b'Car ferries in the skies: The rise and fall of the Aviation Traders Carvair',2021-04-07T00:22:13Z
0.85 (b'Car ferries in the skies; fall; )

"b""Why China's space program could overtake NASA""",2021-04-01T21:08:46Z
0.95 (China's space program; could overtake; NASA)

"b""Utah Jazz 'shaken, but unharmed' after team plane forced into emergency landing after bird strike""",2021-03-31T09:04:25Z
0.90 (team plane; forced; into emergency landing after bird strike)
0.96 (b " " Utah Jazz; shaken; T:after team plane forced into emergency landing after bird strike)

b'Southwest just placed the biggest Boeing 737 Max order since it was grounded',2021-03-29T13:12:26Z
0.45 (it; was grounded; T:2021-03-29T13:12:26Z)
0.92 (b'Southwest; placed; the biggest Boeing 737 Max order)

"b""Trump's presidency was a disaster for his business""",2021-03-23T01:01:07Z
0.91 (Trump's presidency; was; a disaster for his business)

"b""Glory days of Trump's gold-plated 757 seem far away as plane sits idle at a sleepy airport""",2021-03-19T20:11:07Z
0.90 (plane; sits; at a sleepy airport)
0.90 (Glory days of Trump's gold-plated 757; seem; L:far away)

"b""1 engine broken, the other wrapped. This is the current state of Trump's 757""",2021-03-20T01:32:50Z
0.69 Context(This is,List([40, 47))):(1 engine; broken; )
0.40 (This; is; the current state of)
0.28 (the other; wrapped; )

b'Before Air Force One there was Train Car One',2021-03-17T10:44:52Z

b'NASA astronauts conduct fifth spacewalk of 2021',2021-03-13T13:17:04Z
0.93 (b'NASA astronauts; conduct; fifth spacewalk of 2021)

b'The greatest airplane beds in the sky',2021-03-12T10:25:39Z

b'The 737 Max crisis costs continues to climb two years after the second fatal crash',2021-03-10T22:13:27Z
0.93 (b'The 737 Max crisis costs; to climb; T:two years; T:after the second fatal crash)
0.83 (b'The 737 Max crisis costs; continues; )

"b'Two years after a global grounding, airlines are quickly bringing 737 Max jets back into service'",2021-03-09T18:43:43Z
1.00 (airlines; are bringing; 737 max jets)
0.95 (airlines; are quickly bringing; 737 Max jets; back into service; T:b'Two years; T:after a global grounding)

"b'Engine failed on United Airlines flight after pilots increased power, NTSB report says'",2021-03-05T20:12:30Z
0.92 Context(b'Engine failed on United Airlines flight says,List([1, 89))):(b'Engine; failed; on United Airlines flight; after pilots increased power)
0.96 (b'Engine failed on United Airlines flight; says; NTSB report)
0.89 (pilots; increased; power)

b'US and EU agree to suspend tariffs linked to long-running Boeing-Airbus dispute',2021-03-05T19:10:21Z
0.95 Context(EU agree,List([0, 8))):(EU; agree to suspend; tariffs linked to long - running Boeing - Airbus dispute ' , 2021-03-05T19:10:21Z)
0.90 (EU; agree; to suspend tariffs)
0.90 Context(b'US agree,List([0, 10))):(b'US; agree to suspend; tariffs linked to long - running Boeing - Airbus dispute ' , 2021-03-05T19:10:21Z)
0.83 (b'US; agree; to suspend tariffs)
0.71 (tariffs; linked; )

b'US-UK trade truce means cheaper whisky for Americans',2021-03-04T16:59:22Z
0.95 (b'US-UK trade truce; means; cheaper whisky for Americans',2021-03-04T16:59:22Z)

b'The Pan Am flight attendant and the CIA man who fell in love on an airplane',2021-03-03T14:45:46Z
0.94 (the CIA man; fell; in love; on an airplane)

b'Photos from a Pan Am career',2021-03-03T14:35:33Z

"b""Qantas launches 'Mystery Flights' as Australia extends international travel ban""",2021-03-03T03:55:47Z
0.92 (Australia; extends; international travel ban)
0.92 (Qantas; launches; Mystery Flights; T:as Australia extends international travel ban)

"b'5 things to know for March 2: Coronavirus, immigration, SCOTUS, Nigeria, France'",2021-03-02T11:09:15Z
0.50 (things; to know; T:for March 2)

"b'United, predicting a rebound in travel, buys 25 Boeing 737 Max jets'",2021-03-01T18:44:43Z

b'Wreckage from TWA Flight 800 to be destroyed years after explosion',2021-02-27T08:08:33Z
0.94 (b'Wreckage from TWA Flight 800; to be destroyed; T:years after explosion)

b'The Greek airport that was left to fall apart',2020-06-13T08:31:07Z
0.81 (b'The Greek airport; to fall; apart)
0.81 (b'The Greek airport; was left; to fall apart)

"b""Inside Greece's abandoned Hellenikon airport""",2020-06-13T08:19:57Z

"b'CNN 10 - February 26, 2021'",2021-02-25T20:33:05Z

b'FAA met to discuss more frequent engine inspections days before Denver incident',2021-02-24T21:16:28Z
0.92 Context(b'FAA met,List([0, 9))):(b'FAA; met to discuss; more frequent engine inspections days; T:before Denver incident)
0.96 (b'FAA; met; to discuss more frequent engine inspections days before Denver incident',2021-02-24T21:16:28Z)

b'US stocks get back on track',2021-02-23T21:39:06.000Z
0.79 (b'US stocks; get back; )

b'FAA directs air carriers to inspect engines similar to the one that failed on the United Airlines flight',2021-02-24T10:25:47Z
0.90 (the one; failed; on the United Airlines flight)
0.90 (air carriers; to inspect; engines similar to the one)

"b""Investigators release preliminary findings on the United Airlines flight engine failure. Here's what we know""",2021-02-23T07:58:02Z
0.20 Context(Here 's,List([93, 99))):(we; know; )
0.89 Context(Here 's,List([93, 99))):(Investigators; release; preliminary findings on the United Airlines flight engine failure)
0.41 (Here; 's; what we know)

"b'Engine on United Airlines flight was showing signs of metal fatigue, NTSB says'",2021-02-22T07:39:48Z
0.63 (NTSB; says; )
0.94 (b'Engine on United Airlines flight; was showing; signs of metal fatigue)

"b""'Sully': It's very rare to hear someone say 'Mayday' on the radio""",2021-02-23T02:23:24Z

"b'CNN 10 - February 23, 2021'",2021-02-23T01:32:12Z

b'CNN10 - 2/23/21',2021-02-23T01:31:39Z

b'Airlines ground dozens of Boeing 777 planes after engine failure over Denver',2021-02-21T23:53:22Z

b'Boeing recommends grounding some 777 planes after engine failure',2021-02-22T22:38:29Z
0.90 Context(b'Boeing recommends,List([0, 19))):(b'Boeing; recommends grounding; some 777 planes; T:after engine failure)
0.90 (b'Boeing; recommends; grounding some 777 planes after engine failure)

"b""The 737 Max is no longer Boeing's biggest problem, after yet another safety grounding""",2021-02-22T19:37:11Z
0.96 (The 737 Max; is; no longer Boeing's biggest problem)

b'Another safety scare is the last thing Boeing needs',2021-02-22T13:24:40Z
0.78 (the last thing; needs; Boeing)
0.94 (b'Another safety scare; is; the last thing Boeing needs')

b'Another United Airlines flight experienced a right engine failure in 2018',2021-02-22T16:45:31Z
0.94 (b'Another United Airlines flight; experienced; a right engine failure; T:in 2018)

b'Dozens of Boeing 777 planes grounded after engine failure',2021-02-22T16:01:23Z
0.94 (b'Dozens of Boeing 777 planes; grounded; T:after engine failure)

b'Pilot: What happens in an emergency like United 328',2021-02-22T06:36:24Z

"b""How United Airlines passengers reacted when the plane's engine exploded midair""",2021-02-21T15:51:02Z
0.93 (United Airlines passengers; reacted; T:when the plane's engine exploded midair)

b'United Airlines pulls Boeing 777s following engine fire',2021-02-22T13:03:27Z
0.95 (b'United Airlines; pulls; Boeing 777; s following engine fire)

"b'5 things to know for February 22: Covid-19, Texas, White House, United, Iran'",2021-02-22T11:17:14Z
0.50 (things; to know; T:for February 22)

"b""Cargo plane's engine catches fire, dropping debris that injures two people in a Dutch town""",2021-02-21T19:10:34Z
0.88 (debris; injures; two people; L:in a Dutch town)
0.94 (Cargo plane's engine; catches; fire; dropping debris)

b'Commercial Passenger Airplane Crashes Fast Facts',2013-07-09T18:34:23Z
1.00 (b'Commercial Passenger Airplane; Crashes; 2013 -07 -09t18:34:23z)
0.93 (b'Commercial Passenger Airplane; Crashes; Fast Facts')

"b'United Airlines flight suffers engine failure, sending debris falling on neighborhoods outside Denver'",2021-02-20T21:44:29Z
0.87 Context(b'United Airlines flight suffers,List([1, 33))):(b'United Airlines flight; suffers engine failure sending; debris)
0.95 (b'United Airlines flight; suffers; engine failure; sending debris falling on neighborhoods outside Denver'",2021-02-20T21:44:29Z)

"b""Why Gadhafi's private jet is gathering dust on a French airfield""",2021-02-19T13:05:06Z
0.94 (Gadhafi's private jet; is gathering; dust; L:on a French airfield)

"b""For once, America's polarizing extremities are not limited to its politics""",2021-02-16T22:52:01Z
0.94 (America's polarizing extremities; are not limited; to its politics; T:For once)

"b""Inside the new President's routine: Oval Office fires and early bedtimes""",2021-02-15T18:56:21Z

b'South Carolina Republican Tom Rice faces down impeachment backlash in pro-Trump US House district',2021-02-15T11:00:42Z
0.95 (b'South Carolina Republican Tom Rice; faces; down; impeachment backlash in pro-Trump US House district)

b'Why this will be the hottest airplane seat in 2021',2021-02-15T11:34:24Z
0.38 (this; will be; the hottest airplane seat in 2021)

"b'Learjet, once the go-to private plane for celebrities, is ending production'",2021-02-11T19:11:06Z

"b'Indonesia plane crash had engine thrust imbalance, preliminary report finds'",2021-02-11T03:39:04Z
0.94 Context(preliminary report finds,List([54, 78))):(b'Indonesia plane crash; had; engine thrust imbalance)
0.74 (preliminary report; finds; )

b'SpaceX just got a big contract to launch two pieces of a future Moon space station',2021-02-10T22:33:10Z
0.85 Context(b'SpaceX got,List([0, 17))):(b'SpaceX; got to launch; two pieces of a future Moon space station)
0.95 (b'SpaceX; got; a big contract to launch two pieces of a future Moon space station')

b'US considers Covid-19 testing requirement for domestic air travel',2021-02-08T23:52:12Z
1.00 (b'US; considers; -19 testing requirement)
0.88 (b'US; considers; Covid-19 testing requirement for domestic air travel)

"b'Boeing delivers 26 planes in January, including 21 of the 737 Max'",2021-02-09T16:00:55Z
0.59 (b'Boeing; delivers; 26 planes; T:in January)

b'Libya Fast Facts',2013-09-20T17:06:55Z
0.16 (b'Libya Facts; have fastness of; 2013 -09 -20t17:06:55z)

b'The Dow has its biggest loss since October',2021-01-26T16:43:38.325Z
0.18 (b'The Dow; has biggest loss of; 2021 -01 -26t16:43:38.325z)
0.92 (b'The Dow; has; its biggest loss since October)

"b'Facing back-to-back crises, Boeing posts a record loss'",2021-01-27T12:57:07Z
0.94 (Boeing; posts; a record loss)

b'Tech earnings could supercharge a greedy stock market',2021-01-27T12:47:18Z
0.90 (b'Tech earnings; could supercharge; a greedy stock market)

b'The latest on the Biden presidency and Trump impeachment trial',2021-01-22T20:54:11.374Z

"b""CEOs stepped up during the Trump era. They're not off the hook""",2021-01-24T13:34:13Z
0.62 (They; 're not; off the hook)
0.93 (b""CEOs; stepped up; T:during the Trump era)

"b""Biden's first full day in office""",2021-01-20T16:16:17.161Z

"b""Buttigieg eyes more mask restrictions on 'all modes of transportation'""",2021-01-21T11:06:02Z

"b'The President might want Trump World, but he needs a real library'",2021-01-19T03:02:50Z
0.94 (b'The President; might want; Trump World)
0.45 (he; needs; a real library)

b'Watch this rocket launch from the wing of a jumbo jet',2021-01-18T16:41:27Z

"b'Virgin Orbit launches rocket off a 747 aircraft, puts nine satellites in space'",2021-01-17T22:50:39Z
0.93 (Orbit; puts; nine satellites; in space)
0.92 (Orbit; launches; rocket)

"b""Test fire of NASA's SLS moon rocket ends prematurely""",2021-01-17T01:25:59Z
0.88 (b""Test fire of NASA's SLS moon rocket; ends; L:prematurely)

"b""Don't ignore this headline: The pandemic is getting worse. What happens next is up to you""",2021-01-15T05:42:30Z
0.51 (What happens next; is; up to you)
0.77 (The pandemic; is getting; worse)
0.79 (b; Do n't ignore; this headline: The pandemic is getting worse)

"b""Xiaomi and other Chinese companies slapped with US restrictions as Trump's term winds down""",2021-01-15T04:12:32Z
0.93 (other Chinese companies; slapped; with US restrictions as Trump 's term; winds; down)
0.91 (b " " Xiaomi slapped with US restrictions as Trump 's term; winds down; )
0.82 (b; slapped; with US restrictions as Trump 's term)

b'Boeing reports strong end to its worst year in decades',2021-01-12T16:00:20Z

b'Indonesian search team recovers black box at Sriwijaya plane crash site',2021-01-12T11:19:38Z
0.93 (b'Indonesian search team; recovers; black box; at Sriwijaya plane crash site)

"b'A pregnant mother, a family of five and a father on a business trip among the victims of Sriwijaya Air crash'",2021-01-10T14:43:38Z
0.50 (b'A pregnant mother; [is] a family of; five)

b'Black boxes located at Indonesian airliner crash site as human remains recovered',2021-01-10T13:00:18Z
0.83 (b'Black boxes located at Indonesian airliner crash site as human; recovered; )
0.96 (b'Black boxes located at Indonesian airliner crash site as human; remains; recovered',2021-01-10T13:00:18Z)
0.90 (b'Black boxes; located; L:at Indonesian airliner crash site)

"b""All-women Indian pilot crew make history by completing country's longest commercial flight""",2021-01-12T01:47:25Z
0.89 Context(Indian pilot crew make,List([14, 36))):(Indian pilot crew; make history by completing; country's longest commercial flight)
0.89 (Indian pilot crew; make; history)

"b'5 things to know for January 11: Capitol riot, Covid, transition, Indonesia, Honduras'",2021-01-11T11:35:14Z

b'Human remains pulled from the Indonesian Sriwijaya Air crash site',2021-01-10T03:08:20Z
0.92 (b'Human; pulled; from the Indonesian Sriwijaya Air crash site)
0.93 (b'Human; remains; pulled from the Indonesian Sriwijaya Air crash site)

b'Indonesian jetliner with 62 passengers crashes after taking off from Jakarta',2021-01-09T11:12:54Z
0.41 (b'Indonesian jetliner; has [number of] passengers crashes; 62  after)

b'Flying in Indonesia is a necessity to travel ... but it can also be a terrifying experience',2021-01-10T08:09:14Z
0.35 (it; can be; a terrifying experience)
0.95 (b'Flying in Indonesia; is; a necessity to travel)

"b'As Biden raises money for his virtual inauguration, lobbyists prepare for a scaled-down schmooze-fest'",2021-01-09T15:00:57Z
0.84 Context(b'As Biden raises money for his virtual inauguration prepare,List([1, 72))):(b'As Biden; raises; money; for his virtual inauguration)
0.74 (b'As Biden raises money for his virtual inauguration; prepare; for a scaled-down schmooze-fest')

b'Indonesia searches for missing airliner',2021-01-09T13:08:05.020Z
0.92 (b'Indonesia; searches; for missing airliner)

b'Boeing agrees to pay $2.5 billion to settle charges it defrauded FAA on 737 Max',2021-01-07T22:44:48Z
0.85 Context(b'Boeing agrees to pay,List([0, 22))):(b'Boeing; agrees to pay $2.5 billion to settle; charges it defrauded FAA on 737 Max)
0.85 Context(b'Boeing agrees,List([0, 15))):(b'Boeing; agrees to pay; $2.5 billion; to settle charges it defrauded FAA on 737 Max)
0.90 (b'Boeing; agrees; to pay $2.5 billion to settle charges it defrauded FAA on 737 Max',2021-01-07T22:44:48Z)
0.50 (it; defrauded; FAA; on 737 Max)

"b'5 things to know for January 8: Capitol riot, White House, Covid-19, Iran, Boeing'",2021-01-08T11:18:03Z
0.50 (things; to know; T:for January 8)

"b""Recycling an airplane: What's scrapped when an aircraft retires?""",2021-01-07T01:12:30Z
0.73 (an aircraft; retires; )

"b'Welcome back to work, everything is broken'",2021-01-05T01:06:27Z
0.71 (everything; is broken; )

b'Dow tumbles on first trading day of 2021',2021-01-04T17:04:44Z
0.86 (b'Dow; tumbles; T:on first trading day of 2021)

b'Nikki Haley Fast Facts',2017-08-28T21:31:12Z

"b""Boeing's troubled 737 Max is back in the air after nearly two years""",2020-12-29T16:37:22Z
0.39 ('s troubled 737 Max; is back in; the air)
0.96 (Boeing's troubled 737 Max; is; back in the air; T:after nearly two years)

"b""Boeing's 737 Max returns to commercial service""",2020-12-29T20:43:42Z
0.94 (Boeing's 737 Max; returns; to commercial service)

"b'One more push for $2,000 stimulus checks'",2020-12-29T12:17:10Z

b'The 737 Max is about to fly in the US again',2020-12-28T17:34:41Z
0.93 (b'The 737 Max; to fly; L:in the US; T:again; 2020-12-28T17:34:41Z)
0.97 (b'The 737 Max; is; about to fly in the US again',2020-12-28T17:34:41Z)

"b""Boeing 737: How world's most successful airplane became its most troubled""",2020-12-25T10:17:28Z
0.87 (world's most successful airplane; became; its most troubled)

"b""Boeing 737: A photo history of the world's most successful airplane""",2020-12-25T10:13:47Z

b'December 23 coronavirus news',2020-12-22T21:11:34.036Z

b'Lufthansa airlifts fresh food to England as UK border chaos continues',2020-12-23T11:07:39Z
0.80 (UK border chaos; continues; )

b'How to bring an airplane out of hibernation',2020-12-23T11:59:20Z
0.86 (b'How; to bring; an airplane; out of hibernation)

b'Pan Am Flight 103 Fast Facts',2013-09-26T21:35:16Z

b'Pan Am Boeing 377: The luxury airplane with beds in overhead compartments',2020-12-22T14:18:39Z

b'US announces new criminal charges in Pan Am terrorist bombing',2020-12-20T21:58:04Z
0.86 (b'US; announces; new criminal charges)

b'2020 is when private spaceflight just got started. In 2021 it will shoot for the stars',2020-12-21T16:29:20Z
0.60 (it; will shoot; for the stars',2020-12-21T16:29:20Z; T:In 2021)
0.70 (private spaceflight; got started; )
0.79 (private spaceflight; got; started)
0.94 (b'2020; is; when private spaceflight just got started)

b'Terrorism and War-Related Airplane Crashes Fast Facts',2016-03-24T17:35:39Z

b'Why we started an airline during a pandemic',2020-12-16T14:11:44Z
0.45 (we; started; an airline; T:during a pandemic)

b'Virgin Orbit halts test flights as Covid-19 cases surge',2020-12-14T18:37:26Z
0.97 (b'Virgin Orbit; halts; test flights as Covid-19 cases surge',2020-12-14T18:37:26Z)

b'Man was taken into custody after he climbed onto the wing of an airplane preparing to takeoff in Las Vegas',2020-12-13T02:35:51Z
0.92 (an airplane; preparing; to takeoff in Las Vegas)
0.45 (he; climbed; onto the wing of an airplane)
0.76 (b'Man; was taken; into custody; T:after he climbed onto the wing of an airplane)

b'The global effort to move Covid-19 vaccines has begun',2020-12-13T14:01:27Z
1.00 (b'The global effort move; has begun; 2020 -12 -13t14:01:27z)
0.88 (b'The global effort to move Covid-19 vaccines; has begun; )

"b""LEGO won't make modern war machines, but others are picking up the pieces""",2020-12-13T00:11:32Z
0.89 (others; are picking up; the pieces)

"b""Space X's Mars prototype rocket exploded yesterday. Here's what happened on the flight""",2020-12-10T21:19:40Z
0.94 Context(Here 's,List([56, 62))):(Space X's Mars prototype rocket; exploded; T:yesterday)
0.56 (Here; 's; what happened on the flight)

b'China flight attendants advised to wear diapers for Covid protection',2020-12-10T10:46:35Z
0.93 Context(b'China flight attendants advised,List([0, 33))):(b'China flight attendants; advised to wear; diapers; for Covid protection)
0.93 (b'China flight attendants; advised; to wear diapers for Covid protection)

"b""Thieves burglarize Russia's nuclear war 'doomsday' plane""",2020-12-09T16:26:38Z
0.93 (b""Thieves; burglarize; Russia's nuclear war)

"b""The internet has sticker shock over Apple's new headphones""",2020-12-09T01:15:10Z
0.94 (The internet; has; sticker shock over Apple's new headphones)

b'Super Guppy: The huge weird airplane built to carry spacecraft',2020-12-09T10:43:11Z
0.92 (The huge weird airplane; built; to carry spacecraft)

"b""Boeing set to deliver first 737 Max since plane's grounding""",2020-12-08T16:34:59Z
0.92 Context(Boeing set,List([4, 14))):(Boeing; set to deliver; T:first; 737 Max; T:since plane's grounding)
0.94 (Boeing; set; to deliver first 737 Max since plane's grounding)

b'Brazilian airline GOL will resume Boeing 737 Max passenger flights on Wednesday',2020-12-08T03:07:43Z
1.00 (b'Brazilian airline GOL; will resume; 737 max passenger flights)
0.94 (b'Brazilian airline GOL; will resume; Boeing 737 Max passenger flights; T:on Wednesday)

b'Human Spaceflight Fast Facts',2013-07-01T17:13:41Z

b'Post-crash recovery: How one airline plans to restore confidence in the Boeing 737 MAX',2020-12-03T06:01:09Z
0.90 Context(one airline plans,List([27, 44))):(one airline; plans to restore; confidence in the Boeing 737 MAX)
0.92 (one airline; plans; to restore confidence in the Boeing 737 MAX)

b'The Boeing 737 MAX is back in the air after fatal crashes',2020-12-05T23:33:04Z
0.89 (b'The Boeing 737 MAX; is back in; the air)
0.95 (b'The Boeing 737 MAX; is; back in the air; T:after fatal crashes)

b'Airline bids farewell to its jumbo jets by inviting fans for a business class lunch',2020-12-04T17:36:44Z
0.87 (b'Airline bids; farewell; to its jumbo jets)

"b""Ryanair is buying 75 more 737 Max jets, Boeing's biggest order since the grounding""",2020-12-03T17:37:44Z
1.00 (Ryanair; is buying; 75 more 737 max jets)
0.93 (Ryanair; is buying; 75 more 737 Max jets)

b'International Space Station Fast Facts',2013-10-22T14:26:28Z

b'Smaller long-haul planes are the future of flying -- but also its past',2020-11-27T09:34:02Z
0.95 (b'Smaller long - haul planes; are; the future of , 2020-11-27T09:34:02Z)
0.90 (b'Smaller long - haul planes; are; the future of its past)
0.94 (b'Smaller long - haul planes; are; the future of flying)

"b'This global airline has no passengers, no cargo and flies just one way'",2020-12-01T11:13:10Z
0.93 (b'This global airline; has; no passengers)

b'November 30 coronavirus news',2020-11-29T17:59:47.797Z

"b""Now there's another problem for aviation: wasps""",2020-11-30T11:10:23Z

"b""Now there's another problem for aviation: wasps""",2020-11-30T10:35:27Z

"b""Boeing needs China to approve the 737 Max. But that won't end its epic sales drought""",2020-11-20T10:47:23Z

"b'British Airways is selling off its in-flight items, from champagne flutes to socks'",2020-11-23T16:17:54Z
0.87 (b'British Airways; is selling off; its in-flight items; from champagne flutes to socks')

b'What you need to know before you fly on a Boeing 737 MAX',2020-11-21T09:35:03Z
0.27 Context(you need,List([7, 15))):(you; need to know to know; )
0.31 (you; need; to know)
0.72 (you; fly; L:on a Boeing 737 MAX)

b'The week in 42 photos',2020-11-20T03:30:31Z

"b""What a vaccine means for assets that aren't stocks""",2020-11-19T13:21:48Z
0.88 (assets; are n't; stocks)
0.90 (a vaccine; means; for assets)

b'US stocks close lower',2020-11-17T12:25:52.652Z
0.79 (b'US stocks; close lower; )

"b""Boeing's 737 Max gets approval to fly passengers again""",2020-11-18T12:07:21Z
0.95 (Boeing's 737 Max; gets; approval to fly passengers again"")

"b""Boeing's 737 Max cleared to fly again""",2020-11-18T14:42:26Z

"b""A 'Covid-free' flight just landed in London. CNN's Richard Quest was on board""",2020-11-17T19:55:47Z
0.95 (CNN's Richard Quest; was; on board)
0.82 (flight; landed; L:in London)

"b""Boeing's 737 Max debacle could be the most expensive corporate blunder ever""",2020-11-17T18:06:24Z
0.94 (Boeing's 737 Max debacle; could be; the most expensive corporate blunder ever)

b'Alaska Airlines flight hits bear on runway during landing',2020-11-16T22:04:59Z
0.94 (b'Alaska Airlines flight hits; bear; L:on runway; T:during landing)

b'SpaceX launch: Four astronauts take off aboard Crew Dragon bound for ISS',2020-11-16T00:47:42Z
0.94 (Crew Dragon; bound; for ISS)
0.92 (Four astronauts; take off; L:aboard Crew Dragon; 2020-11-16T00:47:42Z)

"b""What the 737 MAX's return to the sky will mean for passengers""",2020-11-13T13:26:17Z
0.96 (the 737 MAX's return to the sky; will mean; for passengers)

b'Boeing issues surprisingly upbeat outlook for Chinese aircraft demand',2020-11-12T16:48:54Z

"b""Stocks will soar in Joe Biden's first year in office, Goldman Sachs predicts""",2020-11-10T14:32:35.159Z
0.81 Context(Goldman Sachs predicts,List([58, 80))):(Stocks; will soar; T:in Joe Biden's first year in office)
0.75 (Goldman Sachs; predicts; )

"b""The 737 Max is set to fly again soon. But Boeing's struggle is far from over""",2020-11-10T21:13:45Z
0.79 Context(Boeing 's struggle is,List([46, 66))):(The 737 Max; is set; to fly again soon)
0.83 (Boeing's struggle; is; far from over)
0.81 (The 737 Max; to fly; T:again; T:soon)

b'These charts show the jobs recovery is far from complete',2020-11-10T12:26:29Z
0.79 Context(b'These charts show,List([0, 19))):(the jobs recovery; is; far from complete)
0.94 (b'These charts; show; the jobs recovery is far from complete',2020-11-10T12:26:29Z)

"b""What it's like to be on vacation in a country on lockdown""",2020-11-10T11:25:52Z
0.28 (it; 's; like)

"b'Europe just hit the US with $4 billion in new tariffs, but Biden could reduce tensions'",2020-11-09T16:39:00Z
1.00 (b'Europe; hit; 2020 -11 -09t16:39:00z)
0.93 (b'Europe; hit; 2020-11-09T16:39:00Z)
0.90 Context(b'Europe hit,List([2, 19))):(Biden; could reduce; tensions ')
0.92 (b'Europe; hit; Biden could reduce tensions ')
0.94 (b'Europe; hit; the US; with $ 4 billion in new tariffs)

"b""Berlin Tegel: Farewell to the airport that wouldn't die""",2020-10-24T08:33:13Z
0.70 (the airport; would n't die; )

b'Senate and House election results 2020',2020-10-30T16:32:47.270Z
0.79 (House election; results; )

b'The Nasdaq is skyrocketing. That may not be a great sign for the economy',2020-11-04T18:23:25Z

b'Must-watch videos of the week',2019-05-17T19:30:48Z

"b""Six 747s flew into a Dutch airport -- but then couldn't leave""",2020-11-02T12:36:24Z
0.95 (b " " Six 747 s; flew; into a Dutch airport)

b'How the US election might determine the future of travel',2020-11-02T09:59:11Z

b'More than 600 dogs and cats are airlifted out of Hawaii to be put up for adoption on the US mainland',2020-10-31T05:15:22Z
0.82 (cats; to be put up; for adoption on the US mainland)
0.84 (cats; are airlifted; out of Hawaii)
