0.88 (Billionaires like Bloomberg; make; our country better)

"New Jersey just raised its threat level for white supremacists to 'high,' well above ISIS and al Qaeda",2020-02-22T00:27:41Z
0.85 (New Jersey; raised; its threat level)

Contigo recalls nearly 6 million of its kids water bottles due to a choking hazard. Again.,2020-02-20T13:17:38Z
1.00 (Contigo; recalls; nearly 6 million)
0.91 (Contigo; recalls Again 2020-02-20T13:17:38Z; nearly 6 million of its kids water bottles due to a choking hazard)

Gun control group Everytown to spend $8 million on Texas races,2020-02-19T20:55:13Z

Deer Pong brings family fun for under 20 bucks,2020-02-19T14:00:33Z
0.94 (Deer Pong; brings; family fun; for under 20 bucks; T:2020-02-19T14:00:33Z)

Blue Apron may be up for sale as losses mount,2020-02-18T15:53:44Z
0.71 (losses; mount; )
0.92 (Blue Apron; may be 2020-02-18T15:53:44Z; up for sale)

Apple's coronavirus warning was a foreshock for earnings. But investors shouldn't freak out just yet,2020-02-18T20:46:39Z
0.91 (investors; should n't freak out; T:just yet; 2020-02-18T20:46:39Z)
0.95 (Apple 's coronavirus warning; was; a foreshock for earnings)

Jeff Bezos commits $10 billion to fight climate change,2020-02-17T21:00:14Z
1.00 (Jeff Bezos; commits; $ 10 billion)
0.93 (Jeff Bezos; commits; $10 billion to fight climate change)

Apple's coronavirus warning just shaved $34 billion off its stock market value,2020-02-18T12:06:54Z
1.00 (Apple 's coronavirus warning; shaved; $ 34 billion)
0.88 (Apple's coronavirus warning; shaved; $34 billion; off its stock market value)

Walmart's holiday season 'wasn't as good as expected',2020-02-18T11:50:23Z
0.82 (Walmart's holiday season; was n't 2020-02-18T11:50:23Z; as good as expected)

Pier 1 files for bankruptcy,2020-02-17T18:13:10Z

"Pick up a new, marked-down appliance at these Presidents Day sales",2020-02-15T05:24:30Z

The best Presidents Day sales: 150+ deals to shop today,2020-02-17T20:07:25Z
0.90 (150+ deals; to shop; T:today)

Quickly catch up on the day's news,2020-02-17T18:16:31Z

The best Presidents Day sales: 150+ deals to shop today,2020-02-16T16:30:09Z
0.90 (150+ deals; to shop; T:today)

A police officer working security at Walmart tried to stop a shoplifter. He was shot multiple times,2020-02-17T06:59:54Z
0.94 Context(A police officer working security at Walmart tried He was shot,List([0, 84))):(A police officer working security at Walmart; tried to stop; a shoplifter)
0.94 Context(He was shot,List([73, 84))):(A police officer working security at Walmart; tried; to stop a shoplifter)
0.40 (He; was shot; T:multiple times)
0.75 (A police officer; working; )

Why stocks keep moving higher. And higher. And higher.,2020-02-16T15:23:31Z
0.56 (stocks; moving; higher)
0.60 (stocks; keep 2020-02-16T15:23:31Z; moving higher)

Save on a new mattress with these Presidents Day deals,2020-02-15T05:21:41Z
0.16 (a mattress with these Presidents Day deals; have age of; 2020 -02 -15t05:21:41z)

The best Presidents Day sales to shop this weekend,2020-02-15T05:13:35Z
0.94 (The best Presidents Day sales; to shop; T:this weekend)

Settle in with these weekend reads,2020-02-14T21:05:18Z

New Hampshire man charged with slapping 15-year-old Trump supporter outside polling station,2020-02-14T03:59:05Z
0.93 (New Hampshire man; with slapping; 15-year-old Trump supporter; L:outside polling station)
0.96 (New Hampshire man; charged; with slapping 15-year-old Trump supporter outside polling station)

Germany's economy has flatlined. The coronavirus could push it into recession,2020-02-14T12:11:22Z
0.80 Context(Germany 's economy has flatlined,List([0, 31))):(The coronavirus; could push; it; into recession)
0.83 (Germany's economy; has flatlined; The coronavirus could push it into recession)

"Use Amazon, Uber or Walmart.com? You've probably signed away your right to sue them",2020-02-13T19:05:26Z
0.41 (You; 've signed; away; your right to sue them; 2020-02-13T19:05:26Z)

Attorneys for El Paso Walmart shooting suspect entered a not guilty plea in response to federal charges,2020-02-13T02:50:11Z
0.95 (Attorneys for El Paso Walmart shooting suspect; entered; a not guilty plea; in response to federal charges)
0.93 (El Paso Walmart; shooting; suspect)

This pricey drink was sold by text message. Now it's hitting Walmart shelves,2020-02-12T19:27:42Z
0.64 (it; 's hitting; Walmart shelves; T:Now)
0.87 (This pricey drink; was sold; by text message; Now it's hitting Walmart shelves,2020-02-12T19:27:42Z)

All the sweet Valentine's Day deals to shop now,2020-02-10T20:43:33Z
0.96 (All the sweet Valentine's Day deals; to shop; T:now; T:2020-02-10T20:43:33Z)

"Move over, kale: Mushrooms are the new grocery aisle celebrities",2020-02-12T15:01:07Z
0.89 (Mushrooms; are; the new grocery aisle celebrities)

'Frozen' and 'Star Wars' rescued Hasbro during the holidays,2020-02-11T13:03:10Z
0.93 (Star Wars; rescued; Hasbro; T:during the holidays)
0.55 (Frozen; rescued; Hasbro; T:during the holidays)

"JD.com is hiring 20,000 people who can't work because of the coronavirus",2020-02-12T09:29:49Z
0.89 (20,000 people; ca n't work; because of the coronavirus)
0.50 (JD.com; is hiring; 20,000 people who can't work because of the coronavirus)

Report: Man tells police he targeted Trump campaign volunteers because he does not like the President,2020-02-11T23:16:03Z
0.29 Context(Man tells,List([8, 17))):(he; targeted; Trump campaign volunteers; because he does not like the President)
0.80 (Man; tells; police; he targeted Trump campaign volunteers)
0.50 (he; does not like; the President)

Two police officers were shot and a suspect is dead in a Walmart shooting in Arkansas,2020-02-10T17:34:54Z
0.94 (a suspect; is; dead; L:in a Walmart shooting in Arkansas)
0.75 (Two police officers; were shot; )

Mayor on Walmart shooting: Many lives were saved today,2020-02-10T20:11:29Z
0.88 Context(Mayor on Walmart shooting,List([0, 25))):(Many lives; were saved; T:today)
0.90 (Mayor on Walmart; shooting; Many lives were saved today)

Louisiana man pleads guilty to setting fire to three black churches,2020-02-10T19:53:23Z
0.87 Context(Louisiana man pleads,List([0, 20))):(Louisiana man; pleads to setting; fire; to three black churches)
0.91 (Louisiana man; pleads; guilty to setting fire to three black churches)

Thinking of buying an Instant Pot? Start here,2020-02-10T19:59:39Z

Quickly catch up on the day's news,2020-02-10T18:45:44Z

Police investigating whether Trump campaign volunteers were targeted in van incident,2020-02-09T03:48:59Z
0.93 Context(Police investigating,List([0, 20))):(Trump campaign volunteers; were targeted; T:in van incident)
0.89 (Police; investigating; whether Trump campaign volunteers were targeted in van incident)

Coronavirus fears lead to worldwide mask shortages,2020-02-07T15:37:59Z
0.90 (Coronavirus fears; lead; to worldwide mask shortages)

How a beloved organic grocery chain collapsed,2020-02-07T11:23:50Z
1.00 (a beloved organic grocery chain; collapsed; 2020 -02 -07t11:23:50z)
0.79 (a beloved organic grocery chain; collapsed; )

The suspect in the El Paso Walmart shooting is now facing federal hate crime charges,2020-02-06T23:48:23Z
0.96 (The suspect in the El Paso Walmart shooting; is facing; federal hate crime charges; T:now)

US clears the way for this self-driving vehicle with no steering wheel or pedals,2020-02-06T23:43:16Z
0.90 (US; clears; the way; for this self-driving vehicle with no steering wheel or pedals)

Former prison employee who helped murderers escape upstate New York prison has been released,2020-02-06T15:26:52Z
0.89 Context(Former prison employee helped,List([0, 33))):(murderers; escape; upstate New York prison)
0.89 (Former prison employee; helped; murderers escape upstate New York prison)
0.90 (Former prison employee who helped murderers escape upstate New York prison; has been released; )

Bernie Sanders raised massive $25 million in the month of January,2020-02-06T11:00:22Z
1.00 (Bernie Sanders; raised; $ 25 million)
0.94 (Bernie Sanders; raised; massive $25 million in the month of January)

Investors are shrugging off coronavirus. Businesses aren't,2020-02-06T12:18:55Z
0.89 (Businesses; are n't; 2020-02-06T12:18:55Z)
0.89 (Investors; are shrugging off; coronavirus)

Exxon's market value has crumbled by $184 billion,2020-02-05T19:25:35Z
0.82 (Exxon's market value; has crumbled; )

Macy's just dealt a big blow to the struggling American mall,2020-02-05T18:07:34Z
0.16 (the struggling mall; has America of; 2020 -02 -05t18:07:34z)
0.91 (Macy's; dealt; a big blow; to the struggling American mall)

Best Buy decides to keep its CEO following misconduct investigation,2020-02-04T21:59:39Z
0.83 Context(Buy decides,List([5, 16))):(Buy; decides to keep; its CEO; T:following misconduct investigation)
0.83 (Buy; decides; to keep its CEO following misconduct investigation)

Veronica Escobar: Texas congresswoman giving Democrats' Spanish rebuttal to Trump speech,2020-02-04T11:02:45Z
0.94 (Texas congresswoman; giving; Democrats' Spanish rebuttal; to Trump speech)

Super Bowl commercials: Who scored and who fumbled on the ad industry's biggest stage,2020-02-03T04:32:33Z
0.16 (the ad industry 's stage; has biggest of; 2020 -02 -03t04:32:33z)
0.92 (Super Bowl commercials; fumbled; on the ad industry 's biggest stage)

Another Whole Foods competitor just bit the dust,2020-02-03T17:22:09Z
0.94 (Another Whole Foods competitor; bit; the dust)

Super Bowl 2020,2020-02-02T22:42:53Z

"Four companies have recalled more than 165,000 infant incline sleepers due to suffocation risk",2020-01-30T00:37:47Z
0.99 (four companies; have recalled; more than 165,000 infant incline sleepers due suffocation risk)
1.00 (Four companies; have recalled; more than 165000 infant incline sleepers)
0.94 (Four companies; have recalled; more than 165,000 infant incline sleepers due to suffocation risk)

Slashing food stamps hurts the poor. It also hurts their supermarkets,2020-01-29T14:02:12Z
0.33 (It; hurts; their supermarkets)
0.83 (Slashing food stamps; hurts; the poor)

Walmart takes a step toward owning the food chain,2020-01-24T15:27:51Z
0.90 Context(Walmart takes,List([0, 13))):(Walmart; takes toward owning 2020-01-24T15:27:51Z; the food chain)
0.90 (Walmart; takes; a step toward owning the food chain,2020-01-24T15:27:51Z)

"Papyrus, another mall staple, is closing all its stores",2020-01-24T13:14:03Z
0.84 (Papyrus; is closing; all its stores)

GrubHub has a solution to its delivery problems: Takeout,2020-01-23T14:01:39Z
0.89 (GrubHub; has; a solution to its delivery problems)

Fairway files for bankruptcy with a plan to keep some stores open,2020-01-23T14:52:16Z

Martin Luther King Jr. Day: What's open and what's closed,2020-01-19T10:08:22Z
0.88 (Jr; [is] Luther King [of]; Martin)

Best Buy opens investigation into allegations of misconduct by CEO,2020-01-17T21:43:55Z
0.94 (Best Buy; opens; investigation; into allegations of misconduct by CEO; T:2020-01-17T21:43:55Z)

Amazon wants to help create a million new jobs in India,2020-01-17T11:53:51Z
0.16 (a million jobs in India; have age of; 2020 -01 -17t11:53:51z)
0.92 Context(Amazon wants to help,List([0, 20))):(Amazon; wants to help create; a million new jobs in India)
0.92 Context(Amazon wants,List([0, 12))):(Amazon; wants to help; create a million new jobs in India)
0.94 (Amazon; wants; to help create a million new jobs in India)

Target had weak holiday sales. Investors better hope it's an outlier,2020-01-16T12:09:12Z
0.46 Context(Investors better hope,List([31, 52))):(it; 's; an outlier)
0.92 Context(Investors better hope,List([31, 52))):(Target; had; weak holiday sales)
0.78 (Investors; better hope; it's an outlier)

Target's holiday season was a letdown. Costco's wasn't,2020-01-15T12:02:20Z
0.94 (Costco's; was n't; 2020-01-15T12:02:20Z)
0.95 (Target's holiday season; was; a letdown)

Jeff Bezos is in India. Amazon has a ton on the line,2020-01-15T11:07:00Z
0.94 Context(Amazon has,List([24, 34))):(Jeff Bezos; is; in India)
0.92 (Amazon; has; a ton on the line)

"A Florida woman tried to build a bomb inside a Walmart using items she didn't pay for, police say",2020-01-15T08:33:20Z
1.00 (police; say; 2020 -01 -15t08:33:20z)
0.79 Context(A Florida woman tried to build a bomb inside a Walmart say,List([1, 98))):(A Florida woman; tried to build a bomb using; items she didn't pay for)
0.93 Context(A Florida woman tried to build a bomb inside a Walmart say,List([1, 98))):(A Florida woman; tried to build; a bomb; L:inside a Walmart)
0.93 Context(A Florida woman tried to build a bomb inside a Walmart say,List([1, 98))):(A Florida woman; tried; to build a bomb inside a Walmart)
0.97 (A Florida woman tried to build a bomb inside a Walmart; say; police)
0.72 (items; did n't pay; for)

Vegan sausages and clever marketing have helped this low-cost chain take over Britain,2020-01-14T05:13:11Z
0.92 Context(clever marketing have helped,List([0, 28))):(this low - cost chain; take over; Britain , 2020-01-14T05:13:11Z)
0.94 (clever marketing; have helped; this low - cost chain take over Britain , 2020-01-14T05:13:11Z)
0.92 Context(Vegan sausages have helped,List([0, 26))):(this low - cost chain; take over; Britain , 2020-01-14T05:13:11Z)
0.95 (Vegan sausages; have helped; this low - cost chain take over Britain , 2020-01-14T05:13:11Z)

Amazon and Flipkart face an antitrust investigation in India,2020-01-14T00:40:36Z
0.16 (an investigation in India; has antitrust of; 2020 -01 -14t00:40:36z)
0.93 (Amazon; face; an antitrust investigation in India)

Milk 2.0: How the dairy industry plans to save milk,2020-01-10T11:52:38Z
0.90 Context(the dairy industry plans,List([14, 38))):(the dairy industry; plans to save; milk; 2020-01-10T11:52:38Z)
0.93 (the dairy industry; plans; to save milk,2020-01-10T11:52:38Z)

The best artificial Christmas trees to buy now,2019-12-03T19:36:02Z
0.95 (The best artificial Christmas trees; to buy; T:now; 2019-12-03T19:36:02Z)

America has turned its back on big department stores,2020-01-09T15:19:09Z
0.86 (America; has turned; its back on big department stores)

Bed Bath & Beyond is in deep trouble. And it could get worse,2020-01-08T22:41:19Z
0.23 (it; could get; worse)
0.95 (Bed Bath & Beyond; is; in deep trouble; 2020-01-08T22:41:19Z)

How markets are reacting to Iran,2020-01-08T11:47:36Z
0.91 (markets; are reacting; to Iran,2020-01-08T11:47:36Z)

Investors are selling oil again. Here's why,2020-01-07T12:03:38Z
0.36 (Here; 's; why)
0.89 (Investors; are selling; oil; T:again)

Amazon's India business is getting an offline boost,2020-01-06T23:46:00Z
0.94 (Amazon's India business; is getting; an offline boost)

SmileDirectClub signs exclusive deal to sell dental care at Walmart,2020-01-06T18:33:42Z

Aldi's UK holiday sales top \xc2\xa31 billion for the first time,2020-01-06T15:53:39Z

Someone released bedbugs in a Pennsylvania Walmart and now police are investigating,2020-01-05T21:41:25Z
1.00 (Someone; released; 2020 -01 -05t21:41:25z)
0.89 (Someone; released; 2020-01-05T21:41:25Z)
0.82 (police; are investigating; T:now)
0.71 (Someone; released; )
0.91 (Someone; released; bedbugs; L:in a Pennsylvania Walmart)

All the New Year's sales you should shop to start 2020 off strong,2020-01-02T20:22:23Z
0.30 Context(you should shop,List([25, 40))):(you; should shop to start; 2020)
0.30 (you; should shop; to start 2020)

Here's what's open and closed New Years Day,2020-01-01T11:48:03Z
0.31 (Here; 's; what 's closed)
0.31 (Here; 's; what 's open)

All the best after-Christmas sales to shop before the new year starts,2019-12-27T18:37:17Z
0.93 (the new year; starts; 2019-12-27T18:37:17Z)

"From licking ice cream to storming Area 51, these 8 stories made 2019 a wild year",2019-12-29T10:14:14Z
0.99 (8 stories; made; a wild year)
1.00 (these 8 stories; made; 2019 a wild year ")
0.96 (these 8 stories; made; 2019 a wild year; T:From licking ice cream to storming Area 51)

Michaels replaces CEO after just two months on the job,2019-12-27T18:35:26Z
0.89 (Michaels; replaces; CEO; T:after just two months on the job)

Amazon has its best holiday season ever,2019-12-26T15:13:21Z
0.18 (Amazon; has best holiday season of; 2019 -12 -26t15:13:21z)
0.89 (Amazon; has; its best holiday season ever)

"5 things to know for December 26:  Israel, typhoon, impeachment, Zambia, Chile fires",2019-12-26T11:16:23Z

A hard-boiled egg recall expands to products sold at Walmart and Trader Joe's following a deadly listeria outbreak,2019-12-25T14:09:48Z
0.93 (Trader Joe's; following; a deadly listeria outbreak)
0.93 (products; sold; L:at Walmart)
0.93 (A hard-boiled egg recall; expands; to products)

The biggest shopping day of the year dwarfed Black Friday and Cyber Monday,2019-12-24T16:06:14Z
0.95 (The biggest shopping day of the year; dwarfed; T:Cyber Monday)
0.95 (The biggest shopping day of the year; dwarfed; Black Friday)

Retail isn't dead. It's just changing,2019-12-24T14:38:01Z
0.14 (It; 's changing; )
0.36 (Retail; is n't; dead)

Police surprised a 4-year-old boy for Christmas after his mother was killed,2019-12-24T13:44:03Z
0.34 (his mother; was killed; )
0.85 (Police; surprised; a 4-year-old boy; T:after his mother was killed,2019-12-24T13:44:03Z)

How stores choose which songs to play,2019-12-24T12:05:55Z
0.87 (stores; choose; which songs to play)

Dollar General isn't doing enough to bring healthy food to low-income Americans,2019-12-20T18:13:51Z
0.96 (Dollar General; is n't doing; enough to bring healthy food to low-income Americans,)

Fake and dangerous kids products are turning up for sale on Amazon,2019-12-20T14:12:50Z
0.93 (dangerous kids products; are turning up; for sale on Amazon)
0.93 (Fake kids products; are turning up; for sale on Amazon)

Still haven't finished your holiday shopping? Here's your last-minute game plan,2019-12-20T19:03:11Z
0.41 (Here; 's; your last-minute game plan)

Democratic debate in Los Angeles,2019-12-19T23:59:13Z
0.16 (debate in Los Angeles; has democracy of; 2019 -12 -19t23:59:13z)

It's time to thank your teachers. Here's what to give them (Hint: skip the mug),2019-12-19T16:40:07Z

"More than 9,300 stores closed in 2019",2019-12-19T10:46:14Z
0.80 (More than 9,300 stores; closed; T:in 2019)

The world's oldest central bank ends its big experiment with interest rates,2019-12-19T11:55:33Z
0.91 (The world's oldest central bank; ends; its big experiment with interest rates)

Target's Brian Cornell is the top CEO of 2019,2019-12-18T15:11:05Z
0.96 (Target's Brian Cornell; is; the top CEO of 2019,2019-12-18T15:11:05Z)

Goldfish crackers launches two new flavors,2019-12-16T11:24:49Z
0.90 (Goldfish crackers; launches; two new flavors)

Bed Bath & Beyond's new CEO just laid off nearly his entire C-Suite,2019-12-17T16:49:42Z
0.83 (Bed Bath & Beyond's new CEO; laid off; nearly his entire C-Suite)

Amazon sellers can't use FedEx Ground for Prime shipments,2019-12-16T23:31:40Z
0.94 (Amazon sellers; ca n't use; FedEx Ground; for Prime shipments)

Dawn says you're washing your dishes wrong,2019-12-17T13:04:50Z
0.41 Context(Dawn says,List([0, 9))):(you; 're washing; your dishes)
0.72 (Dawn; says; you're washing your dishes wrong,2019-12-17T13:04:50Z)

"A host of holiday suggestions, a pageant milestone and therapy chickens!",2019-12-14T05:14:53Z

Walmart is hauling out the holiday decor deals,2019-12-13T18:43:01Z
0.92 (Walmart; is hauling out; the holiday decor deals)

Priyanka Chopra and Nick Jonas are producing a reality wedding series for Amazon,2019-12-12T17:07:20Z
0.94 (Nick Jonas; are producing; a reality wedding series for Amazon)
0.94 (Priyanka Chopra; are producing; a reality wedding series for Amazon)

He's making a killing selling ugly Christmas sweaters,2019-12-12T12:53:17Z
0.34 Context(He 's making,List([0, 11))):(He; 's making selling; ugly Christmas sweaters)
0.44 (He; 's making; a killing selling ugly Christmas sweaters)

"Fleece pullovers are trending, and here are 15 pieces we love",2019-12-09T22:50:57Z
0.83 (15 pieces we love "; have here of; 2019 -12 -09t22:50:57z)
0.97 (15 pieces we love "; are; 2019 -12 -09t22:50:57z)
0.88 (15 pieces; love; we)
0.39 (here; are; 15 pieces we love ")
0.79 (Fleece pullovers; are trending; )

Christmas sweater with Santa and cocaine forces Walmart to apologize,2019-12-09T05:10:22Z
0.77 (Walmart; to apologize; )
0.83 (Christmas sweater with Santa Walmart; to apologize; )

Mochi ice cream is finally having a mainstream moment,2019-12-09T15:30:18Z
0.94 (Mochi ice cream; is having; a mainstream moment; T:finally)

NFL star Khalil Mack pays off 300 holiday layaway accounts at a Walmart in his hometown,2019-12-08T19:17:00Z
0.88 (Khalil Mack; [is] star [of]; NFL)
0.91 (NFL star Khalil Mack; pays off; 300 holiday layaway accounts; L:at a Walmart; L:in his hometown)

A family is putting up 22 angels on a Christmas display for the El Paso Walmart shooting victims,2019-12-07T01:37:39Z
1.00 (A family; is putting; 22 angels)
0.94 (the El Paso Walmart; shooting 2019-12-07T01:37:39Z; victims)
0.95 (A family; is putting up; 22 angels; on a Christmas display for the El Paso Walmart shooting victims,2019-12-07T01:37:39Z)

Retailers are scrambling to find holiday help,2019-12-06T19:44:23Z
0.87 Context(Retailers are scrambling,List([0, 24))):(Retailers; are scrambling to find; holiday help)
0.87 (Retailers; are scrambling; to find holiday help)

He tried to fix Macy's. Now he is the new Tractor Supply CEO,2019-12-05T16:41:48Z
0.38 (2019-12-05T16:41:48Z; [is] new Supply CEO [of]; Tractor)
0.39 Context(He tried he is,List([0, 33))):(He; tried to fix; Macy's)
0.39 Context(he is,List([28, 33))):(He; tried; to fix Macy's)
0.64 (he; is; the new Tractor Supply CEO; T:Now)

Beyond Burgers are coming to Costco,2019-12-05T17:44:32Z

Toxic air and gridlock: India's tech cities are choking on their success,2019-12-03T23:00:25Z
0.89 (India 's tech cities; are choking; on their success)

"The Santa Claus business is booming, even as malls struggle",2019-12-05T19:31:27Z
0.96 (The Santa Claus business; is; booming; even as malls struggle",2019-12-05T19:31:27Z)

"Dollar General is opening 1,000 new stores next year",2019-12-05T16:39:33Z
1.00 (Dollar General; is opening; 1000 new stores next year ")
0.93 (Dollar General; is opening; 1,000 new stores; T:next year)

First on CNN Business: Gun safety advocates grade stores. Walmart got an A; Home Depot got an F,2019-12-04T13:00:50Z
0.96 Context(Walmart got Home Depot got,List([58, 90))):(Gun safety; advocates; grade stores; T:First on CNN Business)
0.92 Context(Home Depot got,List([76, 90))):(Walmart; got; an A)
0.80 (Home Depot; got; )

2019 hasn't been easy and the word of the year proves it,2019-12-03T08:56:59Z
0.87 (the word of the year; proves; it)
0.30 (2019; has n't been; easy)

"Baby Yoda merch has finally landed in a galaxy near you. (Hurry, these will sell out)",2019-12-03T19:57:13Z
0.21 Context(Baby Yoda merch has landed,List([1, 35))):(these; will sell out; )
0.87 (Baby Yoda merch; has landed; L:in a galaxy near you; T:finally)

Deck your halls with our favorite holiday decorations,2019-11-30T13:53:03Z

These Cyber Monday sales are still going on today,2019-12-02T09:28:42Z
0.96 (These Cyber Monday sales; are going on; T:today; T:2019-12-02T09:28:42Z; T:still)

You can get a KitchenAid stand mixer for more than 50% off for Cyber Monday,2019-12-02T13:50:53Z
0.66 (You; can get; a KitchenAid stand mixer; for more than 50% off for Cyber Monday)

"Black Friday broke shopping records, but not at stores",2019-12-02T17:50:09Z
1.00 (Black Friday; broke; 2019 -12 -02t17:50:09z)
0.94 (Black Friday; broke; 2019-12-02T17:50:09Z)
0.93 (Black Friday; broke; shopping records)

All the best Dyson vacuum sales this Cyber Week,2019-11-29T18:30:14Z

AirPods and AirPods Pro back in stock and on sale for Cyber Monday,2019-12-02T01:26:45Z

Cyber Monday 2019: The best early deals to shop now,2019-12-01T08:55:02Z

Black Friday 2019: All the best deals you can still shop today,2019-11-30T08:26:17Z
0.93 (All the best deals; can shop; T:today; T:2019-11-30T08:26:17Z; T:still)

Shop the best Sony PS4 Black Friday deals at Walmart right now,2019-11-30T04:18:25Z

Black Friday 2019: All the best deals you can shop today,2019-11-29T08:00:53Z
0.66 (you; can shop; T:today; 2019-11-29T08:00:53Z)

All the Nintendo Switch and Switch Lite deals to shop this Black Friday,2019-11-28T17:52:11Z
0.96 (All the Nintendo Switch and Switch Lite deals; to shop; this Black Friday,2019-11-28T17:52:11Z)

"For the next 26 days, retailers will be after your wallet",2019-11-29T12:10:04Z
0.91 (retailers; will be; after your wallet; 2019-11-29T12:10:04Z; T:For the next 26 days)

The best things to buy on Black Friday,2019-11-28T20:02:43Z
0.70 (The best things; to buy; T:on Black Friday)

Rampage Killings Fast Facts,2013-09-16T17:47:24Z

Deadliest Mass Shootings in Modern US History Fast Facts,2013-09-16T23:03:06Z
0.16 (Facts; have fastness of; 2013 -09 -16t23:03:06z)

Black Friday 2019: The best deals to start shopping now,2019-11-28T10:11:38Z
0.75 (The best deals; shopping; T:now)
0.91 (The best deals; to start; 2019-11-28T10:11:38Z)

Early deals to shop ahead of Black Friday,2019-11-27T08:03:25Z
0.92 (Early deals; to shop; L:ahead of Black Friday)

Retailers face a Thanksgiving Day decision: Open or closed?,2019-11-27T17:21:02Z
0.91 (Retailers; face; a Thanksgiving Day decision)

How retailers trick your brain into overspending during the holidays,2018-12-18T19:14:53Z
0.87 Context(retailers trick,List([4, 19))):(retailers; trick your brain into overspending; T:during the holidays)
0.82 (retailers; trick; your brain; into overspending; T:during the holidays)

Early deals to shop this Black Friday,2019-11-25T04:50:27Z

"Hasbro really, really needs you to buy 'Frozen 2' and 'Star Wars' toys this holiday season",2019-11-21T19:06:16Z
0.51 Context(Hasbro needs,List([2, 30))):(you; to buy; Frozen this holiday season)
0.80 (Hasbro; needs; you to buy ' Frozen this holiday season)
0.55 Context(Hasbro needs,List([2, 30))):(you; to buy; Frozen ' Star Wars ' toys)
