Best Buy launches a new $200 membership program to fight Amazon,2021-04-07T19:36:08Z
1.00 (Buy; Best launches; $ 200 membership program)
0.94 (a new $200 membership program; to fight; Amazon)
0.96 (Buy; launches; a new $200 membership program to fight Amazon,2021-04-07T19:36:08Z)

"The best sales to shop today: Samsung, Eight Sleep, Madewell and more",2021-04-07T15:18:41Z
0.91 (The best sales; to shop; today more)

Looking for an Xbox Series X? Here's how to have the best shot,2021-03-25T17:30:12Z
0.16 (the shot; has best of; 2021 -03 -25t17:30:12z)
0.61 (Here; 's; how to have the best shot)

Finding the PS5 is a nightmare \xe2\x80\x94 here's how to actually have a chance,2021-03-09T19:28:26Z
0.92 Context(here 's,List([44, 50))):(Finding the PS5; is; a nightmare)
0.56 (here; 's; how to actually have a chance)

"The best sales to shop today: Apple Watch, Reebok, Cosori and more",2021-04-06T15:12:57Z
0.93 (The best sales; to shop; T:today; 2021-04-06T15:12:57Z)

Read these tips before getting your Covid-19 vaccine,2021-04-03T07:03:48Z

Amazon is on edge over Alabama union vote,2021-04-04T14:08:26Z
0.95 (Amazon; is; on edge over Alabama union vote)

There's a new approach to police response to mental health emergencies. Taking the police out of it,2021-04-03T00:24:00Z

These are our favorite store credit cards for 2021,2021-04-01T20:16:03Z
0.39 (These; are; our favorite store credit cards for 2021,2021-04-01T20:16:03Z)

"The best sales to shop today: Dyson, Ring, Samsung and more",2021-04-01T15:29:46Z
0.91 (The best sales; to shop; T:today)

Jobs in these industries are already back to pre-pandemic levels,2021-04-01T13:57:49Z
0.92 (Jobs in these industries; are; T:already; back to pre-pandemic levels)

Huggies diapers and Scott toilet paper may soon get more expensive,2021-03-31T16:52:33Z
0.85 (Scott toilet paper; may get; more expensive; 2021-03-31T16:52:33Z; T:soon)
0.79 (Huggies diapers; may get; more expensive; 2021-03-31T16:52:33Z; T:soon)

"The best sales to shop today: Jabra, Case-Mate, Roomba and more",2021-03-31T15:12:07Z
0.93 (The best sales; to shop; Roomba)
0.93 (The best sales; to shop; Jabra)
0.91 (The best sales; to shop; T:today)

GameStop raids Amazon for another heavy-hitter exec,2021-03-30T18:07:26Z

"The best sales to shop today: Mac Mini, Arlo, Old Navy and more",2021-03-30T15:34:06Z
0.91 (The best sales; to shop; T:today)

Toxic chemical 'Hall of Shame' calls out major retailers for failing to act,2021-03-30T04:04:30Z
0.89 (major retailers; to act; 2021-03-30T04:04:30Z)
0.94 (Toxic chemical 'Hall of Shame; calls out; major retailers)

Here's what could happen next as milestone Amazon union vote ends,2021-03-26T12:16:49Z
0.71 (Here; 's; what could happen next as milestone Amazon union vote ends,2021-03-26T12:16:49Z)
0.86 (milestone Amazon union vote; ends; )

"The best sales to shop today: Dyson, Nordstrom, Burrow and more",2021-03-29T15:32:07Z
0.91 (The best sales; to shop; T:today)

Nashville declares emergency after deadly flash flooding,2021-03-28T07:31:26Z
0.92 (Nashville; declares; emergency after deadly flash flooding)

A quiet home and a lost wedding ring: How a mass shooting upended this family,2021-03-26T19:03:24Z

"The best sales to shop this weekend: Adidas, Macy's, Instant Pot and more",2021-03-26T15:49:39Z
0.78 (The best sales; to shop; T:this more)
0.93 (The best sales; to shop; this Adidas)
0.78 (The best sales; to shop; this)
0.93 (The best sales; to shop; T:this weekend; 2021-03-26T15:49:39Z)

"Police still don't know why a gunman killed 12 people in Virginia Beach in 2019, a new report says",2021-03-25T15:49:07Z
0.90 Context(Police do n't know a new report says,List([1, 99))):(a gunman; killed; 12 people in Virginia Beach; T:in 2019)
0.95 Context(a new report says,List([82, 99))):(Police; do n't know; why a gunman killed 12 people in Virginia Beach in 2019; T:still)
0.70 (a new report; says; )

Mass Shootings in the US Fast Facts,2019-08-20T01:12:18Z

"The best sales to shop today: Overstock, Athleta, Google Nest and more",2021-03-23T15:30:41Z
0.91 (The best sales; to shop; T:today)

Amazon was supposed to kill Instacart. Instead Instacart became a mini-Amazon,2021-03-23T11:57:27Z
0.97 (Instacart; became; 2021 -03 -23t11:57:27z)
0.92 (Amazon; to kill; Instacart)

Why anti-Asian American violence is rising -- along with White supremacist propaganda,2021-03-18T01:11:17Z
0.75 (anti-Asian American violence; is rising; )

Stocks bounce higher after Fed holds off on rate hikes,2021-03-16T12:58:22.673Z
0.86 (Fed; holds off; on rate hikes)
0.56 (Stocks; bounce higher; )

Amazon's grocery chain is growing. It isn't Whole Foods,2021-03-17T18:43:27Z
0.78 Context(It is n't,List([35, 43))):(Amazon's grocery chain; is growing; )
0.46 (It; is n't; Whole Foods)

Opioid Crisis Fast Facts,2017-09-18T16:27:25Z

The new Nest Hub is here \xe2\x80\x94 and it can track your sleep,2021-03-16T13:02:37Z
0.31 (it; can track; your sleep)
0.88 (The new Nest Hub; is; here)

Retail sales slid in February as people shopped less,2021-03-16T12:41:53Z
0.75 (people; shopped; less)
0.94 (Retail sales; slid; T:in February; T:as people shopped less)

"Rosalind Brewer officially takes the helm at Walgreens, becoming the only Black woman Fortune 500 CEO",2021-03-15T13:04:42Z
0.76 (Rosalind Brewer; becoming; )
0.93 (Rosalind Brewer; officially takes; the helm; becoming)

Jerome Powell can't take his eyes off the job market,2021-03-14T13:08:31Z
0.89 (Jerome Powell; ca n't take; his eyes; off the job market; 2021-03-14T13:08:31Z)

CVS expands Covid-19 vaccine to 12 more states,2021-03-11T16:34:16Z
1.00 (CVS; expands; -19 vaccine)
0.84 (CVS; expands; Covid-19 vaccine; to 12 more states)

Why small grocery stores are (still) out of toilet paper,2021-03-10T16:40:58Z
0.90 (small grocery stores; are; T:still; out of toilet paper)

"The Lip Bar's vegan, WFH-friendly products are now available at Walmart",2021-03-09T18:03:08Z
0.19 (WFH friendly products; have handiness of; 2021 -03 -09t18:03:08z)
0.95 (WFH-friendly products; are; T:now; available at Walmart; 2021-03-09T18:03:08Z)

Walmart adds more Beyond Meat products,2021-03-09T17:16:18Z
0.94 (Walmart; adds; more; Beyond Meat products; 2021-03-09T17:16:18Z)

The role of an unexpected savior is not new to Tyler Perry,2021-03-08T18:34:01Z
0.94 (The role of an unexpected savior; is not; new to Tyler Perry)

"'Consider chemical hazards' in the baby foods you sell, FDA warns manufacturers",2021-03-05T19:33:40Z
0.90 (FDA; warns; manufacturers; 2021-03-05T19:33:40Z)
0.92 (the baby foods; sell; you)

"Beto O'Rourke is criss-crossing Texas, igniting Democratic hopes he'll run for governor",2021-03-05T18:55:47Z
0.52 (he; 'll run; for governor)
0.85 (Beto O'Rourke; igniting; Democratic hopes he'll run for governor)

"The best sales to shop this weekend: Overstock, Columbia, Converse and more",2021-03-05T17:30:36Z
0.93 (The best sales; to shop; Converse)
0.93 (The best sales; to shop; Overstock)
0.91 (The best sales; to shop; T:this weekend)

Grocery stores' pandemic boom is over,2021-03-04T17:58:40Z
0.89 (Grocery stores' pandemic boom; is; over)

"The best sales to shop today: Dyson, Apt2B, Under Armour and more",2021-03-04T17:35:49Z

"The best sales to shop today: GameStop, Bose headphones, Baublebar and more",2021-03-03T16:59:57Z
0.93 (The best sales; to shop; T:today; 2021-03-03T16:59:57Z)

"The best sales to shop today: iPads, Rothy's, Rifle Paper Co. and more",2021-03-02T17:21:17Z
1.00 (The best sales; to shop; 2021 -03 -02t17:21:17z)
0.91 (The best sales; to shop; 2021-03-02T17:21:17Z)
0.78 (The best sales; to shop; more)
0.91 (The best sales; to shop; T:today)

Target saw more sales growth in 2020 than the last 11 years combined. Here's why,2021-03-02T12:52:49Z
0.77 (the last 11 years; combined; )

Everything you need to know about the debate over the $15 minimum wage,2021-02-22T12:01:38Z
0.82 Context(you need,List([11, 19))):(Everything; to know; you)
0.67 (you; need; to know about the debate over the $15 minimum wage)

"Costco raises its minimum wage above rivals like Amazon, Target and Best Buy",2021-02-25T15:37:19Z
0.88 (Costco; raises; its minimum wage above rivals like Best Buy)
0.88 (Costco; raises; its minimum wage above rivals like Target)
0.88 (Costco; raises; its minimum wage above rivals like Amazon)

"When a woman lost her wallet in a store, a good Samaritan drove to her home to return it",2021-02-24T17:23:23Z
1.00 (a good Samaritan; drove; 2021 -02 -24t17:23:23z)
0.94 (a good Samaritan; drove; to her home; to return it; 2021-02-24T17:23:23Z; T:When a woman lost her wallet in a store)
0.87 (a woman; lost; her wallet; L:in a store)

Security cam footage shows man return lost wallet,2021-02-25T13:38:47Z
0.93 (Security cam footage; shows; man return)

Instacart is moving beyond the grocery store,2021-02-23T18:26:08Z
0.93 (Instacart; is moving; beyond the grocery store; 2021-02-23T18:26:08Z)

Macy's made money for the first time in the pandemic,2021-02-23T14:17:46Z

Our mask-wearing road trip across a battered America,2021-02-20T14:24:04Z

"One week into distribution, pharmacies have a familiar request: 'We just need more vaccines'",2021-02-19T11:59:54Z
0.36 Context(pharmacies have,List([29, 44))):(We; need; more vaccines)
0.87 (pharmacies; have; a familiar request)

5 questions that need answers at the GameStop hearing,2021-02-18T13:03:46Z
0.90 (5 questions; need; answers at the GameStop hearing)

Biden administration looks to FEMA to help combat domestic terrorism in wake of Capitol attack,2021-02-18T18:01:14Z
0.92 Context(Biden administration looks,List([0, 26))):(Biden administration; looks to FEMA to help; combat domestic terrorism in wake of Capitol attack)
0.95 (Biden administration; looks; to FEMA; to help combat domestic terrorism in wake of Capitol attack)

"Grocery store workers have been on the front lines for a year, but they're struggling to get the Covid vaccine",2021-02-18T13:37:23Z
0.61 Context(they 're struggling,List([0, 19))):(they; 're struggling to get; the Covid vaccine)
0.61 (they; 're struggling; to get the Covid vaccine)
0.91 (Grocery store workers; have been; on the front lines; T:for a year)

Walmart just boosted pay to $15. It's not what you think,2021-02-18T13:21:33Z
0.62 Context(It 's not,List([33, 41))):(you; think; 2021-02-18T13:21:33Z)
0.35 (It; 's not; what you think,2021-02-18T13:21:33Z)
0.77 (Walmart; boosted pay; to $15)

Millions are still without power as winter storms continue,2021-02-17T13:08:23.218Z
0.73 (winter storms; continue; )
0.91 (Millions; are; T:still; without power; T:as winter storms continue,2021-02-17T13:08:23.218Z)

Winter storm continues to hammer businesses,2021-02-17T23:43:33Z
0.89 (Winter storm; to hammer; businesses)
0.73 (Winter storm; continues; )

Wall Street hits the enthusiasm pause button,2021-02-16T18:38:09.056Z
0.94 (Wall Street; hits; the enthusiasm pause button)

US retail sales jump 5.3% in January,2021-02-17T13:38:31Z
0.96 (US retail sales; jump; 5.3%; T:in January; 2021-02-17T13:38:31Z)

Want solid returns you can depend on? Here are stocks we love,2021-02-14T15:10:22Z
0.78 (stocks; love; we)
0.44 (Here; are; stocks we love,2021-02-14T15:10:22Z)
0.36 (you; can depend; on)

'We don't see a clear exit strategy.' The travel industry is still getting crushed,2021-02-14T13:53:02Z
0.73 Context(We do n't see,List([1, 13))):(The travel industry; is getting crushed 2021-02-14T13:53:02Z; T:still)
0.39 (We; do n't see; a clear exit strategy)
0.85 (The travel industry; getting; crushed,2021-02-14T13:53:02Z; T:still)

February 10 coronavirus news,2021-02-10T00:17:45.798Z

A Kansas grandfather got Covid-19 in July. He's still in the hospital 7 months later,2021-02-14T18:57:33Z
0.94 Context(He 's,List([43, 47))):(A Kansas grandfather; got; Covid-19; T:in July)
0.46 (He; 's; T:still; in the hospital; T:7 months later)

You'll love to shop all these sweet Valentine's Day deals,2021-02-14T13:36:40Z
0.60 Context(You 'll love,List([0, 11))):(You; 'll love to shop; all these sweet Valentine's Day deals; 2021-02-14T13:36:40Z)
0.70 (You; 'll love; to shop all these sweet Valentine's Day deals,2021-02-14T13:36:40Z)

Pharmacies start administering their first 1 million Covid-19 vaccine doses from federal government,2021-02-12T08:21:20Z
0.82 Context(Pharmacies start,List([0, 16))):(Pharmacies; start administering; their first 1 million Covid-19 vaccine doses; from federal government)
0.90 (Pharmacies; start; administering their first 1 million Covid-19 vaccine doses from federal government,2021-02-12T08:21:20Z)

"Small triumphs, some glitches as nationwide Covid-19 vaccine pharmacy program takes off",2021-02-13T04:52:02Z
0.86 (nationwide Covid-19 vaccine pharmacy program; takes off; )

Vaccines -- despite variants -- are still good news,2021-02-12T12:07:38Z
0.92 (Vaccines -- despite variants; are; T:still; good news; 2021-02-12T12:07:38Z)

This is one of the fastest growing jobs at Walmart,2021-02-12T15:24:24Z
0.50 (This; is; one of the fastest growing jobs at Walmart)

What you need to know before making a vaccine appointment at your pharmacy,2021-02-04T23:41:18Z
0.40 Context(you need to know,List([5, 21))):(you; need to know before making; a vaccine appointment at your pharmacy)
0.40 Context(you need,List([5, 13))):(you; need to know; T:before making a vaccine appointment at your pharmacy)
0.52 (you; need; to know before making a vaccine appointment at your pharmacy)

You'll love to shop all these sweet Valentine's Day deals,2021-02-09T14:37:18Z
0.60 Context(You 'll love,List([0, 11))):(You; 'll love to shop; all these sweet Valentine's Day deals; 2021-02-09T14:37:18Z)
0.70 (You; 'll love; to shop all these sweet Valentine's Day deals,2021-02-09T14:37:18Z)

Walmart promises to honor vaccine appointments after its website mistakenly allows some to register in Florida,2021-02-12T07:43:52Z
0.53 Context(Walmart promises mistakenly allows,List([0, 82))):(some; to register; L:in Florida)
0.87 Context(Walmart promises,List([0, 16))):(Walmart; promises mistakenly allows; some to register in Florida,2021-02-12T07:43:52Z)
0.83 Context(Walmart promises,List([0, 16))):(Walmart; promises to honor; vaccine appointments; T:after its website)
0.83 (Walmart; promises; to honor vaccine appointments after its website)

"Biden administration seeks a pause on TikTok, WeChat court fights",2021-02-11T14:44:27Z
1.00 (WeChat court; fights; 2021 -02 -11t14:44:27z)
0.92 Context(WeChat court fights,List([47, 66))):(Biden administration; seeks; a pause on TikTok)
0.93 (WeChat court; fights; 2021-02-11T14:44:27Z)

Colin Kaepernick gets in on Wall Street's hottest trend,2021-02-11T04:31:16Z
0.94 (Colin Kaepernick; gets in; on Wall Street's hottest trend)

"More Americans say they're willing to take a Covid-19 vaccine, but supply issues remain",2021-02-10T07:43:39Z
0.73 (supply issues; remain; )
0.67 Context(More Americans say,List([2, 20))):(they; 're; willing to take a Covid - 19 vaccine)
0.91 (More Americans; say; they 're willing to take a Covid - 19 vaccine)
0.62 (they; to take; a Covid - 19 vaccine)

Aldi plans to open 100 new US stores this year,2021-02-10T17:42:33Z
0.92 Context(Aldi plans,List([0, 10))):(Aldi; plans to open; 100 new US stores; T:this year)
0.94 (Aldi; plans; to open 100 new US stores this year)

"A hug, a fishing trip, the symphony: Seniors long for simple pleasures after 2nd dose of Covid vaccine",2021-02-10T13:50:49Z

Amazon's plans for India take a hit as court battle swings in rival's favor,2021-02-09T11:13:28Z
0.94 (Amazon's plans for India; take; a hit; as court battle swings in rival's favor)

A $15 minimum wage would hurt those it's meant to help,2021-02-09T13:28:24Z
0.17 (it; to help; 2021-02-09T13:28:24Z)
0.71 (A $15 minimum wage; would hurt; those it's meant to help,2021-02-09T13:28:24Z)

The coronavirus pandemic is still going strong. But there's hope on the horizon,2021-02-08T11:53:50Z
0.81 (The coronavirus pandemic; is going; strong; T:still)

"'Definitely getting better': The United States is making vaccine progress on several fronts, and experts are encouraged",2021-02-05T08:13:22Z
0.91 (The United States; is making; vaccine progress; on several , 2021-02-05T08:13:22Z)
0.91 (The United States; is making; vaccine progress; on several experts)
0.78 (The United States; are encouraged; )
0.91 (The United States; is making; vaccine progress; L:on several fronts)

"Leading baby food manufacturers knowingly sold products with high levels of toxic metals, a congressional investigation found",2021-02-04T18:18:15Z
1.00 (a congressional investigation; found; 2021 -02 -04t18:18:15z)
0.95 Context(a congressional investigation found,List([91, 126))):(Leading baby food manufacturers; sold; products with high levels of toxic metals; T:knowingly)
0.70 (a congressional investigation; found; )

"The best sales to shop this weekend: Apple TV 4K, Ring, Roomba and more",2021-02-05T17:12:58Z

Rosa Flores,2014-12-22T20:23:53Z

Stream and save with a rare deal on Apple TV 4K,2020-02-20T19:23:51Z
0.16 (a deal on Apple TV 4K; has rare of; 2020 -02 -20t19:23:51z)

"5 things to know for February 5: Covid-19, Congress, Smartmatic, Yemen, Hong Kong",2021-02-05T11:17:18Z
0.68 (5 things; to know; T:for February 5)

"The best sales to shop today: Gravity Blankets, Dyson, MacBook Pro and more",2021-02-04T16:25:32Z

One of our favorite cold brew makers is on sale at Walmart,2021-01-08T15:27:10Z
0.82 (One of our favorite cold brew makers; is; on sale at Walmart)

Analysis: Bezos leaves behind a company that's created value but has also triggered a national reckoning,2021-02-04T12:53:34Z
0.86 (Bezos; has triggered; a national reckoning)
0.89 (a company; 's created; value)
0.92 (Bezos; leaves; behind a company)

February 3 coronavirus news,2021-02-02T17:50:07.560Z

These cities want to give grocery store workers hazard pay,2021-02-03T17:22:02Z
0.88 Context(These cities want,List([0, 17))):(These cities; want to give; grocery store workers; hazard pay)
0.91 (These cities; want; to give grocery store workers hazard pay)

Amazon gets court to block $3.3 billion retail deal involving India's richest man,2021-02-03T02:13:56Z
0.93 Context(Amazon gets,List([0, 11))):(court; to block; $3.3 billion retail deal involving India's richest man)
0.92 (Amazon; gets; court to block $3.3 billion retail deal)
0.94 ($3.3 billion retail deal; involving; India's richest man)

"Prep for Sunday's big game with deals on TVs, soundbars and more",2021-02-02T16:46:25Z

Principal works overnight shifts at Walmart to help low-income students,2021-02-02T00:27:13Z
0.87 Context(Principal works,List([0, 15))):(Principal; works overnight shifts at Walmart to help; low-income students)
0.92 (Principal; works; overnight shifts at Walmart)

'They're my children': Hear what this principal does to help his low-income students,2021-02-02T00:11:56Z

Here's what really happens to the items you return online,2021-01-30T15:34:52Z
0.56 (Here; 's; what really happens to the items)
0.74 (the items; return; online)

On a budget? Here's how to save money on your groceries,2021-01-28T18:59:51Z
0.61 (Here; 's; how to save money on your groceries; T:On a budget)

Where does the GameStop mania end?,2021-01-28T13:09:14Z

January 27 coronavirus news,2021-01-26T19:35:59.772Z

Walgreens taps Starbucks executive Rosalind Brewer to be its CEO,2021-01-27T01:02:47Z
0.38 (Rosalind Brewer; [is] executive [of]; Starbucks)
0.91 (Walgreens taps Starbucks executive Rosalind Brewer; to be; its CEO)

Walmart's latest strategy to get your stuff to you faster,2021-01-27T05:02:47Z

"5 things to know for January 27: Covid-19, White House, Capitol riot, Italy, Newark",2021-01-27T11:16:38Z
0.68 (5 things; to know; T:for January 27: Covid-19)

What the Biden administration means for the future of Silicon Valley,2021-01-26T12:20:58Z
0.94 (the Biden administration; means; for the future of Silicon Valley)

"The best sales to shop today: Macy's, Sony, Levi's and more",2021-01-26T15:55:22Z
0.91 (The best sales; to shop; T:today)

Google Maps will soon display Covid-19 vaccination sites,2021-01-25T10:26:36Z
1.00 (Google Maps; will display; -19 vaccination sites)
0.95 (Google Maps; will display; Covid-19 vaccination sites; T:soon)

Walmart will expand Covid-19 vaccinations to more states,2021-01-22T17:34:54Z
1.00 (Walmart; will expand; -19 vaccinations)
0.93 (Walmart; will expand; Covid-19 vaccinations; to more states)

Ed Meagher,2020-03-24T15:18:00Z

Costco is (finally) testing out curbside pickup for groceries,2021-01-21T15:57:57Z
0.88 (Costco; is finally testing out; curbside pickup for groceries)

Divisive policies and actions from Trump-era that Biden could decide to alter,2021-01-21T05:50:05Z
0.72 Context(Biden could decide,List([28, 46))):(Biden; could decide to alter to alter; )
0.72 Context(Biden could decide,List([38, 56))):(Biden; could decide to alter to alter; )
0.76 (Biden; could decide; to alter)

Michelle Obama Fast Facts,2012-12-26T20:26:31Z

Joe Biden wants to avoid the Obama era's biggest economic mistake. Congress may not let him,2021-01-20T12:38:06Z
0.14 Context(Congress may not let,List([67, 87))):(him; 2021-01-20T12:38:06Z; )
0.92 Context(Joe Biden wants Congress may not let,List([0, 87))):(Joe Biden; wants to avoid; the Obama era's biggest economic mistake)
0.94 Context(Congress may not let,List([67, 87))):(Joe Biden; wants; to avoid the Obama era's biggest economic mistake)
0.83 (Congress; may not let; him,2021-01-20T12:38:06Z)

"It's Inauguration Eve, and Wall Street is feeling good",2021-01-20T01:01:19Z
0.82 (Wall Street; is feeling; good)
0.57 (It; 's; Inauguration Eve)

Facebook Fast Facts,2014-02-11T16:34:57Z

Walmart CEO blames 'fiction' of fraudulent election for dividing Americans,2021-01-19T18:31:08Z
0.93 (Walmart CEO; blames; fiction; of fraudulent election for dividing Americans)

French politics kills Canadian bid to create one of the world's top supermarket groups,2021-01-18T14:32:08Z
0.95 (French politics; kills; Canadian bid to create one of the world's top supermarket groups,2021-01-18T14:32:08Z)

The online shopping exec Walmart hired to take on Amazon is leaving,2021-01-15T16:51:37Z
0.91 (The online shopping; exec; Walmart hired to take on Amazon)

Circle K's owner offers $20 billion for France's biggest retailer,2021-01-13T16:50:31Z
1.00 (Circle K 's owner; offers; $ 20 billion)
0.95 (Circle K's owner; offers; $20 billion for France's biggest retailer)

Stocks hold steady ahead of impeachment vote,2021-01-12T14:38:55.278Z
0.85 (Stocks; hold; steady; L:ahead of impeachment vote)

Corporate America halts donations to Republicans who voted to overturn the election,2021-01-10T20:18:53Z
0.88 Context(Republicans voted,List([37, 58))):(Republicans; voted to overturn; the election)
0.88 (Republicans; voted; to overturn the election,2021-01-10T20:18:53Z)
0.95 (Corporate America; halts; donations; to Republicans)

Staples offers to buy Office Depot for $2.1 billion,2021-01-11T14:30:03Z
0.89 Context(Staples offers,List([0, 14))):(Staples; offers to buy; Office Depot; for $2.1 billion)
0.89 (Staples; offers; to buy Office Depot for $2.1 billion)

Corporate America pulls the plug on President Trump,2021-01-11T13:01:28Z
0.95 (Corporate America; pulls; the plug; on President Trump,2021-01-11T13:01:28Z)

"The best sales to shop this weekend: Best Buy, Dyson, Sur La Table and more",2021-01-08T17:37:33Z
0.89 (The best sales; to shop; T:this weekend; Best Buy)
0.91 (The best sales; to shop; T:this weekend)
0.93 (The best sales to shop this weekend; Buy; Dyson; 2021-01-08T17:37:33Z)

These are our favorite store credit cards for 2021,2020-12-14T22:16:07Z
0.39 (These; are; our favorite store credit cards for 2021,2020-12-14T22:16:07Z)

"The best sales to shop today: Target, Kate Spade, Aerogarden and more",2021-01-07T15:58:39Z

She was promoted just in time to lead TikTok through a 'Category 5 storm',2021-01-04T12:21:40Z
0.45 (She; was promoted; T:just in time)

Make sure you have the best credit card when you shop at Amazon,2020-12-23T19:51:28Z
0.18 (you; have the best credit card shop at Amazon of; 2020 -12 -23t19:51:28z)
0.72 (you; shop; L:at Amazon)
0.51 (you; have; the best credit card when you shop at Amazon)

"Start your week smart: Congress, Senate, Ahmaud Arbery, Walmart shooting, vaccine",2021-01-03T14:43:19Z

"Walmart shooting suspect in custody in Virginia after allegedly wounding 3 people, including a sheriff's deputy",2021-01-03T05:36:03Z

Start 2021 off strong with savings from these New Year's sales,2020-12-31T13:59:37Z

21 things to look forward to in 2021 ... if everything works out,2021-01-01T02:26:24Z
0.62 (everything; works out 2021-01-01T02:26:24Z; )

El Paso teacher whose video of students hugging became a national sensation dies from Covid-19,2020-12-31T22:16:11Z
0.93 (El Paso teacher; dies; from Covid-19,2020-12-31T22:16:11Z)
0.92 (El Paso teacher; became; a national sensation)
0.71 (students; hugging; )

Dow and S&P 500 end 2020 at record highs,2020-12-31T14:36:56Z

Keep the holiday spirit alive with savings from these after-Christmas sales,2020-12-26T13:00:17Z

These businesses were the surprise winners of 2020,2020-12-30T12:14:16Z
0.90 (These businesses; were; the surprise winners of 2020,2020-12-30T12:14:16Z)

Trump administration appeals court order blocking TikTok restrictions,2020-12-29T02:10:34Z
0.92 (court order; blocking; TikTok restrictions; T:2020-12-29T02:10:34Z)

What the #)$*#@)($ is happening with Bitcoin's insane record run?,2020-12-27T16:37:13Z

December 26 coronavirus news,2020-12-16T20:58:02.694Z

The latest on the coronavirus pandemic and vaccines,2020-12-24T01:04:55.328Z

Their communities are deserted by pharmacies. Advocates fear this will lead to inequitable vaccine access,2020-12-24T13:42:00Z
0.33 Context(Advocates fear,List([46, 60))):(this; will lead; to inequitable vaccine access)
0.59 Context(Advocates fear,List([46, 60))):(Their communities; are deserted; by pharmacies)
