8 bodies found dead in tractor-trailer,2017-07-23T10:29:31Z
0.90 (8 bodies; found; dead; L:in tractor-trailer)

Renegotiating NAFTA -- in 15 easy steps,2017-07-19T16:42:29Z

"86-year-old jewel thief busted again, this time at Walmart",2017-07-18T18:21:59Z

Walmart apologizes for slur in listing on its website,2017-07-17T20:16:08Z
0.83 Context(Walmart apologizes,List([0, 18))):(Walmart; apologizes for slur in listing; on its website)
0.85 (Walmart; apologizes; for slur; L:in listing on its website; 2017-07-17T20:16:08Z)

Is your TV an eyesore? Samsung wants to change that,2017-07-17T14:56:03Z
0.54 Context(Samsung wants,List([23, 36))):(Samsung; wants to change; that)
0.61 (Samsung; wants; to change that)

The world's coolest nationalities: Where do you rank?,2017-07-12T07:43:48Z

Can Massmart take on the might of Walmart?,2017-07-10T15:07:05Z

Can Walmart crack Africa?,2017-07-10T15:13:02Z

"Abercrombie & Fitch is no longer for sale, sending stock plunging to 17-year low",2017-07-10T13:16:22Z
0.92 (Abercrombie & Fitch; sending; stock)
0.93 (Abercrombie & Fitch; is no longer; for sale; sending stock plunging to 17-year low)

5.8 magnitude earthquake hits western Montana,2017-07-06T09:38:03Z
0.99 (5.8 magnitude earthquake hits; hits; western Montana)
0.94 (5.8 magnitude earthquake; hits; western Montana)

Fireworks product recalled over unintended explosions,2017-06-29T06:28:13Z
0.73 (Fireworks product; recalled; )

Prosecutor removed from death penalty case takes Florida governor to court,2017-06-28T09:28:19Z
0.91 (Prosecutor; removed; from death penalty case; takes Florida governor to court,2017-06-28T09:28:19Z)

What's the future of coal country? These grads aren't sure,2017-06-15T00:57:36Z

Silicon Valley CEOs can't get enough of Indian PM Modi,2017-06-26T15:07:29Z
0.94 (Silicon Valley CEOs; ca n't get; enough of Indian PM Modi)

"In Castile shooting, a 4-year-old gives her mother 'The Talk'",2017-06-22T20:43:28Z
0.88 (a 4-year-old; gives; her mother)

"12 iconic mountains (under 29,035 feet)",2017-06-20T11:12:34Z

Buying Whole Foods could be Amazon's Waterloo,2017-06-18T01:03:45Z
0.93 (Buying Whole Foods; could be; Amazon's Waterloo)

Could there be a bidding war for Whole Foods?,2017-06-19T18:10:13Z

Blue Apron says it could be worth $3 billion,2017-06-19T15:21:16Z
0.19 Context(Blue Apron says,List([0, 15))):(it; could be; worth $3 billion)
0.85 (Blue Apron; says; it could be worth $3 billion)

Amazon wrecked the mall. Now it's coming for the grocery store,2017-06-17T18:11:30Z
0.60 (it; 's coming; for the grocery store; T:Now)
0.86 (Amazon; wrecked; the mall; Now it's coming for the grocery store)

What happens to Instacart in the Amazon-Whole Foods deal?,2017-06-16T18:05:07Z

Bonobos fans aren't happy about the Walmart takeover,2017-06-16T20:23:49Z
0.92 (Bonobos fans; are n't; happy about the Walmart takeover)

Grocery stocks are getting clobbered after Amazon-Whole Foods deal,2017-06-16T14:44:47Z
0.92 (Grocery stocks; are getting clobbered; T:after Amazon-Whole Foods deal,2017-06-16T14:44:47Z)
0.90 (Grocery stocks; getting; clobbered after Amazon-Whole Foods deal,2017-06-16T14:44:47Z)

Amazon is buying Whole Foods for $13.7 billion,2017-06-16T13:10:45Z
0.93 (Amazon; is buying; Whole Foods; for $13.7 billion)

Jeff Bezos is the smartest guy in business,2017-06-16T16:35:00Z
0.94 (Jeff Bezos; is; the smartest guy in business)

Walmart is buying Bonobos for $310 million,2017-06-16T14:48:00Z
0.93 (Walmart; is buying; Bonobos; for $310 million; T:2017-06-16T14:48:00Z)

Why does America have so many hungry kids?,2017-06-09T22:51:16Z

Grocery wars! Amazon and Walmart crush Kroger,2017-06-15T16:19:35Z
0.93 (Grocery wars; crush; Kroger , 2017-06-15T16:19:35Z)

Man freed after lookalike becomes suspect in robbery,2017-06-14T02:24:38Z
0.54 (lookalike; becomes; suspect in robbery)
0.88 (Man; freed; T:after lookalike becomes suspect in robbery,2017-06-14T02:24:38Z)

Uber to add another woman to its board amid crises,2017-06-12T17:07:52Z
0.86 (Uber; to add; another woman; to its board; T:amid crises,2017-06-12T17:07:52Z)

Amazon Prime debuts discount for people on government benefits,2017-06-06T20:26:52Z
0.93 (Amazon Prime; debuts; discount)

5 stunning stats about Walmart,2014-12-02T12:43:37Z

They live in Mexico and go to school in the US,2017-06-05T00:48:56Z
0.72 (They; go; to school; L:in the US; 2017-06-05T00:48:56Z)
0.66 (They; live; L:in Mexico)

"5 things for Friday, June 2: Paris climate agreement, Philippines attack, national spelling bee",2017-06-02T10:01:57Z

"Quickly catch up on the day's news: Thursday, June 1",2017-06-01T21:10:17Z

Some Walmart workers now deliver packages on their way home,2017-06-01T19:38:06Z
0.95 (Some Walmart workers; deliver; packages; T:now)

How this contacts startup is fighting optometrists to survive,2017-05-31T16:34:05Z
0.91 (this contacts startup; is fighting; optometrists; to survive)

Michael Kors to close 100 to 125 stores,2017-05-31T14:53:13Z

Tiger Woods arrest is latest problem for Nike,2017-05-30T15:40:05Z
0.96 (Tiger Woods arrest; is; latest problem for Nike)

"Amazon stock tops $1,000",2017-05-30T13:43:14Z
1.00 (Amazon stock; tops; $ 1000 ")
0.86 (Amazon stock; tops; $1,000)

Forerunner Ventures' Kirsten Green: 'We need to have more women founders',2017-05-29T14:19:56Z
0.40 Context(We need,List([37, 44))):(We; need to have; more women founders',2017-05-29T14:19:56Z)
0.40 (We; need; to have more women founders',2017-05-29T14:19:56Z)

What should you do if you witness a racist or Islamophobic tirade?,2017-05-28T22:55:19Z
0.77 (Islamophobic; tirade; )
0.62 (you; witness; a racist)

"Utah woman locked kids in trunk  while she shopped, police say",2017-05-28T08:07:05Z
1.00 (police; say; 2017 -05 -28t08:07:05z)
0.91 Context(police say,List([53, 63))):(Utah woman; locked; kids; L:in trunk)
0.66 (police; say; )
0.19 (she; shopped; )

Police: Woman locked kids in trunk,2017-05-28T11:39:30Z
0.91 (Woman; locked; kids; L:in trunk; 2017-05-28T11:39:30Z)

What to make of these viral racist tirades?,2017-05-26T07:15:10Z

"5 things for Friday, May 26: Russia, Montana, travel ban, G-7 & NATO",2017-05-26T10:20:09Z

Not all retailers stink! Best Buy stock at all-time high,2017-05-25T16:53:41Z
0.88 (all retailers; Buy high; stock)

Does anyone shop at Sears? Sales plunge again,2017-05-25T14:20:17Z
0.91 (Sales; plunge; T:again; 2017-05-25T14:20:17Z)

"Walmart to ban woman who told customer to 'go back to Mexico,' called another the N-word",2017-05-24T20:12:34Z
0.94 (Walmart to ban woman; called; another the N-word; T:2017-05-24T20:12:34Z)
0.92 (woman; told; customer; to 'go back to Mexico)
0.96 (Walmart; to ban; woman who told customer to 'go back to Mexico,)

Walmart announces guaranteed pay for military workers,2017-05-23T08:03:37Z
0.90 (Walmart; announces; guaranteed pay for military workers)

Racist rant inside Walmart goes viral,2017-05-24T20:32:16Z
0.84 (Racist rant inside Walmart; goes; viral,2017-05-24T20:32:16Z)

Trump thump is short-lived as stocks rebound,2017-05-23T14:06:37Z
0.94 (Trump thump; is; short-lived as stocks rebound)

Business leaders to Tillerson: State Department funding = jobs,2017-05-22T22:24:28Z

Robots could wipe out another 6 million retail jobs,2017-05-19T16:18:45Z
1.00 (Robots; could wipe; 6 million retail jobs)
0.89 (Robots; could wipe out; another 6 million retail jobs)

Department stores have lost more jobs than coal mines,2017-05-12T21:34:25Z
0.93 (Department stores; have lost; more jobs than coal mines)

Watch out Amazon. Walmart is coming for you,2017-05-18T14:17:53Z

STDs are at an all-time high: Can at-home tests help?,2017-05-18T12:56:51Z

Investors take a breather; Cisco looks sick; Walmart earnings,2017-05-18T08:59:31Z
0.87 Context(Cisco looks,List([27, 38))):(Investors; take; a breather)
0.76 (Cisco; looks; sick)

Trump worries hit stocks; Laptop ban in focus; Target earnings,2017-05-17T09:29:36Z
0.93 (Trump worries; hit; stocks)

Tracy Morgan is 'Alive' and laughing in new Netflix special,2017-05-16T14:08:29Z
0.93 (Tracy; laughing; in new Netflix special; 2017-05-16T14:08:29Z)
0.83 (Tracy Morgan; is; Alive)

This big retailer isn't getting Amazon-ed,2017-05-16T14:44:09Z
0.93 (This big retailer; is n't getting; Amazon-ed; 2017-05-16T14:44:09Z)

Expensive art at auction,2017-05-16T10:29:48Z
0.16 (art at auction ,; has expensiveness of; 2017 -05 -16t10:29:48z)

"$1,000 in Amazon 20 years ago is now worth $638,000",2017-05-15T19:32:15Z
0.82 ($1,000 in Amazon; ago is; T:now; worth $638,000)

More retail earnings; SpaceX launch; Facebook's IPO-versary,2017-05-14T12:06:59Z

These stocks are getting left out of the Trump rally,2017-05-12T06:03:31Z
0.92 (These stocks; are getting left; out of the Trump rally)
0.90 (These stocks; getting; left out of the Trump rally)

American al Qaeda recruit to be released from prison,2017-05-11T20:03:15Z
0.92 (American al Qaeda; to be released; from prison)
0.93 (American al Qaeda; recruit; to be released from prison)

"Retail train wreck continues as sales plunge at Macy's, Kohl's",2017-05-11T13:42:18Z
0.75 (Retail train wreck; continues; )

Abercrombie & Fitch's latest sale may be itself,2017-05-10T17:22:12Z
0.92 (Abercrombie & Fitch's latest sale; may be; itself; 2017-05-10T17:22:12Z)

Target testing next-day delivery,2017-05-09T11:51:40Z
0.92 (Target; testing; next-day delivery; T:2017-05-09T11:51:40Z)

Amazon lowers free shipping minimum ... again,2017-05-09T01:49:08Z
0.93 (Amazon; lowers; free shipping minimum; T:again; 2017-05-09T01:49:08Z)

India has 'incredible' potential. So why hasn't Warren Buffett invested?,2017-05-08T13:20:21Z

Big retailers hope to prove they aren't dying,2017-05-08T15:51:58Z
0.27 Context(Big retailers hope to prove,List([0, 27))):(they; are n't dying; )
0.83 Context(Big retailers hope,List([0, 18))):(Big retailers; hope to prove; they aren't dying,2017-05-08T15:51:58Z)
0.83 (Big retailers; hope; to prove they aren't dying,2017-05-08T15:51:58Z)

Lawyers call for release of US terrorist who helped 'dismantle' al Qaeda,2017-05-06T18:44:02Z
0.91 (US terrorist; helped; dismantle' al Qaeda)
0.93 (Lawyers; call; for release of US terrorist)

"Floods galore: Storm hits NYC; Mississippi, Missouri rivers to crest Saturday",2017-05-05T12:11:57Z
0.73 Context(Missouri rivers,List([45, 60))):(Missouri; rivers to crest to crest; )
0.76 (Missouri; rivers; to crest)
0.85 Context(Floods galore,List([1, 14))):(Storm; hits; NYC)
0.66 (Floods; galore; )

7 bounty hunters are accused of killing an innocent man,2017-05-05T17:11:07Z
0.90 (7 bounty hunters; of killing; an innocent man)
0.91 (7 bounty hunters; are accused; of killing an innocent man)

Aerial images show devastating flooding in central US,2017-05-04T17:58:56Z
0.94 (Aerial images; show; devastating flooding in central US)

Ammo sales are slumping under Trump,2017-05-04T16:50:03Z
0.91 (sales; are slumping; L:under Trump)

Apple has a quarter-trillion dollars in cash,2017-05-02T20:55:23Z
0.94 (Apple; has; a quarter-trillion dollars in cash,2017-05-02T20:55:23Z)

Apple probably has a quarter of a trillion in cash,2017-05-01T17:01:03Z
0.93 (Apple; has; a quarter of a trillion in cash)

California judge OKs Cummins' move back to Tennessee,2017-04-24T19:10:54Z
0.88 (OKs Cummins; [is] judge [from]; California)

"Cherokee Nation sues pharmacies, drug distributors over opioid epidemic",2017-04-24T20:05:00Z
0.93 (Cherokee Nation; sues; pharmacies, drug distributors; over opioid epidemic)

Accused kidnapper due in court Monday,2017-04-23T18:48:42Z

End of the road: 39 days on the run for missing teacher and student,2017-04-21T21:11:37Z

Tad Cummins arrest: Tipster reveals how teacher covered up identity,2017-04-21T15:51:10Z
0.87 Context(Tipster reveals,List([20, 35))):(teacher; covered up; identity)
0.90 (Tipster; reveals; how teacher covered up identity)

"Bebe is closing all its stores, the latest casualty in retail",2017-04-21T14:30:46Z
0.86 (Bebe; is closing; all its stores; T:the latest casualty in retail)

'I'm glad this is over': Tenn. teacher accused of abducting girl nabbed in Calif.,2017-04-20T17:03:47Z
0.84 (girl; nabbed; L:in Calif)
0.93 (Tenn. teacher; accused; of abducting girl)
0.50 (this; is; over': Tenn. teacher)
0.57 (I; 'm; glad this is over': Tenn. teacher)

Walmart CEO Doug McMillon saw his pay jump 13% last year,2017-04-20T23:26:52Z
0.88 (Doug McMillon; [is] CEO [of]; Walmart)
0.85 (Walmart CEO Doug McMillon; saw; his pay jump 13% last year)

Crisis-ridden Venezuela gave $500K to Trump inauguration,2017-04-20T21:01:51Z
1.00 (Crisis ridden Venezuela; gave; $ 500k)
0.95 (Crisis-ridden Venezuela; gave; $500K; to Trump inauguration)

Missing Tennessee student: From kissing allegation to 5-week manhunt,2017-03-21T18:23:09Z

Wife of Tennessee teacher accused in abduction: 'He's totally betrayed me',2017-04-14T14:39:12Z
0.23 (He; 's betrayed; me)
0.94 (Wife of Tennessee teacher; accused; in abduction)

A month later: What we know (and don't) about the Tennessee abduction,2017-04-13T16:20:41Z
0.24 (we; know; )

Prosecutor sues Florida governor over death penalty cases,2017-04-11T19:25:27Z
0.93 (Prosecutor; sues; Florida governor; L:over death penalty cases)

Bat reportedly found in packaged Fresh Express salad mix,2017-04-09T02:58:04Z
0.86 (Bat; found; L:in packaged Fresh Express salad mix)

Retailers cut tens of thousands of jobs. Again,2017-04-07T16:38:06Z
0.89 (Retailers; cut Again; tens of thousands of jobs)

"Your browser history is for sale, here's what you need to know",2017-04-05T21:23:38Z
0.27 Context(here 's you need,List([35, 55))):(you; need to know; )
0.27 Context(here 's,List([35, 41))):(you; need; )
0.67 Context(here 's,List([35, 41))):(Your browser history; is; for sale)
0.45 (here; 's; what you need to know",2017-04-05T21:23:38Z)

Watch: Lightning strikes only a few feet away,2017-04-03T18:45:05Z

Amazon is worth almost twice as much as Walmart,2017-04-04T19:24:44Z
0.95 (Amazon; is; worth almost twice as much as Walmart,2017-04-04T19:24:44Z)

Wife of Tennessee teacher accused of kidnapping wants divorce,2017-04-03T16:02:07Z
0.94 (Wife of Tennessee teacher; wants; divorce)
0.94 (Wife of Tennessee teacher; accused; of kidnapping)

Google fights to win back advertisers,2017-04-03T20:07:36Z
0.90 Context(Google fights,List([0, 13))):(Google; fights to win; back advertisers)
0.92 (Google; fights; to win back advertisers)

Tennessee manhunt: New images released of student and teacher,2017-03-31T17:26:15Z
0.90 (New images; released; of teacher)
0.73 (New images; released; )

"Quickly catch up on the day's news: Friday, March 31",2017-03-31T18:54:21Z

New images released of missing student,2017-03-31T18:04:00Z
0.73 (New images; released; )

Sears stock is up 50% in a week. What the heck is going on?,2017-03-30T17:05:56Z

Trump and jobs: A running fact check,2017-02-17T19:28:51Z

How Sears changed America,2017-03-23T10:28:08Z
1.00 (Sears; changed; 2017 -03 -23t10:28:08z)
0.93 (Sears; changed; America,2017-03-23T10:28:08Z)

Sears has 'substantial doubt' that it can survive,2017-03-22T11:55:56Z
0.17 (it; 2017-03-22T11:55:56Z; )
0.19 (it; can survive; )
0.93 (Sears; has; substantial doubt)

"CNN 10 - March 23, 2017",2017-03-22T21:29:32Z

Don't just do it? Nike tanks on poor sales,2017-03-22T13:43:07Z

"Tennessee manhunt: Suspect researched teen marriage, officials say",2017-03-21T11:07:29Z
1.00 (officials; say; 2017 -03 -21t11:07:29z)
0.90 Context(Tennessee manhunt : Suspect researched teen marriage say,List([1, 67))):(Suspect; researched; teen marriage)
0.96 (Tennessee manhunt: Suspect researched teen marriage; say; officials)

Apple worth $750 billion. Next stop? $1 trillion,2017-03-21T14:59:27Z

Target to open a new store across from Macy's flagship New York City location,2017-03-20T14:52:10Z
0.93 (Target; to open; a new store; across from Macy's flagship)

"20,000 lbs of frozen pizza recalled over listeria fears",2017-03-17T00:12:41Z
0.79 (20,000 lbs of frozen pizza; recalled; )

Attorney removed from Markeith Loyd case after anti-death penalty stance,2017-03-16T14:18:58Z
0.93 (Attorney; removed; from Markeith Loyd case; T:after anti-death penalty stance)

"Trump's budget would hit tens of thousands of federal workers, experts say",2017-03-16T20:10:04Z
1.00 (experts; say; 2017 -03 -16t20:10:04z)
0.92 Context(experts say,List([64, 75))):(Trump's budget; would hit; tens of thousands of federal workers)
0.67 (experts; say; )

Trump and the Fed are throwing a party for banks,2017-03-15T15:38:59Z
0.93 (the Fed; are throwing; a party; for banks; T:2017-03-15T15:38:59Z)
0.81 (Trump; are throwing; a party; for banks; 2017-03-15T15:38:59Z)

Ethics complaint filed against White House official,2017-03-14T20:26:10Z
0.92 (Ethics complaint; filed; against White House official,2017-03-14T20:26:10Z)

Trump is pushing 'Buy American.' But customers (mostly) don't care,2017-03-13T10:25:10Z
0.90 (customers ( mostly; do n't care; 2017-03-13T10:25:10Z)
0.79 Context(Trump is pushing,List([0, 16))):(Trump; is pushing Buy; American)
0.83 (Trump; is pushing; Buy American)

Bush's top economist: Trump should get moving on tax cuts,2017-03-13T11:56:25Z
0.82 Context(Trump should get,List([22, 38))):(Trump; should get moving; on tax cuts)
0.82 (Trump; should get; moving on tax cuts)

Smoke and mirrors: Marijuana company bragged of 'bogus' sales: SEC,2017-03-10T19:07:25Z

There is a retail bubble -- and it's bursting,2017-03-09T16:02:26Z
0.19 (it; 's bursting; )

Rise of Amazon leaves even more retailers in intensive care,2017-03-06T11:22:26Z
0.93 (Rise of Amazon; leaves; even more retailers in intensive care)

Costco is raising membership fees for first time since 2011,2017-03-03T14:41:59Z
0.93 (Costco; is raising; membership fees; T:for first time since 2011,2017-03-03T14:41:59Z)

Weak coloring book sales and no Adele hurt Barnes & Noble,2017-03-02T18:26:57Z

Trump speaks to Congress: CNN's Reality Check Team vets the claims,2017-03-01T03:42:21Z
0.85 Context(CNN 's Reality Check Team vets,List([26, 55))):(Trump; speaks; to Congress)
0.91 (CNN's Reality Check Team; vets; the claims; 2017-03-01T03:42:21Z)

Donald Trump's Congress speech (full text),2017-03-01T02:23:19Z

Target has terrible holiday and warns of awful 2017,2017-02-28T13:39:12Z
1.00 (Target; has warns of; 20172017 -02 -28t13:39:12z)
0.94 (Target; has; warns of awful 2017,2017-02-28T13:39:12Z)
0.94 (Target; has; terrible holiday)

America's favorite retailer is...,2017-02-28T05:01:32Z
0.86 (America's favorite retailer; is; )

Ellen DeGeneres and Walmart give these students the ultimate prize,2017-02-26T23:25:55Z
0.92 (Walmart; give; these students; the ultimate prize)
0.93 (Ellen DeGeneres; give; these students; the ultimate prize)

"More than 400,000 plastic toy frogs recalled",2017-02-23T20:03:37Z
0.93 (More than 400,000 plastic toy frogs; recalled; 2017-02-23T20:03:37Z)

"Little Tikes recalls 540,000 swings after injuries",2017-02-24T00:14:24Z
1.00 (Little Tikes; recalls; 540000 swings after injuries ")
0.93 (Little Tikes; recalls; 540,000 swings after injuries)

Trump rally: CEOs of Dow companies make $400 million,2017-02-24T17:44:23Z
0.21 (Dow companies; have CEOs of; 2017 -02 -24t17:44:23z)
1.00 (Trump rally; make; $ 400 million)

Dow winning streak; Retailers need therapy; Consumers confident?,2017-02-24T10:42:25Z
0.83 Context(Retailers need,List([20, 34))):(Dow; winning; streak)
0.87 (Retailers; need; therapy)

Fallen angels? Victoria's Secret sales plunge,2017-02-23T16:27:47Z

These 10 stocks dominate the market,2017-02-22T18:25:06Z
0.99 (10 stocks; dominate; the market)
0.91 (These 10 stocks; dominate; the market)

How Trump could make the trade deficit look worse,2017-02-21T22:30:03Z
0.82 (Trump; could make; the trade deficit look worse,2017-02-21T22:30:03Z)

Amazon brings free shipping minimum back down to $35,2017-02-21T22:01:33Z
0.94 (Amazon; brings; free shipping minimum; back down to $35,2017-02-21T22:01:33Z)

"Move over, Amazon: Here comes Walmart",2017-02-21T18:36:17Z
0.59 (Here; comes; Walmart)

Retailers report; Central bank chatter; Stock rally resumes?,2017-02-21T10:13:17Z
0.66 Context(Stock rally resumes,List([40, 59))):(Retailers; report; )
0.75 (Stock rally; resumes; )

"Earnings, earnings and more earnings; Can the Trump rally continue?",2017-02-19T12:51:38Z

Tracy Morgan happy he was hit by Walmart truck,2017-02-17T17:55:37Z
0.50 (he; was hit; by Walmart truck)

Suspect in Orlando officer's killing indicted,2017-02-15T21:22:18Z
0.80 (Orlando officer's; killing; )

Here's what Warren Buffett bought and sold last quarter,2017-02-14T22:41:31Z
0.60 (Here; 's; what sold last quarter , 2017-02-14T22:41:31Z)
0.75 Context(Here 's,List([0, 7))):(Warren Buffett; bought; )
0.60 (Here; 's; what Warren Buffett bought , 2017-02-14T22:41:31Z)

Trump's 'phenomenal' tax reform,2017-02-10T18:46:53Z
0.16 (Trump 's tax reform; has phenomenal of; 2017 -02 -10t18:46:53z)

Sears gets new lifeline and stock soars,2017-02-10T14:26:56Z
0.95 (Sears; gets; stock soars; 2017-02-10T14:26:56Z)
0.94 (Sears; gets; new lifeline , 2017-02-10T14:26:56Z)

Here's why Amazon might buy a big retailer,2017-02-09T16:51:45Z
0.90 Context(Here 's,List([0, 6))):(Amazon; might buy; a big retailer; T:2017-02-09T16:51:45Z)
0.60 (Here; 's; why Amazon might buy a big retailer,2017-02-09T16:51:45Z)

Is Sears toast? Retailer's stock hits all-time low,2017-02-08T18:35:05Z
0.95 (Retailer's stock; hits; all-time low)

Florida man wanted in 4 killings is dead; companion arrested,2017-02-07T15:56:44Z
0.66 (companion; arrested; )

"Republican elders float carbon tax, plan White House lobbying campaign",2017-02-08T00:00:05Z
0.92 (Republican elders; float; carbon tax, plan White House lobbying campaign)

Macy's may be bought by owner of Saks and Lord & Taylor,2017-02-03T16:20:44Z
0.94 (Macy 's; may be bought; by owner of Taylor)
0.94 (Macy 's; may be bought; by owner of Lord)
0.94 (Macy 's; may be bought; by owner of Saks)

A fight is coming over the border adjustment tax,2017-02-02T21:26:02Z
0.90 (A fight; is coming; over the border adjustment tax,2017-02-02T21:26:02Z)

#AdiosStarbucks: Mexicans threaten to boycott American goods,2017-02-02T17:40:44Z
0.90 Context(# AdiosStarbucks threaten,List([0, 34))):(#AdiosStarbucks; threaten to boycott; American goods)
0.90 (#AdiosStarbucks; threaten; to boycott American goods)

Trump pi\xc3\xb1atas selling out in Mexico,2017-02-02T17:13:59Z
0.94 (Trump pi\xc3\xb1atas; selling out; L:in Mexico)

"Apple has $246 BILLION in cash, nearly all overseas",2017-02-01T15:39:33Z
1.00 (Apple; has; $ 246 billion)
0.94 (Apple; has; $246 BILLION in cash, nearly all overseas)

Brenham,2017-01-30T20:16:29Z

Anti-Muslim hate crimes: Ignorance in action?,2017-01-30T17:03:03Z

A 20% Mexico tariff would pay for the wall. But it would hurt Americans,2017-01-26T23:19:26Z
0.50 (it; would hurt; Americans)
0.94 (A 20 % Mexico tariff; would pay; for the wall)

Chinese giant buys U.S. firm that does Mexico money transfers,2017-01-26T16:46:00Z
0.93 (U.S. firm; does; Mexico money transfers)
0.92 (Chinese giant; buys; U.S. firm)

"Kroger is hiring 10,000 workers",2017-01-24T13:51:55Z
1.00 (Kroger; is hiring; 10000 workers ")
0.92 (Kroger; is hiring; 10,000 workers)

Where Trump support and Obamacare use soar together,2017-01-24T09:01:32Z
0.93 (Obamacare use; soar together; 2017-01-24T09:01:32Z)
0.93 (Trump support use; soar together; 2017-01-24T09:01:32Z)

Slain Orlando police officer's car vandalized,2017-01-20T21:39:41Z
0.85 (Slain Orlando police officer's car; vandalized; )

Judge denies bond for suspect on Orlando police shooting charges,2017-01-20T16:39:58Z
0.93 (Judge; denies; bond; for suspect on Orlando police shooting charges)

The week in 29 photos,2017-01-20T02:51:49Z

Fallen officers: 4 killed in the line of duty in 2017,2017-01-20T10:43:04Z
0.16 (officers; have Fallen of; 4)
0.43 (4; killed; L:in the line of duty in 2017,2017-01-20T10:43:04Z)

Suspect in Orlando cop killing hurt; police chief says he resisted arrest,2017-01-19T15:16:16Z
0.40 Context(police chief says,List([37, 54))):(he; resisted; arrest)
0.83 (police chief; says; he resisted arrest,2017-01-19T15:16:16Z)
0.93 (Orlando cop; killing; hurt)

"Trump scores PR win against automakers, but can he take credit for the jobs?",2017-01-18T18:04:12Z
1.00 (Trump scores PR; win; 2017 -01 -18t18:04:12z)
0.93 (Trump scores PR; win; 2017-01-18T18:04:12Z)
0.93 (Trump scores PR; win; against automakers)

Trump as job creator -- hope or hoax?,2017-01-19T00:28:30Z

The biggest winners and losers from Trumponomics,2017-01-18T18:44:20Z

Can Trump take credit for new jobs?,2017-01-18T13:51:20Z

"Suspect in cop killing captured, Orlando police say",2017-01-18T00:23:09Z
1.00 (Orlando police; say; 2017 -01 -18t00:23:09z)
0.94 (Suspect in cop; say; Orlando police)
0.56 (cop; killing captured; )

Orlando police shooting: Markeith Loyd stays out of reach,2017-01-16T09:21:34Z
0.94 (Markeith Loyd; stays; out of reach; 2017-01-16T09:21:34Z)

Trump trade talk sends dollar lower,2017-01-17T16:51:29Z
0.93 (Trump trade talk; sends; dollar; lower)

A pitch to CEOs on health care -- lead with your wallets,2017-01-17T19:21:12Z
0.87 (A pitch to CEOs on health care; lead; with your wallets)

"GM to invest $1 billion in U.S. plants, add or keep 7,000 jobs",2017-01-17T13:34:18Z
1.00 (GM; to invest; $ 1 billion)
0.79 (GM; to keep; 7,000 jobs)
0.53 (GM; to add; )
0.88 (GM; to invest; $1 billion in U.S. plants)

"Walmart adding 10,000 U.S. jobs",2017-01-17T13:01:07Z
1.00 (Walmart; adding; 10000 u.s. jobs ")
0.93 (Walmart; adding; 10,000 U.S. jobs; 2017-01-17T13:01:07Z)

Orlando officer Debra Clayton remembered as a difference-maker,2017-01-15T02:53:59Z
0.88 (Debra Clayton; [is] officer [of]; Orlando)
0.94 (Orlando officer Debra Clayton; remembered; as a difference-maker)

Jamie Dimon is hopeful about Donald Trump,2017-01-13T13:55:04Z
0.95 (Jamie Dimon; is; hopeful about Donald Trump,2017-01-13T13:55:04Z)

