"b""Tad Cummins, former Tennessee teacher, sentenced to 20 years in student's kidnapping""",2019-01-16T23:12:42Z
"b""The painstaking steps Jayme Closs' abductor says he took to kidnap her""",2019-01-15T11:22:54Z
"b'Women could boost the global economy, but outdated laws are holding them back'",2019-01-15T18:54:13Z
b'Microsoft and Walgreens join forces to take on Amazon in health care',2019-01-15T18:33:12Z
b'Survivors of kidnapping show the way ahead for Jayme Closs',2019-01-11T12:21:33Z
b'Your A-Z guide to the best Cyber Week sales happening right now',2018-11-23T04:42:24Z
"b""Why a wacky discount store is buying up the remains of Toys 'R' Us""",2019-01-11T15:15:55Z
"b""What's moving markets today""",2019-01-10T13:13:12Z
"b""Here's the endgame for Sears. It doesn't look good""",2019-01-10T15:01:56Z
"b""How Kirkland Signature powers Costco's success""",2019-01-10T14:39:45Z
"b""China's Baidu will help deliver Walmart groceries in self-driving vans""",2019-01-09T13:05:59Z
"b""Second suspect will face murder charge in connection with Jazmine Barnes' killing""",2019-01-08T20:43:35Z
b'Sears reaches 11th hour deal to stay in business -- for now',2019-01-08T16:56:59Z
b'Shattered community says goodbye to 7-year-old Jazmine Barnes',2019-01-08T10:52:26Z
b'How the government shutdown is affecting Americans',2019-01-05T15:23:46Z
b'The best Xbox One deals and savings this Black Friday',2018-11-23T04:55:48Z
b'Kroger and Microsoft partner up to take on Amazon',2019-01-07T18:31:46Z
"b""Alleged driver in 7-year-old's killing to be held without bail""",2019-01-07T13:05:23Z
"b'If Sears survives, this is what it will look like'",2019-01-06T12:47:02Z
"b""Prosecutors name the second suspect in Jazmine Barnes' killing""",2019-01-06T14:23:48Z
b'This family thought their troubles were over. Then the government shutdown left them in limbo.',2019-01-06T10:27:57Z
b'Man faces charge in drive-by killing of Jazmine Barnes',2019-01-06T04:51:54Z
b'5 people who inspired us in 2018 -- and the impact they continue to have',2018-12-23T08:06:24Z
"b""Jazmine Barnes shooting: A convenience store run shatters a family's life""",2019-01-05T22:17:12Z
b'Community rallies for justice in shooting death of 7-year-old Jazmine Barnes',2019-01-05T21:38:53Z
b'Attorney and activist offer reward in Texas drive-by shooting that killed 7-year-old',2019-01-03T02:13:49Z
"b'Sheriff says no breaks in the case of the shooting death of a 7-year-old girl, but tips coming in'",2019-01-02T16:10:42Z
"b""Retail's Amazon antidote: Buy online, pickup in store""",2018-12-29T17:02:08Z
b'Texas dad pleads for help in finding gunman who killed 7-year-old girl',2018-12-31T15:26:33Z
b'Mom speaks after child is killed in drive-by',2019-01-01T20:43:56Z
b'The best stocks of 2018',2018-12-31T15:01:51Z
b'The worst stocks of 2018',2018-12-31T14:56:40Z
b'Crunch time for Sears: More store closings and a last-minute bid to save company',2018-12-28T20:23:42Z
"b""Secret Santas across the country have paid off more than $130,000 in Walmart customers' layaway items""",2018-12-05T22:31:22Z
b'India just made life tougher for Amazon and Walmart',2018-12-27T13:28:24Z
b'US futures down; India and Amazon; Investor nerves',2018-12-27T10:32:47Z
b'Bigger paychecks and cheap gas drive best holiday shopping season in six years',2018-12-26T17:26:35Z
b'Shoppers are spending but it may not last',2018-12-22T18:10:35Z
"b'New York Times reports Southwest Key subject of probe, but shelter provider says no contact with feds'",2018-12-21T23:08:16Z
b'Planned Parenthood and others respond to accusations that they mistreated pregnant employees',2018-12-21T04:08:25Z
b'Man who spent 17 years in prison for crime his doppelganger committed gets $1.1M',2018-12-19T22:00:09Z
b'Minnesota prosecutors weigh sexual assault charges against Chinese billionaire tech executive',2018-12-19T17:43:12Z
b'Check your fridge and pantry for food products recalled this week',2018-12-15T02:26:22Z
b'Free Shipping Day starts Friday  \xe2\x80\x94 here are some top retailers participating this year',2018-12-10T20:44:01Z
"b""Costco: Retail's overlooked holiday winner""",2018-12-13T16:23:16Z
"b""Google is wading into India's huge online shopping market""",2018-12-13T13:32:47Z
b'87 more cases of salmonella linked to recalled beef',2018-12-12T21:57:55Z
"b""Veteran investor says there's more to tech than FAANG""",2018-12-11T16:56:04Z
"b'5 things to know for December 10: Brexit, Khashoggi, White House, Nissan, Weather'",2018-12-10T11:05:21Z
b'Kid Rock pays off layaways for 350 families at Nashville Walmart',2018-12-09T11:51:41Z
b'What happened this week (in anything but politics)',2018-12-07T18:50:51Z
"b'Tyler Perry pays off more than $430,000 in layaways ahead of Christmas'",2018-12-06T21:07:48Z
"b'Star paid off more than $430,000 in layaways'",2018-12-07T16:40:56Z
b'Walmart turns to robots and apps in stores',2018-12-07T14:16:49Z
"b""Macron's top-down approach to fighting climate change serves as a cautionary tale""",2018-12-06T20:25:33Z
"b'Infant ibuprofen sold at CVS, Walmart and Family Dollar recalled'",2018-12-06T15:28:24Z
"b'5 things to know for December 6: NAFTA, Denmark, Wisconsin, Costa Rica, microplastics'",2018-12-06T11:06:08Z
b'An anonymous man calling himself Santa picked up the tab for Walmart customers in Vermont',2018-11-20T22:32:21Z
b'Unilever is spending billions to boost its India presence',2018-12-03T11:43:56Z
b'Trump and Xi celebrate warm talks but remain far away from a final deal on trade',2018-12-02T20:19:26Z
b'Sen. Elizabeth Warren outlines foreign policy vision amid 2020 speculation',2018-11-29T23:29:03Z
"b""Here's one market Amazon can't easily crack: Car parts""",2018-11-29T14:42:54Z
"b""She wore a Confederate flag to vote, then she laid it on a civil rights leader's grave""",2018-11-28T12:11:52Z
b'Republican Cindy Hyde-Smith wins Mississippi US Senate runoff amid racial controversies',2018-11-28T03:28:55Z
"b""Mississippi Senate runoff: Here's what you need to know""",2018-11-27T15:36:04Z
b'Trump tests his dealmaking powers in trade showdown with Xi',2018-11-28T00:32:08Z
b'Why Amazon could win the battle for holiday toy sales',2018-11-27T19:37:18Z
"b""Mississippi's US Senate race comes to a close amid racial controversies""",2018-11-27T05:59:53Z
b'Retailers cash in on Black Friday and Cyber Monday spending',2018-11-27T13:20:44Z
"b""My journey from India's Silicon Valley to its 'no network' zone""",2018-11-27T03:10:37Z
b'President Trump holds rallies in Mississippi',2018-11-26T19:34:21Z
b'Trump dims hopes of China trade deal with fresh tariff threat on Apple phones',2018-11-26T23:34:52Z
"b""The cuts at GM are tough. The company's future without them would be even tougher""",2018-11-26T21:24:27Z
"b""Hyde-Smith accuses Democrats of trying to turn 'hanging' comment into a 'political weapon'""",2018-11-21T03:07:43Z
b'Your A-Z guide for the best Cyber Monday sales happening right now',2018-11-26T05:07:03Z
"b""What's at stake on Cyber Monday""",2018-11-25T18:58:23Z
"b""Mississippi Sen. Cindy Hyde-Smith pushed resolution praising Confederate soldier's effort to 'defend his homeland'""",2018-11-25T01:40:01Z
b'An argument at a Florida Walmart leads to gunfire and a woman is killed',2018-11-25T01:28:29Z
b'Argument at FL Walmart leads to fatal shooting',2018-11-25T16:25:36Z
b'Black Friday sales could hit a record $23 billion',2018-11-23T20:10:11Z
"b""Heavy rains douse California's deadliest wildfire and pose new dangers""",2018-11-23T08:21:15Z
"b'The Camp Fire forced them from their homes. So, strangers brought Thanksgiving to them'",2018-11-23T13:53:44Z
"b""Inside China's Silicon Valley: From copycats to innovation""",2018-11-23T02:37:42Z
b'What to expect from Black Friday',2018-11-21T20:40:23Z
b'Rain could trigger mudslides in California communities already destroyed by fires',2018-11-22T11:00:41Z
"b""How Black Friday shopping could change if Trump's trade war goes on""",2018-11-22T19:44:03Z
"b""Quickly catch up on the day's news""",2018-11-22T17:28:49Z
"b""15 discounts and deals you'll want to snag right now during Walmart's Black Friday sale""",2018-11-22T16:44:52Z
b'What happened this week (in anything but politics)',2018-11-22T16:18:43Z
b'Number of people accounted for rises as rain threatens areas scarred by Camp Fire',2018-11-21T09:31:35Z
b'Walmart urges Camp Fire evacuees to leave tent city for shelters',2018-11-22T01:47:41Z
"b""Quickly catch up on the day's news""",2018-11-21T18:05:32Z
"b""Walmart asks Mississippi's Hyde-Smith to return donation after 'public hanging' comment""",2018-11-20T17:43:03Z
b'The history of Black Friday',2018-11-21T14:34:54Z
"b""Walmart and Target seize on the first Black Friday without Toys 'R' Us""",2018-11-21T11:28:06Z
"b'5 things to know for November 21: Stocks, Zuckerberg, E. coli, Saudis, Nancy Pelosi'",2018-11-21T11:21:25Z
"b'With rain on the way, California fire evacuees brace for relief and danger'",2018-11-20T09:31:28Z
"b'Black Friday TV deals: Top discounts from Amazon, Walmart, Target and more'",2018-11-19T19:21:37Z
b'Photo surfaces of Cindy Hyde-Smith posing with Confederate artifacts',2018-11-20T22:05:43Z
"b""Target, Kohl's and TJX are hot, but Wall Street is worried about the holidays""",2018-11-20T15:25:54Z
"b'Rain will bring much-needed relief to California fires, but also new dangers'",2018-11-19T16:17:17Z
b'In pictures: Wildfires tear across California',2018-11-09T03:05:20Z
"b""The catastrophic Camp Fire isn't even halfway done burning, officials predict""",2018-11-18T11:18:30Z
b'Wildfire evacuees take refuge in Walmart parking lot',2018-11-18T18:17:17Z
b'Death toll from Camp Fire rises to 76 as searchers find five more remains',2018-11-17T17:44:53Z
b'Fire drove them out of their homes. Now they could be flooded out of their tent city.',2018-11-18T02:09:04Z
b'Californians find ways to help each other as deadly wildfires rage',2018-11-18T01:51:50Z
"b""Paradise lost: How California's deadliest wildfire unfolded""",2018-11-17T16:52:23Z
"b""'Do you have the paper?': Washington scrambles for details ahead of US-China trade talks""",2018-11-17T13:39:51Z
"b""Monopoly for Millennials is not about real estate because 'you can't afford it anyway,' Hasbro says""",2018-11-16T19:07:52Z
"b""Couple, homeless man accused of setting up GoFundMe campaign 'predicated on a lie'""",2018-11-15T19:51:59Z
b'Camp Fire death toll rises to 63 while missing list grows to 631 names',2018-11-15T09:52:11Z
b'Bernie Sanders unveils Stop Walmart Act',2018-11-15T21:48:19Z
b'Apple rebounds after 5-day stock slide',2018-11-15T15:34:32Z
b'3 things businesses can do to win the climate change fight',2018-11-15T16:47:14Z
b'Walmart surges heading into holidays',2018-11-15T12:30:42Z
b'Uber losses accelerate; China makes an offer; Brexit chaos',2018-11-15T09:50:56Z
b'Fire victims camp out in Walmart parking lot',2018-11-14T22:48:53Z
"b""How Mandy Moore and Taylor Goldsmith's 'This Is Us' collaboration happened""",2018-11-14T01:42:15Z
b'Bernie Sanders wants Walmart to raise worker wages',2018-11-13T23:43:10Z
b'Blue Apron announces more layoffs as sales sink',2018-11-14T15:03:59Z
b'Tencent earnings; Global slowdown; Oil stabilizes',2018-11-14T10:29:00Z
b'Home Depot posts strong sales despite real estate trends',2018-11-13T16:37:41Z
b'Setback for Walmart: Flipkart CEO resigns after misconduct investigation',2018-11-13T12:34:44Z
b'Tech rout; Amazon decides; Oil losses',2018-11-13T10:23:48Z
b'Did the White House really create 6.3 million new jobs?',2018-11-12T18:59:49Z
"b""Consumers are spending and it's not just at Walmart and Amazon""",2018-11-12T18:05:10Z
"b""SoftBank's mega IPO; Oil surges; Brexit hits the pound""",2018-11-12T10:23:15Z
"b""Wall Street loves gridlock. But gridlock isn't always great""",2018-11-11T12:09:44Z
"b""Progressive backlash against Amazon HQ2 is growing. Here's why""",2018-11-09T19:27:34Z
"b""White House adviser Navarro warns Wall Street 'globalists' over China""",2018-11-09T20:40:23Z
b'Biggest Amazon bulls think stock will go up another 40%',2018-11-09T16:36:46Z
"b""Walmart thinks shopping via text might be retail's next big thing""",2018-11-08T17:07:51Z
b'Election Night in the US',2018-11-06T11:00:22Z
"b'The suspect fought for the steering wheel before killing 3 Girl Scouts and a mom, prosecutor says'",2018-11-06T16:00:35Z
b'The dismantling of GE continues: It is selling yet another business',2018-11-06T18:16:30Z
b'Slurpee and go: 7-Eleven introduces mobile checkout',2018-11-05T17:59:42Z
b'Amazon offers free shipping on all orders for the holidays',2018-11-04T18:42:49Z
"b""Jet is going where Walmart can't""",2018-11-02T12:19:55Z
"b'From book clubs to cookware, BuzzFeed finds new ways to make money'",2018-10-31T20:45:01Z
b'Amazon undercuts Casper with its own new mattresses',2018-10-31T18:35:28Z
"b""Warren Buffett's bets haven't paid off in 2018 -- but he's still beating the market""",2018-10-31T16:23:24Z
"b""Walmart's plan to win the holidays: Faster checkouts and a simpler website""",2018-10-30T04:02:14Z
b'What this organic baby food company is doing to help working mothers',2018-10-29T17:06:20Z
"b""Best Buy expands its toy section in a fight for Toys 'R' Us' customers""",2018-10-29T15:29:19Z
"b""Walmart is testing a cashierless Sam's Club""",2018-10-29T15:07:13Z
b'Check your kitchen for these recalled foods',2018-10-27T13:44:52Z
"b""Don't sweat Amazon's weak holiday sales forecast""",2018-10-26T15:41:38Z
"b""Here's how many times Trump attacked pipe bomb targets""",2018-10-25T20:25:21Z
b'Amazon is investing millions to keep packaging out of landfills',2018-10-26T14:17:31Z
b'Kellyanne Conway: We can bring the opioid crisis to an end',2018-10-26T12:15:39Z
b'63 more cases of salmonella linked to recalled raw beef',2018-10-24T23:13:30Z
b'Microsoft up on sales jump even as market falls',2018-10-24T20:40:15Z
b'Trump signs opioids law at White House event',2018-10-24T17:04:42Z
b'Amazon can sell you stuff. But can it clean your house?',2018-10-24T13:59:51Z
"b""Walmart and Target are trying to capitalize on Trader Joe's 'Two-Buck Chuck' success""",2018-10-23T12:53:06Z
"b""Things are bad at Sears. They're worse at Kmart""",2018-10-21T17:16:02Z
"b""Walmart's strategy to solve the Amazon puzzle is working""",2018-10-19T13:16:56Z
"b'Why midterm candidates are ditching red, white, and blue campaign logos'",2018-10-20T12:07:51Z
"b""Quickly catch up on the day's news""",2018-10-19T18:08:04Z
b'Hedge funds have killed Sears and many other retailers',2018-10-16T18:12:54Z
b'Instacart is now valued at $7 billion',2018-10-16T15:20:57Z
b'Decades of bad decisions doomed Sears',2018-10-16T11:19:06Z
b'Walmart trims profit outlook after Flipkart purchase',2018-10-16T11:45:18Z
"b""It's time for Netflix to prove it's still the king""",2018-10-15T19:45:18Z
"b'Sears, the store that changed America, declares bankruptcy'",2018-10-15T05:10:38Z
"b""Sears' slow death is a gift to Walmart and Home Depot""",2018-10-15T12:28:40Z
b'Retailers wake up to opportunity in plus-size clothing',2018-10-13T12:35:58Z
"b""Michael's death toll rises to 17, including 8 in Florida""",2018-10-12T08:39:01Z
b'What happened this week (in anything but politics)',2018-10-12T19:52:41Z
"b""Hurricane Michael's aftermath""",2018-10-08T13:37:24Z
"b'5 days, $1 billion: Flipkart and Amazon spur Indian smartphone bonanza'",2018-10-12T11:28:53Z
"b""5 things to know for October 12: Tropical Storm Michael, missing journalist, Georgia governor's race, cardinal's resignation""",2018-10-12T10:20:29Z
"b'Walmart taps MGM, startup to beef up its streaming video service'",2018-10-11T16:18:38Z
b'Media bigwigs converge in L.A. for Vanity Fair summit',2018-10-10T04:30:37Z
b'FAO Schwarz is making a comeback',2018-10-09T16:58:11Z
"b'The high-risk, high-reward world of selling stuff on Amazon'",2018-10-09T12:00:39Z
b'Who needs brand names? Now Amazon makes the stuff it sells',2018-10-08T10:25:46Z
b'Staffing up for the holidays was already tough. Then came Amazon',2018-10-08T10:07:49Z
b'Check your fridge and garage for all these things recalled this week',2018-10-06T15:46:34Z
"b""This is blockchain and here's why it matters""",2018-10-03T23:42:42Z
b'How Casper drove Mattress Firm into bankruptcy',2018-10-06T12:49:54Z
b'6.5 million pounds of beef recalled due to salmonella outbreak',2018-10-04T12:43:30Z
"b""It's Amazon's world. We just live in it.""",2018-10-04T00:25:56Z
b'Amazon eliminates bonuses and stock awards for hourly workers',2018-10-04T11:36:27Z
"b""Why there might not be another TV blockbuster like 'Game of Thrones'""",2018-10-03T20:42:29Z
"b""Costco's secret weapon: Food courts and $1.50 hot dogs""",2018-10-04T10:02:48Z
b'Amazon announces $15 minimum wage for all US employees',2018-10-02T20:28:55Z
b'I spent 53 minutes in Amazon Go and saw the future of retail',2018-10-03T20:22:40Z
b'Amazon announces $15 minimum wage for all US employees',2018-10-02T10:09:41Z
b'How Walmart is taking on Amazon',2018-10-02T18:40:47Z
b'Amazon will now let Indians shop in Hindi',2018-09-30T16:50:37Z
b'Amazon vs. Walmart: The fight for India is just beginning',2018-09-30T16:43:44Z
b'Aldi is going granola to compete with Whole Foods',2018-09-30T15:10:01Z
b'How innovation helped save Detroit',2018-09-30T15:05:06Z
b'How Amazon plans to battle Walmart in India',2018-09-30T13:52:34Z
"b'AT&T, fresh off its WarnerMedia deal, unveils new advertising business'",2018-09-26T02:12:55Z
b'Sears is now a penny stock',2018-09-28T16:25:25Z
"b""How America's 'ground-zero' for modern slavery was cleaned up by workers' group""",2017-05-30T09:47:01Z
"b'JUST CEO Josh Tetrick created vegan mayo. Now, he wants to end world hunger'",2018-09-27T21:14:02Z
b'How it all went wrong at JCPenney',2018-09-27T17:16:09Z
b'Federal Reserve hikes rates for third time this year',2018-09-26T18:01:24Z
"b""The Texan's Texas: Easygoing Brenham""",2017-01-31T12:24:58Z
"b""There's a big push in 2018 to get young people to register to vote""",2018-09-25T13:54:00Z
"b""Trump's trade war with China just got a whole lot bigger""",2018-09-23T16:01:44Z
"b'Corporate America, not banks, could cause the next recession'",2018-09-23T11:40:15Z
b'US-China trade talks stall amid tariff standoff',2018-09-22T16:20:04Z
"b'Walmart discriminated against pregnant workers, federal agency says'",2018-09-21T19:35:26Z
b'The trade war reaches Procter & Gamble -- and into the medicine cabinet',2018-09-21T11:43:23Z
b'How Amazon plans to battle Walmart in India',2018-09-20T16:05:20Z
b'Walmart is where the trade war comes home',2018-09-19T14:20:41Z
"b""Walmart wants to bring its 'everyday low prices' to health care""",2018-09-19T11:54:20Z
b'Visa and MasterCard agree to settle swipe fee class action for $6.2 billion',2018-09-18T14:07:27Z
"b""A blue wave you haven't heard about""",2018-09-16T15:40:42Z
b'How Costco thrives in the Amazon era',2018-09-14T20:07:03Z
"b""Grocery stores aren't dead, but they need help with real-time data""",2018-09-13T13:00:54Z
b'Why Walmart is giving Jet.com a fancy makeover',2018-09-13T10:21:06Z
b'IBM is betting big on blockchain technology. Is it worth the risk?',2018-09-06T12:46:39Z
"b'Florence upgraded to hurricane, heads toward East Coast'",2018-09-09T10:26:38Z
"b""Apple's iPhone is the MVP of the stock market""",2018-09-09T12:00:55Z
"b'By calling Jeff Sessions a dumb Southerner, Trump has done the impossible'",2018-09-05T14:36:33Z
b'Activist investor wants to replace entire Campbell Soup board',2018-09-07T15:55:21Z
"b""Bernie Sanders' 'Stop BEZOS' bill targets worker pay at Amazon and Walmart""",2018-09-05T23:42:14Z
"b""Walmart wants to replace Toys 'R' Us""",2018-08-30T21:10:48Z
b'What Ellen DeGeneres means to Walmart',2018-09-05T15:49:38Z
b'Amazon will now let Indians shop in Hindi',2018-09-05T11:23:46Z
b'Jeff Bezos donates $10 million to group that help veterans get elected',2018-09-05T11:37:11Z
b'JD.com CEO Richard Liu was arrested on suspicion of rape',2018-09-05T04:55:17Z
"b'Amazon is now worth $1,000,000,000,000'",2018-09-04T14:20:15Z
b'How Richard Liu built JD.com into a $45 billion tech giant',2018-09-04T09:39:32Z
b'Chinese billionaire Richard Liu released after US arrest',2018-09-02T23:39:18Z
b'Your cheat sheet for the best Labor Day deals happening right now',2018-09-01T22:41:02Z
"b""Amazon defends itself from Bernie Sanders' attacks""",2018-08-29T17:12:36Z
b'He went to prison for a crime a lookalike may have done. Now he wants $1.1 million',2018-08-31T17:30:09Z
b'Why Dollar General thrives even in a hot economy',2018-08-30T16:41:06Z
b'Campbell is moving forward by going back',2018-08-30T10:48:03Z
b'How it all went wrong at JCPenney',2018-08-29T14:21:09Z
b'Amazon-Whole Foods one year later: The grocery business will never be the same',2018-08-28T18:47:11Z
"b""Best Buy makes all the right moves, but Wall Street isn't sold""",2018-08-28T16:22:51Z
"b'Warren Buffett is investing in Paytm, his first Indian company'",2018-08-27T12:33:02Z
"b""This small company liked Trump's tariffs. Now it's fighting to keep its factory open""",2018-08-24T19:28:49Z
b'Two lawyers. One court. And their fight against the odds.',2018-08-24T12:44:32Z
"b""The 30 most astounding moments in Rep. Duncan Hunter's 47-page indictment""",2018-08-22T14:55:20Z
"b""Target's new strategy is paying off big time""",2018-08-22T10:43:23Z
b'Rep. Duncan Hunter and his wife indicted in use of campaign funds for personal expenses',2018-08-21T22:11:52Z
"b""How crazy rich are Asia's wealthiest families?""",2018-08-22T12:55:40Z
b'How Costco thrives in the Amazon era',2018-08-21T13:34:44Z
b'Nordstrom racks up big gain in digital sales',2018-08-16T21:25:48Z
b'Escape from the Mayo Clinic: Parents break teen out of world-famous hospital',2018-08-13T09:34:17Z
b'Walmart sales growth was the best in a decade',2018-08-16T13:47:50Z
"b""This program is helping Kentucky's food stamp recipients find jobs""",2018-08-16T15:39:45Z
"b""JCPenney's latest results were absolutely dreadful""",2018-08-16T15:37:23Z
b'Aldi is going granola to compete with Whole Foods',2018-08-16T12:04:12Z
b'Retail earnings; Tencent pain; Cisco surge',2018-08-16T09:03:55Z
"b""Macy's momentum may be starting to slow""",2018-08-15T15:16:18Z
b'Turkey hits back; Tencent earnings; Sears offer',2018-08-15T08:50:28Z
b'Autonomous vehicles are coming. Now comes the hard part.',2018-08-15T04:01:24Z
"b""Kroger's next battleground: China""",2018-08-14T22:57:17Z
b'Consumers spent big at Home Depot',2018-08-14T14:27:45Z
"b""Icahn backs off; Tencent's troubles; More from Musk""",2018-08-14T09:15:49Z
b'Lee and Wrangler jeans get the boot as VF Corp moves to Denver',2018-08-13T15:49:22Z
b'Crisis in Turkey; Global fallout; Bayer pain',2018-08-13T09:01:08Z
b'Americans are spending like crazy. Can the good times last?',2018-08-12T11:06:03Z
b'Walmart is giving less shelf space to Twinkies. Hostess falls 16%',2018-08-08T19:20:50Z
"b""Beards are back. That's bad news for Gillette""",2018-08-08T15:17:45Z
b'Another Prime perk at Whole Foods: Curbside pickup',2018-08-08T11:15:44Z
b'Walmart cashier praised for heartfelt move',2018-08-06T22:41:21Z
b'Why grocery stores will win the meal kit wars',2018-08-06T19:32:18Z
"b'In the Senate, the August recess will be missed'",2018-08-05T12:07:05Z
"b""Kraft Heinz reports tasty sales but Campbell Soup rumors won't die""",2018-08-03T16:00:49Z
b'Trump keeps up attacks against billionaire Charles Koch',2018-08-02T11:57:06Z
"b""Macy's stock is doing almost as well as Amazon""",2018-08-02T16:04:48Z
b'Champion is ending a popular line at Target',2018-08-01T18:13:41Z
b'Kroger launches online grocery delivery service',2018-08-01T15:46:06Z
b'Why Campbell Soup might go up for sale',2018-08-01T16:34:51Z
b'Pampers and Charmin are getting more expensive',2018-07-31T18:04:40Z
"b""711 kids in custody haven't been reunited with their parents. What happens to them now?""",2018-07-28T06:36:13Z
b'Mississippi police department fires cop who used stun gun on handcuffed man',2018-07-28T00:19:49Z
"b""The full story on Trump's 'economic turnaround'""",2018-07-27T20:39:16Z
b'These foods linked to ongoing outbreaks might make you sick',2018-07-20T15:26:47Z
"b'5 things for July 26: White House, Syria, Facebook, Toronto shooting, Mars'",2018-07-26T10:11:55Z
"b""Amazon's next move: Managing your money?""",2018-07-25T17:45:34Z
b'Walmart will chauffeur shoppers in self-driving Waymo cars',2018-07-25T15:58:10Z
b'How Netflix beat its rivals and survived the 2000s',2018-07-24T19:52:53Z
b'Chick-fil-A is getting into the meal kit business',2018-07-23T21:59:16Z
"b""Hasbro adjusts to life without Toys 'R' Us and stock soars""",2018-07-23T17:25:16Z
"b""Microsoft's cloud bet pushes annual sales over $100 billion""",2018-07-19T21:51:53Z
b'Employers commit to train 3.8 million workers under Trump executive order',2018-07-19T21:44:25Z
b'PACIFIC \xe2\x80\xa2 Scoop: Reed Hastings Is Writing a Netflix Book',2018-07-18T14:29:59Z
b'Disney would dominate the US box office if it buys Fox',2018-07-11T20:34:16Z
b'PACIFIC \xe2\x80\xa2 Reed Hastings Loses His Rubber Stamp',2018-07-17T15:48:41Z
"b""Trump's fast and loose trade policy endangers American jobs""",2018-07-17T13:35:45Z
b'Walmart and Microsoft team up to fight Amazon',2018-07-17T12:08:02Z
b'How innovation helped save Detroit',2018-07-14T19:15:15Z
b'Why Prime Day is important to Amazon',2018-07-15T11:28:53Z
b'The new GE still faces many old problems',2018-07-15T11:23:03Z
"b'Insults, fighting, shouting: Strzok hearing boils over'",2018-07-13T00:41:16Z
