"b""Fallen angels? Victoria's Secret sales plunge""",2017-02-23T16:27:47Z
b'These 10 stocks dominate the market',2017-02-22T18:25:06Z
b'How Trump could make the trade deficit look worse',2017-02-21T22:30:03Z
b'Amazon brings free shipping minimum back down to $35',2017-02-21T22:01:33Z
"b'Move over, Amazon: Here comes Walmart'",2017-02-21T18:36:17Z
b'Retailers report; Central bank chatter; Stock rally resumes?',2017-02-21T10:13:17Z
"b'Earnings, earnings and more earnings; Can the Trump rally continue?'",2017-02-19T12:51:38Z
b'Tracy Morgan happy he was hit by Walmart truck',2017-02-17T17:55:37Z
"b""Suspect in Orlando officer's killing indicted""",2017-02-15T21:22:18Z
"b""Here's what Warren Buffett bought and sold last quarter""",2017-02-14T22:41:31Z
"b""Trump's 'phenomenal' tax reform""",2017-02-10T18:46:53Z
b'Sears gets new lifeline and stock soars',2017-02-10T14:26:56Z
"b""Here's why Amazon might buy a big retailer""",2017-02-09T16:51:45Z
"b""Is Sears toast? Retailer's stock hits all-time low""",2017-02-08T18:35:05Z
b'Florida man wanted in 4 killings is dead; companion arrested',2017-02-07T15:56:44Z
"b'Republican elders float carbon tax, plan White House lobbying campaign'",2017-02-08T00:00:05Z
"b""Macy's may be bought by owner of Saks and Lord & Taylor""",2017-02-03T16:20:44Z
b'A fight is coming over the border adjustment tax',2017-02-02T21:26:02Z
b'#AdiosStarbucks: Mexicans threaten to boycott American goods',2017-02-02T17:40:44Z
b'Trump pi\xc3\xb1atas selling out in Mexico',2017-02-02T17:13:59Z
"b'Apple has $246 BILLION in cash, nearly all overseas'",2017-02-01T15:39:33Z
b'Brenham',2017-01-30T20:16:29Z
b'Anti-Muslim hate crimes: Ignorance in action?',2017-01-30T17:03:03Z
b'A 20% Mexico tariff would pay for the wall. But it would hurt Americans',2017-01-26T23:19:26Z
b'Chinese giant buys U.S. firm that does Mexico money transfers',2017-01-26T16:46:00Z
"b'Kroger is hiring 10,000 workers'",2017-01-24T13:51:55Z
b'Where Trump support and Obamacare use soar together',2017-01-24T09:01:32Z
"b""Slain Orlando police officer's car vandalized""",2017-01-20T21:39:41Z
b'Judge denies bond for suspect on Orlando police shooting charges',2017-01-20T16:39:58Z
b'The week in 29 photos',2017-01-20T02:51:49Z
b'Fallen officers: 4 killed in the line of duty in 2017',2017-01-20T10:43:04Z
b'Suspect in Orlando cop killing hurt; police chief says he resisted arrest',2017-01-19T15:16:16Z
"b'Trump scores PR win against automakers, but can he take credit for the jobs?'",2017-01-18T18:04:12Z
b'Trump as job creator -- hope or hoax?',2017-01-19T00:28:30Z
b'The biggest winners and losers from Trumponomics',2017-01-18T18:44:20Z
b'Can Trump take credit for new jobs?',2017-01-18T13:51:20Z
"b'Suspect in cop killing captured, Orlando police say'",2017-01-18T00:23:09Z
b'Orlando police shooting: Markeith Loyd stays out of reach',2017-01-16T09:21:34Z
b'Trump trade talk sends dollar lower',2017-01-17T16:51:29Z
b'A pitch to CEOs on health care -- lead with your wallets',2017-01-17T19:21:12Z
"b'GM to invest $1 billion in U.S. plants, add or keep 7,000 jobs'",2017-01-17T13:34:18Z
"b'Walmart adding 10,000 U.S. jobs'",2017-01-17T13:01:07Z
b'Orlando officer Debra Clayton remembered as a difference-maker',2017-01-15T02:53:59Z
b'Jamie Dimon is hopeful about Donald Trump',2017-01-13T13:55:04Z
"b""'She believed in helping people': Remembering Master Sgt. Debra Clayton""",2017-01-13T14:01:48Z
"b'Orlando manhunt: Three arrested, tips pour in'",2017-01-12T03:45:07Z
b'Hostess is hotter than a deep fried Twinkie',2017-01-12T15:05:29Z
b'Orlando tragedy: Two officers remembered',2017-01-10T01:58:18Z
"b'5 things for Wednesday, January 11, 2017: Barack Obama, Donald Trump, Dylann Roof'",2017-01-11T11:28:56Z
"b'Orlando: Manhunt for suspected cop killer expands; reward now $100,000'",2017-01-10T09:24:39Z
b'The Obama bull market: A 140% jump in the Dow',2017-01-10T15:34:33Z
"b'5 things for Tuesday, January 10, 2017: Orlando manhunt, Jeff Sessions, Donald Trump'",2017-01-10T11:48:00Z
"b""Orlando police officer shot to death; sheriff's deputy dies during manhunt""",2017-01-09T15:19:06Z
b'Bernie Sanders: We need serious talk on serious issues',2017-01-09T20:42:18Z
"b""Smerconish vows to 'burst my bubble' in 2017""",2017-01-07T17:22:41Z
b'Classic Joe Biden',2017-01-06T21:11:30Z
"b""Amazon worth more than Sears, Macy's and Target combined""",2017-01-06T17:02:15Z
b'Ford: F-series is best-selling truck for 40 years',2017-01-04T16:44:54Z
b'Trump and trade: What you need to know before he takes office',2016-12-29T18:16:40Z
b'Run-DMC sues Amazon and Walmart for $50 million',2016-12-30T15:47:26Z
b'Just how far will Trump go on China and Mexico?',2016-12-23T18:28:21Z
"b""The quest for 20,000; Retail's last stand; Trump tweet watch""",2016-12-25T13:03:46Z
b'Weak TV of 2016',2016-12-22T23:24:42Z
"b""'Make America White Again': Hate speech and crimes post-election""",2016-11-10T21:44:52Z
"b""Walmart pulls 'Bulletproof' Black Lives Matter items after police object""",2016-12-21T18:36:47Z
"b""Today's Dow is a lot different from just 20 years ago""",2016-12-21T16:51:37Z
b'Walmart trims its Christmas Eve hours',2016-12-20T15:53:30Z
b'2016 in review: The revenge of the forgotten',2016-12-19T08:07:06Z
"b""Tillerson nomination puts ExxonMobil's gay rights record in the spotlight""",2016-12-13T17:58:29Z
b'Secret Santa pays off $46K in layaway at PA Walmart',2016-12-10T02:11:02Z
"b""'Secret Santa' pays off 194 layaway accounts""",2016-12-10T01:49:02Z
b'Good to be on Trump blacklist. Stocks he bashed soar',2016-12-09T16:54:48Z
b'Fireman goes beyond the call with surprise phone call',2016-12-09T13:51:36Z
b'Escaped inmate sought in officer stabbing is back in custody',2016-12-08T11:50:16Z
"b""Walmart's Mexico unit to add 10,000 jobs""",2016-12-08T15:23:05Z
b'Google will hit a renewable energy milestone in 2017',2016-12-06T14:00:18Z
b'Walmart agrees to $7.5 million settlement in  discrimination suit',2016-12-03T00:54:19Z
b'Why I (still) want to run for office',2016-12-02T17:28:03Z
b'Trump taps top CEOs for their views on the economy',2016-12-02T15:51:49Z
b'3-year-old dies after tragic window blind cord accident',2016-12-01T16:10:33Z
"b'Ho ho ho! UPS, FedEx soar on holiday shopping hopes'",2016-12-01T15:34:46Z
b'Trump and Pence put on a show',2016-11-30T21:11:31Z
b'Ohio State University attack investigation: FBI asks public for help',2016-11-30T20:52:48Z
"b""Truck driver who hit Tracy Morgan's limo pleads guilty""",2016-11-30T01:10:04Z
b'America goes shopping: Crowds hit the stores for Black Friday 2016',2016-11-25T00:30:42Z
b'Cyber Monday deals are here',2016-11-28T16:53:18Z
b'Cyber Monday sales kick off',2016-11-28T16:03:20Z
b'How to find the best shopping deals among the clutter',2016-11-28T15:57:36Z
b'How to find the best shopping deals among the clutter',2016-11-23T14:00:29Z
b'Black Friday 2016: What time do the stores open?',2016-11-16T18:40:27Z
"b'Stunning! Dow hits new high of 19,000 as Trump rally continues'",2016-11-22T13:40:16Z
b'4 shopping apps for finding the best deals',2016-11-22T19:31:13Z
b'What people fight about on Thanksgiving',2014-11-24T21:46:34Z
b'Walmart is starting Cyber Week on Black Friday',2016-11-21T14:58:25Z
"b'You called, we listened: What thousands of voicemails reveal about the American voter'",2016-11-16T17:36:50Z
b'What time do the stores open on Black Friday?',2016-11-18T19:44:40Z
b'Shoppers guide to avoiding toxic chemicals',2016-11-17T16:58:13Z
b'Supermarkets get Trump bump. Food prices to jump?',2016-11-17T17:09:00Z
"b""Amazon's awful week: Trump wins, competition ratchets up""",2016-11-17T16:31:53Z
b'Schools on the front lines heal their wounds post-election',2016-11-16T13:12:32Z
b'Fed in focus; Back into bonds; Tracking U.S. dollar rally',2016-11-17T10:02:11Z
b'Target hits the mark and wows with holiday outlook',2016-11-16T14:16:45Z
"b'Dow nears 19,000; Nintendo jumps on Super Mario; Oil down'",2016-11-16T10:09:30Z
b'The secret costs of Islamophobia',2016-09-23T22:21:48Z
"b""Dow's record rally; Buffett buys airlines; Yuan in focus""",2016-11-15T10:22:27Z
b'Warren Buffett makes a bet on U.S. airlines',2016-11-14T23:07:32Z
"b""Stocks rally again; Bond market bombs; Japan's GDP surprise""",2016-11-14T10:01:01Z
"b""Megyn Kelly book release; 'Fantastic Beasts' release; Tesla-SolarCity meeting""",2016-11-13T13:02:24Z
"b'Walmart, Target, Best Buy roll out Black Friday deals'",2016-11-10T16:35:09Z
b'Amazon debuts Black Friday Deals site',2016-11-07T18:09:18Z
b'Hershey bar cost 2 cents when Cubs won 1908 World Series',2016-11-03T12:41:26Z
b'Amazon to customers: Start shopping',2016-11-01T13:01:32Z
b'Retailers drop Thanksgiving hours amid backlash',2016-10-28T18:56:47Z
b'Amazon brings Prime to China. Should Alibaba be worried?',2016-10-28T08:25:30Z
"b""Walmart is deploying an army of 'holiday helpers'""",2016-10-27T14:19:11Z
b'Groupon buys rival LivingSocial for a heavy discount',2016-10-26T21:13:46Z
b'Long live Twinkies! Hostess returning to Wall Street',2016-10-19T15:04:20Z
"b'Google and Amazon are in a race to $1,000'",2016-10-17T13:50:24Z
"b""What's behind Amazon's frantic hiring binge""",2016-10-14T20:26:34Z
"b'Rebecca Lewis, abducted Saturday, found in Memphis after manhunt'",2016-10-10T16:15:06Z
b'Is Kroger going to buy Whole Foods?',2016-10-07T15:23:17Z
b'Infant bathtub slings recalled due to drowning risk',2016-10-06T18:46:02Z
b'I survived: How many Americans feel these days',2016-10-06T14:41:40Z
"b""Startup cuts prices on feminine products to protest 'pink tax'""",2016-10-06T16:16:30Z
"b'Bottled water, batteries and booze: People prep for Hurricane Matthew'",2016-10-05T17:26:54Z
b'Is Kmart closing? Sears says no',2016-10-04T13:28:33Z
"b""Why Walmart is interested in India's biggest online retailer""",2016-09-30T13:58:59Z
"b'Walmart is making a comeback. Watch out, Amazon?'",2016-09-29T16:40:41Z
"b'To improve health, cities are changing their streetlights'",2016-09-29T09:51:07Z
"b'Working class whites blame Washington, but still want more government help'",2016-09-21T10:35:00Z
b'The truth about the white working class: A mosaic of their own',2016-09-25T11:51:37Z
b'Alabama town mirrors US class divide on immigration',2016-09-22T09:37:58Z
b'Walmart awards cash bonuses to nearly a million workers',2016-09-21T14:23:23Z
b'Stocks: 5 things to know before the open',2016-09-20T09:05:39Z
"b""Dick's Sporting Goods is America's hottest retailer""",2016-09-19T16:39:49Z
"b""Unilever looks to buy Jessica Alba's Honest Company""",2016-09-16T17:26:40Z
b'Good Samaritans risk lives to save woman from attackers',2016-09-14T13:08:14Z
b'5 things for Tuesday September 13: MH370 discovery. Campaign transparency. A sugar high.',2016-09-13T10:06:49Z
b'Walmart wants shoppers to be able to hail a cart',2016-09-12T17:41:26Z
"b'\xc2\xbfEst\xc3\xa1n UPS, FedEx y Walmart amenazados por el progreso de Amazon?'",2016-09-09T22:07:18Z
"b""This year's offensive 9/11 ads: Walmart 911 display, Twin Towers mattress sale""",2016-09-09T13:41:22Z
b'Why the fight for plus-size mannequins matters',2016-09-09T18:15:47Z
"b""Your grocery bill is cheaper. Here's why""",2016-09-09T15:52:14Z
b'Where are all the startups? U.S. entrepreneurship near 40-year low',2016-09-08T13:52:55Z
"b""ITT Tech shutdown: What's next for students""",2016-09-07T19:11:29Z
"b'VandeHei venture raises $10 million from Lerer, NBC'",2016-09-06T23:14:25Z
b'Jeff Bezos rules the world -- Amazon at all-time high',2016-09-06T16:25:48Z
b'The grocery shopping app for the 99%',2016-09-06T15:57:42Z
b'Stocks: 5 things to know before the open',2016-09-02T09:18:56Z
"b'5 things for Friday, September 2: Hurricane Hermine, Zika, Venezuela protests'",2016-09-02T10:37:34Z
"b'Walmart cuts 7,000 jobs, promises to relocate workers'",2016-09-01T21:18:53Z
b'US commercial flights take off for Cuba after more than half-century',2016-08-30T20:33:57Z
b'Signal from sun-like star likely of Earthling variety',2016-08-31T16:50:53Z
b'More Patti LaBelle desserts coming to Walmart',2016-08-26T17:03:57Z
b'Debate on whether to show up for flood misses the point',2016-08-23T17:19:48Z
"b'In Louisiana, acts of kindness flourish amid the misery'",2016-08-19T13:22:36Z
"b""Amazon's new part-time tech teams will get full-time benefits""",2016-08-18T16:42:28Z
b'Americans are shopping...at Walmart',2016-08-18T13:04:49Z
"b""What's driving Walmart's sales?""",2016-08-18T15:48:55Z
b'Parents still splurging on clothes for their kids',2016-08-18T15:34:50Z
b'Walmart deal makes overnight millionaire even richer',2016-08-18T12:24:41Z
"b""Meet Jet.com's unlikely shareholder""",2016-08-18T12:25:53Z
b'Stocks: 3 things to know before the open',2016-08-18T08:54:11Z
"b'Microsoft, Google gang up on Apple in new ads'",2016-08-17T18:45:33Z
"b'Target misses the mark, warns of weak sales ahead'",2016-08-17T12:39:40Z
b'Stocks are hot again. But are they too hot?',2016-08-16T15:33:51Z
"b'Why Google, Microsoft and Walmart are gobbling up tech companies'",2016-08-16T15:00:20Z
"b'5 things for Tuesday, August 16: Donald Trump, Gitmo, Olympics'",2016-08-16T10:25:44Z
b'Warren Buffett increases stake in Apple',2016-08-15T21:39:59Z
"b""The Whopperito: Burger King's newest food fusion""",2016-08-12T15:02:46Z
b'Walmart is selling deep-fried Twinkies',2016-08-12T14:39:44Z
b'Top Clinton State Department aide helped Clinton Foundation',2016-08-11T20:22:06Z
"b""Macy's & Co.: Who else is closing stores""",2016-08-11T19:29:49Z
"b""Macy's is closing another 100 stores""",2016-08-11T12:26:37Z
"b'Nearly 44,000 retail workers have been laid off in 2016'",2016-08-11T16:14:06Z
b'Google Ventures founder latest executive to depart Alphabet',2016-08-11T15:28:24Z
b'5 reasons why stocks may keep going higher',2016-08-11T11:09:39Z
b'Meet the guy Walmart is betting $3.3 billion on to fight Amazon',2016-08-08T19:42:09Z
b'Walmart buying Jet.com for $3.3 billion to take on Amazon',2016-08-08T13:06:07Z
b'Stocks: 4 things to know before the open',2016-08-08T09:03:57Z
b'12 national parks in 12 months',2016-08-05T05:32:14Z
"b""Why Americans aren't shopping till they drop""",2016-08-03T14:56:55Z
"b'Struggling in China, foreign firms seek to become more Chinese'",2016-08-02T07:13:03Z
b'Dogs crash into West Virginia Walmart',2016-08-03T00:26:07Z
b'NTSB: Balloon pilot may have been trying to land',2016-08-01T18:26:21Z
"b'Texas hot air balloon hit power lines before crash, NTSB says'",2016-07-31T15:17:00Z
"b'5 things for Thursday, July 28: Democratic convention, Barack Obama, Donald Trump'",2016-07-28T10:19:46Z
b'That time Walmart got offended by the idea of a female president',2016-07-27T17:47:37Z
b'This shirt once offended Walmart',2016-07-28T01:57:32Z
"b'As wages rise, CEOs are starting to complain'",2016-07-25T18:24:53Z
"b""It's always Prime Day for Amazon""",2016-07-12T14:41:40Z
b'Walmart starts cutting off Visa in Canada',2016-07-18T17:59:44Z
b'5.4 million bottles of Liquid Plumr recalled',2016-07-17T12:43:36Z
"b'Herbalife finally settles with FTC, stock soars'",2016-07-15T14:27:30Z
"b""Here's what people bought on Amazon's Prime Day""",2016-07-13T16:13:36Z
b'Amazon Prime Day powers through early snags',2016-07-11T22:42:11Z
b'Amazon Prime Day items on sale',2016-07-12T18:00:34Z
b'American workers finally getting a raise',2016-07-12T17:03:04Z
"b""It's always Prime Day for Amazon""",2016-07-12T13:46:39Z
"b'18,000 JPMorgan Chase tellers and branch workers are getting raises'",2016-07-12T12:39:16Z
"b""Here's what Walmart put on sale to compete with Amazon""",2016-07-11T12:10:36Z
"b""Here's your guide to Amazon's Prime Day""",2016-07-10T20:25:37Z
b'Jogging strollers recalled after 215 injuries reported',2016-07-07T20:09:34Z
b'Every day is Prime Day for Jeff Bezos',2016-07-07T16:37:56Z
b'Chris Rock and Tracy Morgan appear for surprise standup sets',2016-07-07T14:28:02Z
"b""A really boring stock is one of Dow's top 5""",2016-07-06T16:58:10Z
b'Clinton seizes opening as Trump alienates big business',2016-07-05T10:01:32Z
"b""Lower-income Americans getting 'digital health,' too""",2016-07-05T12:58:08Z
"b""Elizabeth Warren: Have tech companies become 'too big to fail'?""",2016-06-30T16:05:48Z
b'Walmart is giving everyone a month of free shipping',2016-06-29T12:45:49Z
"b'Brexit, shmexit! These stocks are up today'",2016-06-24T15:56:31Z
"b'2 mass shootings, 2 flags, 2 very different reactions'",2016-06-23T21:16:35Z
"b""Freed Phoenix freeway shooting suspect: 'I did not do it'""",2016-06-23T18:13:29Z
b'Art auctions: A look at the top record breakers',2015-12-22T14:23:32Z
b'Walmart buys stake in Chinese online retailer',2016-06-20T18:23:22Z
"b'Police: Armed suspect shot, killed inside Walmart'",2016-06-14T19:36:24Z
b'SWAT squad kills Amarillo Walmart worker',2016-06-14T17:01:35Z
b'Whole Foods gets warning letter from FDA',2016-06-14T18:28:08Z
b'Layoffs in aisle 4! Retailers are big job killers',2016-06-08T14:58:52Z
b'Walmart investors are smiling once again',2016-06-07T15:48:31Z
b'The best cheap investment funds',2016-06-06T16:31:48Z
"b""Walmart's Smiley is back after 10 years and a lawsuit""",2016-06-02T15:24:19Z
"b""Uncommon poise: Officer's quick action saves young hostage""",2016-06-03T13:14:44Z
b'Forget about debit cards -- here come debit rings',2016-06-02T21:07:02Z
b'Toy jewelry kit recalled for lead threat',2016-06-02T13:00:30Z
"b""Report slams Walmart for 'exploitative' conditions in Asia factories""",2016-05-31T15:47:03Z
b'Jeff Bezos is almost richer than Warren Buffett',2016-06-01T16:24:32Z
b'How Donald Trump could win',2016-05-31T09:59:31Z
b'Whole Foods bets big on urban Millennials',2016-05-24T15:17:44Z
"b""20 stocks the 'smart money' is betting against""",2016-05-23T17:34:38Z
b'U.S. problem: I work three part-time jobs',2016-05-17T18:10:14Z
b'Stocks: 6 things to know before the open',2016-05-19T09:00:44Z
"b'Many sunscreens contain lower SPF than labels claim, study finds'",2016-05-18T17:01:58Z
b'Sports Authority to close all remaining stores',2016-05-18T19:34:59Z
b'Target misses the mark',2016-05-18T12:58:56Z
"b'T.J. Maxx, Marshalls and HomeGoods plan to open thousands of new stores'",2016-05-18T12:43:35Z
"b""America's top 10 job-killing companies""",2016-05-15T13:54:14Z
"b""Save 'til you cave?""",2016-05-12T19:15:21Z
"b""Missing Tennessee girl may be 'in imminent danger'""",2016-05-10T07:43:21Z
b'Walmart sues Visa over chip debit card rules',2016-05-11T16:22:13Z
b'Walmart cuts iPhone price by $100',2016-04-01T10:29:58Z
b'Munchkin recalls pacifiers over choking hazard',2016-05-09T12:03:28Z
b'Walmart brings back its greeters',2016-05-06T11:53:49Z
b'Wheels up! Amazon is investing in airplanes',2016-05-05T16:52:20Z
"b'Without a winner, Powerball jackpot will keep climbing'",2016-05-04T11:18:41Z
"b""Why Whole Foods CEO envies Trader Joe's""",2016-05-03T14:33:13Z
b'Sports Authority bankruptcy sale could close remaining stores',2016-05-02T18:30:48Z
b'Amazon is making an amazing comeback',2016-05-02T18:39:43Z
b'Warren Buffett admires fellow billionaire Jeff Bezos',2016-04-30T16:38:03Z
b'Amazon shares soar on fourth straight profitable quarter',2016-04-28T20:36:46Z
b'How I went from middle class to homeless',2016-04-26T12:40:29Z
"b""America's part-time workforce is huge""",2016-04-25T17:25:54Z
"b'Two officers shot, suspect killed at Arizona Walmart'",2016-04-24T00:27:18Z
"b'Police: Two officers shot, suspect killed in Arizona'",2016-04-24T01:00:40Z
b'The 25 highest-paying companies of 2016',2016-04-20T11:20:10Z
b'Nordstrom slashes 400 jobs',2016-04-18T22:12:05Z
b'Going out of business: 57-year-old Sport Chalet',2016-04-16T21:13:07Z
b'Moonlighting celebrities',2013-10-25T17:20:30Z
"b'Witnesses: Scallops for the bishop, toast for the kids'",2016-04-05T14:08:23Z
"b'Disney, SeaWorld employees arrested in sex sting'",2016-04-05T21:36:41Z
b'Walmart will switch to selling cage-free eggs only',2016-04-05T23:56:13Z
"b""MIchelle Obama's 'Let's Move!' program""",2015-03-26T10:01:37Z
b'Judge shames thief with this sign',2016-03-25T17:43:40Z
b'Tracy Morgan says he contemplated suicide',2016-03-25T14:14:40Z
b'Promote diversity? You could get dinged at work',2016-03-24T19:24:19Z
b'Tyson Foods workers win $3 million in back pay',2016-03-23T19:08:07Z
"b""Ga. governor cites Jesus in signaling 'religious freedom' bill opposition""",2016-03-17T09:33:24Z
"b""Americans fear a life of 'dead-end crap jobs with crap wages'""",2016-03-16T13:00:39Z
b'Lawsuit takes aim at Mississippi state flag',2016-03-08T05:29:14Z
"b""America's B+ economy: Is this as good as it gets?""",2016-03-07T19:36:38Z
b'How the Syrian crisis came home to small-town Canada',2016-03-07T12:14:04Z
"b""Costco's entry-level workers are getting a raise""",2016-03-03T20:24:06Z
b'How Donald Trump could cause a recession',2016-03-03T17:02:54Z
b'Sports Authority is bankrupt and closing 140 stores',2016-03-02T14:29:26Z
"b""'I'm an abortion travel agent' and other tales from Texas' new desert""",2016-02-26T17:24:16Z
"b""Trump voters 'don't care about facts,' says former Apple CEO John Sculley""",2016-03-01T17:42:31Z
"b'Ukrainian man poses as Pennsylvania high school student, police say'",2016-02-25T23:58:13Z
"b'$10.10 minimum wage struck down in Birmingham, Alabama'",2016-02-27T21:19:18Z
b'Warren Buffett has some explaining to do',2016-02-26T19:50:48Z
"b""Justice Scalia's death prompts Dow Chemical to settle price-fixing case""",2016-02-26T17:32:24Z
"b""America's most hated retailer is...""",2016-02-24T20:36:30Z
"b""Sears CEO: It's 'unfair' to criticize our poor results""",2016-02-25T22:24:07Z
b'Store closings are the hottest trend in retail',2016-02-25T15:38:57Z
"b'The $100,000 job: Garbage workers'",2016-02-24T12:02:18Z
b'Walmart yanks hoverboards from its site',2016-02-24T20:23:15Z
"b""Democratic Town Hall: CNN's Reality Check Team vets the claims""",2016-02-24T02:27:10Z
"b""Take that, Donald Trump? Macy's making a comeback""",2016-02-23T16:39:16Z
b'Georgia Senate passes religious freedom bill',2016-02-22T16:19:32Z
b'Georgia Senate passes religious freedom bill',2016-02-20T01:46:02Z
b'1 million Walmart workers get a raise on Saturday',2016-02-18T17:15:32Z
b'Tough times at Walmart',2016-02-18T15:02:24Z
b'Stocks: 5 things to know before the open',2016-02-18T09:57:47Z
b'Senate passes bill to ban slavery imports',2016-02-12T18:18:16Z
b'The bulls are back? Stocks surge again',2016-02-16T19:02:06Z
"b""'Fight for $15' protesters at Republican debate: 'We can't afford essentials.'""",2016-02-13T17:13:36Z
b'Deaths of two girls at Arizona high school believed murder-suicide',2016-02-12T16:05:23Z
b'Is the worst finally over for Whole Foods?',2016-02-10T19:01:03Z
"b""'Fight for $15' protest planned for Democratic debate""",2016-02-10T21:03:17Z
b'Sports Authority faces possible bankruptcy',2016-02-09T21:17:25Z
b'Global currency collapse: Winners and losers',2016-02-08T12:27:57Z
"b""'Quantico' actress takes red-carpet stand against Mississippi state flag""",2016-02-06T18:01:52Z
b'Kitchenware brands slammed by China labor watchdog',2016-02-05T04:02:51Z
b'Job cuts soar 218% in January',2016-02-04T16:15:15Z
"b""Tesla's worst nightmare ... cheap gas""",2016-02-03T15:01:04Z
b'5 things to watch in the Democratic town hall',2016-02-03T11:22:53Z
"b'Kevin Roper, trucker in Tracy Morgan crash, pleads not guilty'",2016-02-02T00:09:54Z
"b""Watch out 'Patti Pies': Aretha Franklin launching her own desserts""",2016-01-29T13:52:24Z
b'White Castle switching to cage-free eggs',2016-01-29T17:19:48Z
b'Pentagon sets maternity leave at 12 weeks',2016-01-28T22:55:06Z
b'Amazon shares plummet as profit disappoints',2016-01-28T13:55:42Z
b'Detroit Pistons owner to raise $10 million for Flint water crisis',2016-01-28T18:29:43Z
b'Is Mark Zuckerberg the best CEO in America?',2016-01-28T17:58:56Z
"b""New York Times could have prevented 'suffering' in Flint, public editor says""",2016-01-27T22:35:27Z
b'Everything must go! 75% off at closing Walmart stores',2016-01-27T17:40:00Z
b'Deals draw crowds to closing Walmart',2016-01-27T19:29:42Z
b'Whole Foods shoppers say its food not worth the price',2016-01-26T16:20:05Z
b'Walmart and partners donating 6.5 million bottles of water to Flint schools',2016-01-26T12:03:33Z
b'Closing Walmart stores slash prices by 50%',2016-01-22T23:17:49Z
b'Walmart found to have fired striking workers unlawfully',2016-01-22T00:37:46Z
b'Walmart breaks deal to build stores in working-class D.C. district',2016-01-21T21:44:37Z
b'How to make your kid hate sports without really trying',2016-01-21T12:55:20Z
"b""Walmart increasing wages; union says it's all show""",2016-01-20T22:47:43Z
b'Big TV deals ahead of the Super Bowl',2016-01-20T13:39:23Z
"b""Here's the list of U.S. Walmart stores to close""",2016-01-15T20:06:09Z
"b'Walmart will close 269 stores this year, affecting 16,000 workers'",2016-01-15T14:41:03Z
b'Biggest lottery jackpots in U.S. history',2016-01-06T10:37:37Z
b'How Rams owner beat NFL old guard in move back to LA',2016-01-13T17:56:35Z
b'Church uses wealth to curb gun access',2016-01-08T21:51:55Z
b'More bad news for Gap: Old Navy sales plunge',2016-01-08T13:20:05Z
b'The only stock in the Dow up this week is ...',2016-01-07T19:51:13Z
b'Mississippi councilman says throw rocks at police chasing petty crooks in Jackson',2016-01-02T11:12:27Z
"b""Feds: New York man was planning ISIS attack on New Year's Eve""",2015-12-31T17:28:26Z
b'Puerto Rico will default AGAIN',2015-12-30T18:02:14Z
b'Texas businesses prep for new open carry gun law',2015-12-28T22:39:31Z
