b'Best Buy launches a new $200 membership program to fight Amazon',2021-04-07T19:36:08Z
"b'The best sales to shop today: Samsung, Eight Sleep, Madewell and more'",2021-04-07T15:18:41Z
"b""Looking for an Xbox Series X? Here's how to have the best shot""",2021-03-25T17:30:12Z
"b""Finding the PS5 is a nightmare \xe2\x80\x94 here's how to actually have a chance""",2021-03-09T19:28:26Z
"b'The best sales to shop today: Apple Watch, Reebok, Cosori and more'",2021-04-06T15:12:57Z
b'Read these tips before getting your Covid-19 vaccine',2021-04-03T07:03:48Z
b'Amazon is on edge over Alabama union vote',2021-04-04T14:08:26Z
"b""There's a new approach to police response to mental health emergencies. Taking the police out of it""",2021-04-03T00:24:00Z
b'These are our favorite store credit cards for 2021',2021-04-01T20:16:03Z
"b'The best sales to shop today: Dyson, Ring, Samsung and more'",2021-04-01T15:29:46Z
b'Jobs in these industries are already back to pre-pandemic levels',2021-04-01T13:57:49Z
b'Huggies diapers and Scott toilet paper may soon get more expensive',2021-03-31T16:52:33Z
"b'The best sales to shop today: Jabra, Case-Mate, Roomba and more'",2021-03-31T15:12:07Z
b'GameStop raids Amazon for another heavy-hitter exec',2021-03-30T18:07:26Z
"b'The best sales to shop today: Mac Mini, Arlo, Old Navy and more'",2021-03-30T15:34:06Z
"b""Toxic chemical 'Hall of Shame' calls out major retailers for failing to act""",2021-03-30T04:04:30Z
"b""Here's what could happen next as milestone Amazon union vote ends""",2021-03-26T12:16:49Z
"b'The best sales to shop today: Dyson, Nordstrom, Burrow and more'",2021-03-29T15:32:07Z
b'Nashville declares emergency after deadly flash flooding',2021-03-28T07:31:26Z
b'A quiet home and a lost wedding ring: How a mass shooting upended this family',2021-03-26T19:03:24Z
"b""The best sales to shop this weekend: Adidas, Macy's, Instant Pot and more""",2021-03-26T15:49:39Z
"b""Police still don't know why a gunman killed 12 people in Virginia Beach in 2019, a new report says""",2021-03-25T15:49:07Z
b'Mass Shootings in the US Fast Facts',2019-08-20T01:12:18Z
"b'The best sales to shop today: Overstock, Athleta, Google Nest and more'",2021-03-23T15:30:41Z
b'Amazon was supposed to kill Instacart. Instead Instacart became a mini-Amazon',2021-03-23T11:57:27Z
b'Why anti-Asian American violence is rising -- along with White supremacist propaganda',2021-03-18T01:11:17Z
b'Stocks bounce higher after Fed holds off on rate hikes',2021-03-16T12:58:22.673Z
"b""Amazon's grocery chain is growing. It isn't Whole Foods""",2021-03-17T18:43:27Z
b'Opioid Crisis Fast Facts',2017-09-18T16:27:25Z
b'The new Nest Hub is here \xe2\x80\x94 and it can track your sleep',2021-03-16T13:02:37Z
b'Retail sales slid in February as people shopped less',2021-03-16T12:41:53Z
"b'Rosalind Brewer officially takes the helm at Walgreens, becoming the only Black woman Fortune 500 CEO'",2021-03-15T13:04:42Z
"b""Jerome Powell can't take his eyes off the job market""",2021-03-14T13:08:31Z
b'CVS expands Covid-19 vaccine to 12 more states',2021-03-11T16:34:16Z
b'Why small grocery stores are (still) out of toilet paper',2021-03-10T16:40:58Z
"b""The Lip Bar's vegan, WFH-friendly products are now available at Walmart""",2021-03-09T18:03:08Z
b'Walmart adds more Beyond Meat products',2021-03-09T17:16:18Z
b'The role of an unexpected savior is not new to Tyler Perry',2021-03-08T18:34:01Z
"b""'Consider chemical hazards' in the baby foods you sell, FDA warns manufacturers""",2021-03-05T19:33:40Z
"b""Beto O'Rourke is criss-crossing Texas, igniting Democratic hopes he'll run for governor""",2021-03-05T18:55:47Z
"b'The best sales to shop this weekend: Overstock, Columbia, Converse and more'",2021-03-05T17:30:36Z
"b""Grocery stores' pandemic boom is over""",2021-03-04T17:58:40Z
"b'The best sales to shop today: Dyson, Apt2B, Under Armour and more'",2021-03-04T17:35:49Z
"b'The best sales to shop today: GameStop, Bose headphones, Baublebar and more'",2021-03-03T16:59:57Z
"b""The best sales to shop today: iPads, Rothy's, Rifle Paper Co. and more""",2021-03-02T17:21:17Z
"b""Target saw more sales growth in 2020 than the last 11 years combined. Here's why""",2021-03-02T12:52:49Z
b'Everything you need to know about the debate over the $15 minimum wage',2021-02-22T12:01:38Z
"b'Costco raises its minimum wage above rivals like Amazon, Target and Best Buy'",2021-02-25T15:37:19Z
"b'When a woman lost her wallet in a store, a good Samaritan drove to her home to return it'",2021-02-24T17:23:23Z
b'Security cam footage shows man return lost wallet',2021-02-25T13:38:47Z
b'Instacart is moving beyond the grocery store',2021-02-23T18:26:08Z
"b""Macy's made money for the first time in the pandemic""",2021-02-23T14:17:46Z
b'Our mask-wearing road trip across a battered America',2021-02-20T14:24:04Z
"b""One week into distribution, pharmacies have a familiar request: 'We just need more vaccines'""",2021-02-19T11:59:54Z
b'5 questions that need answers at the GameStop hearing',2021-02-18T13:03:46Z
b'Biden administration looks to FEMA to help combat domestic terrorism in wake of Capitol attack',2021-02-18T18:01:14Z
"b""Grocery store workers have been on the front lines for a year, but they're struggling to get the Covid vaccine""",2021-02-18T13:37:23Z
"b""Walmart just boosted pay to $15. It's not what you think""",2021-02-18T13:21:33Z
b'Millions are still without power as winter storms continue',2021-02-17T13:08:23.218Z
b'Winter storm continues to hammer businesses',2021-02-17T23:43:33Z
b'Wall Street hits the enthusiasm pause button',2021-02-16T18:38:09.056Z
b'US retail sales jump 5.3% in January',2021-02-17T13:38:31Z
b'Want solid returns you can depend on? Here are stocks we love',2021-02-14T15:10:22Z
"b""'We don't see a clear exit strategy.' The travel industry is still getting crushed""",2021-02-14T13:53:02Z
b'February 10 coronavirus news',2021-02-10T00:17:45.798Z
"b""A Kansas grandfather got Covid-19 in July. He's still in the hospital 7 months later""",2021-02-14T18:57:33Z
"b""You'll love to shop all these sweet Valentine's Day deals""",2021-02-14T13:36:40Z
b'Pharmacies start administering their first 1 million Covid-19 vaccine doses from federal government',2021-02-12T08:21:20Z
"b'Small triumphs, some glitches as nationwide Covid-19 vaccine pharmacy program takes off'",2021-02-13T04:52:02Z
b'Vaccines -- despite variants -- are still good news',2021-02-12T12:07:38Z
b'This is one of the fastest growing jobs at Walmart',2021-02-12T15:24:24Z
b'What you need to know before making a vaccine appointment at your pharmacy',2021-02-04T23:41:18Z
"b""You'll love to shop all these sweet Valentine's Day deals""",2021-02-09T14:37:18Z
b'Walmart promises to honor vaccine appointments after its website mistakenly allows some to register in Florida',2021-02-12T07:43:52Z
"b'Biden administration seeks a pause on TikTok, WeChat court fights'",2021-02-11T14:44:27Z
"b""Colin Kaepernick gets in on Wall Street's hottest trend""",2021-02-11T04:31:16Z
"b""More Americans say they're willing to take a Covid-19 vaccine, but supply issues remain""",2021-02-10T07:43:39Z
b'Aldi plans to open 100 new US stores this year',2021-02-10T17:42:33Z
"b'A hug, a fishing trip, the symphony: Seniors long for simple pleasures after 2nd dose of Covid vaccine'",2021-02-10T13:50:49Z
"b""Amazon's plans for India take a hit as court battle swings in rival's favor""",2021-02-09T11:13:28Z
"b""A $15 minimum wage would hurt those it's meant to help""",2021-02-09T13:28:24Z
"b""The coronavirus pandemic is still going strong. But there's hope on the horizon""",2021-02-08T11:53:50Z
"b""'Definitely getting better': The United States is making vaccine progress on several fronts, and experts are encouraged""",2021-02-05T08:13:22Z
"b'Leading baby food manufacturers knowingly sold products with high levels of toxic metals, a congressional investigation found'",2021-02-04T18:18:15Z
"b'The best sales to shop this weekend: Apple TV 4K, Ring, Roomba and more'",2021-02-05T17:12:58Z
b'Rosa Flores',2014-12-22T20:23:53Z
b'Stream and save with a rare deal on Apple TV 4K',2020-02-20T19:23:51Z
"b'5 things to know for February 5: Covid-19, Congress, Smartmatic, Yemen, Hong Kong'",2021-02-05T11:17:18Z
"b'The best sales to shop today: Gravity Blankets, Dyson, MacBook Pro and more'",2021-02-04T16:25:32Z
b'One of our favorite cold brew makers is on sale at Walmart',2021-01-08T15:27:10Z
"b""Analysis: Bezos leaves behind a company that's created value but has also triggered a national reckoning""",2021-02-04T12:53:34Z
b'February 3 coronavirus news',2021-02-02T17:50:07.560Z
b'These cities want to give grocery store workers hazard pay',2021-02-03T17:22:02Z
"b""Amazon gets court to block $3.3 billion retail deal involving India's richest man""",2021-02-03T02:13:56Z
"b""Prep for Sunday's big game with deals on TVs, soundbars and more""",2021-02-02T16:46:25Z
b'Principal works overnight shifts at Walmart to help low-income students',2021-02-02T00:27:13Z
"b""'They're my children': Hear what this principal does to help his low-income students""",2021-02-02T00:11:56Z
"b""Here's what really happens to the items you return online""",2021-01-30T15:34:52Z
"b""On a budget? Here's how to save money on your groceries""",2021-01-28T18:59:51Z
b'Where does the GameStop mania end?',2021-01-28T13:09:14Z
b'January 27 coronavirus news',2021-01-26T19:35:59.772Z
b'Walgreens taps Starbucks executive Rosalind Brewer to be its CEO',2021-01-27T01:02:47Z
"b""Walmart's latest strategy to get your stuff to you faster""",2021-01-27T05:02:47Z
"b'5 things to know for January 27: Covid-19, White House, Capitol riot, Italy, Newark'",2021-01-27T11:16:38Z
b'What the Biden administration means for the future of Silicon Valley',2021-01-26T12:20:58Z
"b""The best sales to shop today: Macy's, Sony, Levi's and more""",2021-01-26T15:55:22Z
b'Google Maps will soon display Covid-19 vaccination sites',2021-01-25T10:26:36Z
b'Walmart will expand Covid-19 vaccinations to more states',2021-01-22T17:34:54Z
b'Ed Meagher',2020-03-24T15:18:00Z
b'Costco is (finally) testing out curbside pickup for groceries',2021-01-21T15:57:57Z
b'Divisive policies and actions from Trump-era that Biden could decide to alter',2021-01-21T05:50:05Z
b'Michelle Obama Fast Facts',2012-12-26T20:26:31Z
"b""Joe Biden wants to avoid the Obama era's biggest economic mistake. Congress may not let him""",2021-01-20T12:38:06Z
"b""It's Inauguration Eve, and Wall Street is feeling good""",2021-01-20T01:01:19Z
b'Facebook Fast Facts',2014-02-11T16:34:57Z
"b""Walmart CEO blames 'fiction' of fraudulent election for dividing Americans""",2021-01-19T18:31:08Z
"b""French politics kills Canadian bid to create one of the world's top supermarket groups""",2021-01-18T14:32:08Z
b'The online shopping exec Walmart hired to take on Amazon is leaving',2021-01-15T16:51:37Z
"b""Circle K's owner offers $20 billion for France's biggest retailer""",2021-01-13T16:50:31Z
b'Stocks hold steady ahead of impeachment vote',2021-01-12T14:38:55.278Z
b'Corporate America halts donations to Republicans who voted to overturn the election',2021-01-10T20:18:53Z
b'Staples offers to buy Office Depot for $2.1 billion',2021-01-11T14:30:03Z
b'Corporate America pulls the plug on President Trump',2021-01-11T13:01:28Z
"b'The best sales to shop this weekend: Best Buy, Dyson, Sur La Table and more'",2021-01-08T17:37:33Z
b'These are our favorite store credit cards for 2021',2020-12-14T22:16:07Z
"b'The best sales to shop today: Target, Kate Spade, Aerogarden and more'",2021-01-07T15:58:39Z
"b""She was promoted just in time to lead TikTok through a 'Category 5 storm'""",2021-01-04T12:21:40Z
b'Make sure you have the best credit card when you shop at Amazon',2020-12-23T19:51:28Z
"b'Start your week smart: Congress, Senate, Ahmaud Arbery, Walmart shooting, vaccine'",2021-01-03T14:43:19Z
"b""Walmart shooting suspect in custody in Virginia after allegedly wounding 3 people, including a sheriff's deputy""",2021-01-03T05:36:03Z
"b""Start 2021 off strong with savings from these New Year's sales""",2020-12-31T13:59:37Z
b'21 things to look forward to in 2021 ... if everything works out',2021-01-01T02:26:24Z
b'El Paso teacher whose video of students hugging became a national sensation dies from Covid-19',2020-12-31T22:16:11Z
b'Dow and S&P 500 end 2020 at record highs',2020-12-31T14:36:56Z
b'Keep the holiday spirit alive with savings from these after-Christmas sales',2020-12-26T13:00:17Z
b'These businesses were the surprise winners of 2020',2020-12-30T12:14:16Z
b'Trump administration appeals court order blocking TikTok restrictions',2020-12-29T02:10:34Z
"b""What the #)$*#@)($ is happening with Bitcoin's insane record run?""",2020-12-27T16:37:13Z
b'December 26 coronavirus news',2020-12-16T20:58:02.694Z
b'The latest on the coronavirus pandemic and vaccines',2020-12-24T01:04:55.328Z
b'Their communities are deserted by pharmacies. Advocates fear this will lead to inequitable vaccine access',2020-12-24T13:42:00Z
b'Tight on cash? These credit cards charge 0% interest on purchases',2020-12-23T16:22:33Z
b'3 things that could steal Christmas for Wall Street',2020-12-23T12:34:46Z
"b'5 things to know for December 23: Stimulus, pardons, coronavirus, Israel, Walmart'",2020-12-23T11:35:16Z
"b'Walmart contributed to the prescription opioid crisis for years, breaking the law, the Justice Department alleges'",2020-12-22T22:49:40Z
b'Walmart is attempting to solve one of the biggest pain-points of online shopping',2020-12-21T12:29:42Z
b'Retailers brace for a rush of last-minute shopping this weekend',2020-12-18T15:35:18Z
"b'Gift cards for Starbucks, Netflix and more can save the day this holiday season'",2020-12-17T16:57:25Z
b'December 16 coronavirus news',2020-12-15T17:27:13.468Z
b'Protect your holiday gifts from theft or damage with these credit cards',2020-12-16T23:32:09Z
b'Major CEOs signal Covid vaccine mandates could be on the way',2020-12-16T18:22:25Z
"b""See Walmart's self-driving delivery trucks in action""",2020-12-16T17:43:37Z
b'The robots are coming ... to make our lives easier',2020-11-03T08:56:39Z
b'December 14 coronavirus news',2020-12-13T13:31:21.194Z
b'Chase Freedom Flex credit card bonus categories revealed for 1st quarter of 2021',2020-06-15T21:04:45Z
b'22 ugly Christmas sweaters for your holiday Zoom parties',2020-12-09T15:03:54Z
b'Oracle is moving its headquarters to Austin',2020-12-11T23:22:54Z
"b'What you need to know about coronavirus on Friday, December 11'",2020-12-11T13:11:20Z
b'Vaccines on horizon as virus surges through Trump country. And the political debate is as heated as ever',2020-12-10T21:54:30Z
b'How Cholula plans to get more Americans hooked on its hot sauce',2020-11-25T18:08:35Z
b'Tight on cash? These credit cards charge 0% interest on purchases',2020-09-08T21:57:13Z
b'Last chance to activate the rotating bonus categories on the Chase Freedom Flex credit card',2020-09-09T21:30:16Z
"b""You don't need a PS5 or Xbox Series X right now \xe2\x80\x94 here's why""",2020-12-09T18:59:55Z
"b'Online grocery shopping is growing, but millions of Americans on food stamps are being left behind'",2020-12-07T16:44:56Z
"b""US government won't extend the deadline for a TikTok deal, but negotiations continue""",2020-12-05T01:15:27Z
b'Here we go again: The US could start losing jobs very soon',2020-12-04T15:46:19Z
"b'5 things to know for December 4: Coronavirus, White House, economy, Iran, Rohingya'",2020-12-04T11:18:17Z
b'The economy is screaming out for help. Washington needs to listen',2020-12-03T19:06:33Z
"b""Walmart is paying its workers $388 million in holiday bonuses. Critics say it's not nearly enough""",2020-12-03T17:24:35Z
b'200+ Cyber Week sales you can still shop today',2020-12-01T14:35:40Z
b'Dalila-Johari Paul',2020-11-30T22:02:45Z
"b'5 things to know for December 2: Covid-19, pardon probe, economy, China, Brazil'",2020-12-02T11:32:08Z
b'Walmart scraps shipping minimum for subscription service in move to take on Amazon',2020-12-02T05:02:09Z
b'The best tips and strategies to make sure your online orders arrive in time for the holidays',2020-11-13T18:31:20Z
"b""Big Tech's stock market reign may finally be about to end""",2020-12-01T20:09:39Z
b'The 10 best credit cards of December 2020',2020-08-04T19:59:44Z
b'How pharmacies are preparing to give Americans Covid-19 vaccines',2020-12-01T15:34:56Z
b'450+ Cyber Monday sales you can shop right now',2020-11-30T08:00:13Z
"b""Walmart's best Cyber Monday 2020 deals""",2020-11-30T13:24:25Z
"b""Corporate America gave this non-profit almost $2 billion to fight institutional racism and it's already making an impact""",2020-11-27T18:28:13Z
b'The best Cyber Monday Chromebook deals right now',2020-11-30T16:48:21Z
"b'As JCPenney exits bankruptcy, its long-term outlook remains grim'",2020-11-30T19:25:44Z
b'400+ early Cyber Monday deals you can shop now',2020-11-29T11:02:41Z
"b""Shop Walmart's best Cyber Monday 2020 deals right now""",2020-11-29T20:49:28Z
b'All the best Cyber Monday appliance sales',2020-11-29T18:25:12Z
"b'The best Cyber Monday deals on Dyson, Roomba and more'",2020-11-29T16:22:36Z
"b'The best Cyber Monday deals on Dyson, Roomba and more'",2020-11-25T15:45:12Z
b'Shop 350+ Black Friday sales that are still live today',2020-11-28T12:58:42Z
b'400+ Black Friday sales you can shop right now',2020-11-27T08:00:45Z
b'November 27 coronavirus news',2020-11-25T16:59:40.332Z
"b""Cyber Monday 2020 is a few days away \xe2\x80\x94 here's what you need to know""",2020-11-27T15:50:04Z
b'It started in her kitchen. Now her products sell at Target and Walmart',2020-11-27T19:16:30Z
b'Black Friday is different this year. But all is not lost for retailers',2020-11-27T12:59:42Z
"b""Shop Walmart's best Black Friday 2020 deals right now""",2020-11-27T10:32:47Z
b'350+ Black Friday sales you can shop right now',2020-11-26T12:00:15Z
b'TikTok owner gets another week to sell its US business',2020-11-26T20:06:07Z
"b""Shop Walmart's best Black Friday 2020 deals right now""",2020-11-26T00:00:18Z
"b'Walmart is restocking the PlayStation 5, Xbox Series S and Series X tonight'",2020-11-25T23:53:56Z
b'300+ Black Friday sales you can shop right now',2020-11-25T12:00:22Z
b'Nearly 1 million Sunbeam Crock-Pots recalled for burn risks',2020-11-24T22:18:47Z
b'Cash is king: The best cash back credit cards for 2020',2020-09-23T20:07:10Z
b'200+ Black Friday sales you can shop right now',2020-11-24T10:53:26Z
"b'From OLEDs to UHDs, these are the best TV deals to shop this Black Friday'",2020-11-24T15:00:25Z
"b""A horrific school shooting was the last straw for the CEO of Dick's Sporting Goods""",2019-03-10T15:06:11Z
"b""Janet Yellen's first battle is already taking shape""",2020-11-24T13:20:41Z
b'Corporate America is ready for a Biden presidency',2020-11-23T18:52:19Z
b'All the best Black Friday appliance sales',2020-11-23T17:40:34Z
b'150+ Black Friday sales you can shop right now',2020-11-23T12:01:39Z
"b'Walmart, Albertsons, Kroger and Whole Foods are adding sneeze guards to checkout lanes'",2020-03-25T13:07:11Z
"b""Cyber Monday 2020 is one week away \xe2\x80\x94 here's what you need to know""",2020-11-23T12:33:12Z
b'More retailers are closed on Thanksgiving this year',2020-11-22T13:59:29Z
"b'As Black Friday approaches, retailers lobby states to stay open'",2020-11-21T19:43:49Z
b'How to make your Thanksgiving meal for cheap or (practically) free',2020-11-21T16:19:19Z
b'Black Friday 2020: Everything you need to know',2020-11-20T14:30:19Z
b'Tofurkys are selling like hotcakes',2020-11-20T20:25:53Z
b'Working from home is a boost for a...desktop phone company?',2020-11-19T17:27:35Z
"b'The best sales to shop today: Apple, Under Armour, Roomba and more'",2020-11-19T15:33:01Z
b'Are you using the best credit card when ordering food for delivery?',2020-04-09T22:15:34Z
b'Forget chocolate: 2020 is the year of boozy Advent calendars',2020-11-19T14:45:20Z
b'Google and Wyclef Jean team up to help Black-owned businesses get through the holidays',2020-11-19T14:03:56Z
b'A Dutch grocery giant is buying FreshDirect',2020-11-19T00:13:49Z
"b""Sam's Club offers a quick, contact-free, curbside shopping experience at wholesale prices""",2020-11-18T17:51:16Z
"b""Target had a blowout quarter, but that's not the full story""",2020-11-18T17:23:58Z
"b""Will shoppers sit out the holidays? That's the fear""",2020-11-18T12:59:34Z
"b""Walmart's Black Friday Deals for Days sale is back with even more bargains""",2020-11-12T00:01:00Z
b'Walmart reports shortages of toilet paper and cleaning supplies at some stores',2020-11-17T17:38:24Z
b'Amazon is now a drug store. It will ship prescriptions to Prime members',2020-11-17T12:27:35Z
b'Elon Musk is now an A-lister on Wall Street',2020-11-17T12:35:38Z
"b""Small toy stores are worried they won't stay in business after this year""",2020-11-14T16:05:54Z
"b""Cyber Monday 2020 is coming soon \xe2\x80\x94 here's what you need to know""",2020-11-16T14:25:13Z
"b""Vaccine news is great. It won't help the economy much this winter""",2020-11-16T13:21:52Z
b'Cinnabon is selling its frosting by the pint',2020-11-16T13:04:21Z
"b'What you need to know about coronavirus on Monday, November 16'",2020-11-16T12:27:00Z
b'Walmart retreats from Japan by selling most of its stake in Seiyu supermarkets',2020-11-16T10:41:04Z
b'Walmart will start counting customers again as coronavirus cases reach record levels',2020-11-15T20:03:19Z
b'A wall of money is ready for the post-pandemic economy',2020-11-15T13:53:23Z
"b""Missouri police believe 5-year-old was injured in 'rolling' shootout""",2020-11-14T14:15:44Z
b'Are you using the best credit card for your holiday shopping?',2020-11-13T18:33:27Z
b'TikTok granted two more weeks to reach a deal for US business',2020-11-13T17:43:42Z
b'Food delivery giant DoorDash files paperwork to go public',2020-11-13T14:34:56Z
"b""Black Friday 2020 is coming soon \xe2\x80\x94 here's what you need to know""",2020-11-13T15:48:54Z
b'November 12 coronavirus news',2020-11-12T04:12:17.235Z
b'Shoppers trying to buy new PS5 report glitches on Walmart and Best Buy websites',2020-11-12T21:57:09Z
"b'The best sales to shop today: Adidas, Instant Pot, Roomba and more'",2020-11-12T15:38:47Z
"b'The Playstation 5, Xbox Series X and Xbox Series S are out, which one is right for you?'",2020-11-10T22:16:46Z
"b""Trump blew up TikTok and now nobody knows what's going on""",2020-11-11T23:18:31Z
"b""Exclusive: Elizabeth Warren calls out CEOs for 'weak and meaningless' climate commitments""",2020-11-11T17:40:59Z
b'TikTok asks court to step in as sale deadline looms',2020-11-11T04:48:26Z
b'Lower your expenses by getting one of these credit cards with no annual fee',2020-11-10T22:07:01Z
"b'The best sales to shop today: Aerogarden, Puma, Le Creuset and more'",2020-11-10T16:11:09Z
"b""Big Tech shouldn't breathe a sigh of relief over Biden""",2020-11-10T14:26:53Z
b'How to choose the best Chase credit cards for cash back and travel rewards',2020-10-23T20:53:57Z
"b""Cyber Monday 2020 is coming soon \xe2\x80\x94 here's what you need to know""",2020-11-09T13:08:14Z
b'This is the Rite Aid of the future',2020-11-09T13:07:00Z
"b'In 16 minutes, Dave Chappelle beautifully, incisively summed up all of 2020 -- and sometimes it hurt'",2020-11-08T13:41:09Z
b'Joe Biden elected president',2020-11-07T00:44:55.298Z
b'Van Jones: Now we can breathe',2020-11-07T21:21:21Z
"b""TikTok exec says she 'misspoke' in hearing about the app censoring Xinjiang content""",2020-11-06T15:25:09Z
"b""Black Friday 2020 is coming soon \xe2\x80\x94 here's what you need to know""",2020-11-06T13:49:13Z
"b""Sainsbury's is closing its deli counters as shopping goes online and local""",2020-11-05T15:22:24Z
"b""Walmart's Black Friday 'Deals for Days' event features some truly incredible bargains""",2020-11-05T13:21:49Z
b'El Paso is facing its worst Covid-19 outbreak while trying to vote on Election Day',2020-11-04T01:28:55Z
"b'Earn bonus points at Amazon, Walmart and Target with Marriott credit cards'",2020-11-02T21:56:04Z
"b""Cyber Monday 2020 is coming soon \xe2\x80\x94 here's what you need to know""",2020-11-02T14:02:13Z
b'Walmart returns firearms and ammunition to store floors',2020-11-01T22:35:03Z
"b""'SNL' has Jim Carrey's Joe Biden read a spooky Halloween story about the election""",2020-11-01T04:15:59Z
b'Costco drops Chaokoh coconut milk over allegations of forced monkey labor',2020-10-31T17:59:03Z
"b""Here's how stores are changing Black Friday for the pandemic""",2020-10-31T13:07:51Z
b'Which iPad is right for you? We break it down',2020-10-30T21:40:20Z
"b""Black Friday 2020 is coming soon \xe2\x80\x94 here's what you need to know""",2020-10-30T13:00:59Z
b'Gun stocks fall after Walmart removes firearms and ammo from some stores',2020-10-30T16:19:32Z
"b""Celebrate the second season premiere of 'The Mandalorian' with brand-new merch""",2020-10-30T13:52:04Z
b'Walmart removes guns and ammo from shelves in some stores in response to Philadelphia protests',2020-10-29T22:35:16Z
"b'5 things to know for October 30: Covid-19, election, police violence protests, France, Senegal'",2020-10-30T10:37:26Z
b'Why Amazon and Reliance are clashing in India over a cash-strapped retail chain',2020-10-29T15:50:46Z
"b""Atlas push to 'slow the testing down' tracks with dramatic decline in one key state""",2020-10-29T10:06:33Z
b'Philadelphia puts curfew in place after violence erupts during protests over the fatal police shooting of Walter Wallace Jr.',2020-10-28T07:01:25Z
